GO.ID	term	definition	Oral_elim.genes_frequency	Oral_elim.pvalue	Oral_elim.-log10_pvalue	Oral_elim.Significant_genes	Oral_elim.Significant_genes_symbol
"GO:0009208"	"pyrimidine ribonucleoside triphosphate metabolic process"	"The chemical reactions and pathways involving pyrimidine ribonucleoside triphosphate, a compound consisting of a pyrimidine base linked to a ribose sugar esterified with triphosphate on the sugar."	"36.364% (4/11)"	0.006788097	2.17	"Pocillopora_acuta_HIv2___RNAseq.g11840.t1;Pocillopora_acuta_HIv2___RNAseq.g21884.t1;Pocillopora_acuta_HIv2___RNAseq.g3911.t1;Pocillopora_acuta_HIv2___TS.g19040.t1"	"CTP synthase 1 (EC 6.3.4.2) (CTP synthetase 1) (UTP--ammonia ligase 1);Ectonucleoside triphosphate diphosphohydrolase 4 (NTPDase 4) (EC 3.6.1.15) (EC 3.6.1.6) (Golgi UDPase) (Lysosomal apyrase-like protein of 70 kDa) (Uridine-diphosphatase) (UDPase) (EC 3.6.1.42);Nucleoside diphosphate kinase homolog 5 (3'-5' exonuclease NME5) (EC 3.1.-.-);GTP:AMP phosphotransferase AK3, mitochondrial (EC 2.7.4.10) (Adenylate kinase 3) (Adenylate kinase 3 alpha-like 1) (Adenylate kinase isozyme 3)"
"GO:1901607"	"alpha-amino acid biosynthetic process"	NA	"16.867% (14/83)"	0.00328135	2.48	"Pocillopora_acuta_HIv2___RNAseq.g10854.t2;Pocillopora_acuta_HIv2___RNAseq.g12417.t1;Pocillopora_acuta_HIv2___RNAseq.g1504.t1;Pocillopora_acuta_HIv2___RNAseq.g16699.t1;Pocillopora_acuta_HIv2___RNAseq.g19367.t1;Pocillopora_acuta_HIv2___RNAseq.g23634.t1;Pocillopora_acuta_HIv2___RNAseq.g24790.t1;Pocillopora_acuta_HIv2___RNAseq.g27978.t1;Pocillopora_acuta_HIv2___RNAseq.g28641.t1;Pocillopora_acuta_HIv2___RNAseq.g7498.t1;Pocillopora_acuta_HIv2___TS.g19253.t1;Pocillopora_acuta_HIv2___TS.g3401.t1;Pocillopora_acuta_HIv2___TS.g6241.t1e;Pocillopora_acuta_HIv2___TS.g7609.t1b"	"Phenylalanine-4-hydroxylase (PAH) (EC 1.14.16.1) (Phe-4-monooxygenase);Cystathionine gamma-lyase (CGL) (CSE) (EC 4.4.1.1) (Cysteine desulfhydrase) (Cysteine-protein sulfhydrase) (Gamma-cystathionase) (Homocysteine desulfhydrase) (EC 4.4.1.2);L-threonine ammonia-lyase (EC 4.3.1.19) (L-serine ammonia-lyase) (EC 4.3.1.17) (Threonine dehydratase);Glutathione hydrolase 1 proenzyme (EC 3.4.19.13) (Gamma-glutamyltransferase 1) (Gamma-glutamyltranspeptidase 1) (GGT 1) (EC 2.3.2.2) (Leukotriene-C4 hydrolase) (EC 3.4.19.14) (CD antigen CD224) [Cleaved into: Glutathione hydrolase 1 heavy chain; Glutathione hydrolase 1 light chain];Methylenetetrahydrofolate reductase (NADPH) (EC 1.5.1.53);Acireductone dioxygenase (Acireductone dioxygenase (Fe(2+)-requiring)) (ARD') (Fe-ARD) (EC 1.13.11.54) (Acireductone dioxygenase (Ni(2+)-requiring)) (ARD) (Ni-ARD) (EC 1.13.11.53);Death domain-containing ATP nucleosidase (DDAN) (EC 3.5.99.-);Plasma membrane calcium-transporting ATPase 4 (PMCA4) (EC 7.2.2.10) (Matrix-remodeling-associated protein 1) (Plasma membrane calcium ATPase isoform 4) (Plasma membrane calcium pump isoform 4);Protein TabA;Branched-chain-amino-acid aminotransferase (EC 2.6.1.42);Delta-1-pyrroline-5-carboxylate synthase (P5CS) (Aldehyde dehydrogenase family 18 member A1) [Includes: Glutamate 5-kinase (GK) (EC 2.7.2.11) (Gamma-glutamyl kinase); Gamma-glutamyl phosphate reductase (GPR) (EC 1.2.1.41) (Glutamate-5-semialdehyde dehydrogenase) (Glutamyl-gamma-semialdehyde dehydrogenase)];Asparagine synthetase domain-containing protein 1;Glutamate dehydrogenase (GDH) (EC 1.4.1.3) (NAD(P)H-utilizing glutamate dehydrogenase);Phosphoserine phosphatase (PSP) (PSPase) (EC 3.1.3.3) (O-phosphoserine phosphohydrolase)"
"GO:0008594"	"photoreceptor cell morphogenesis"	"The process in which the structures of a photoreceptor cell are generated and organized. This process occurs while the initially relatively unspecialized cell is acquiring the specialized features of a photoreceptor cell, a sensory cell that reacts to the presence of light. An example of this is found in Drosophila melanogaster."	"50% (4/8)"	0.00172795	2.76	"Pocillopora_acuta_HIv2___RNAseq.g12287.t1;Pocillopora_acuta_HIv2___RNAseq.g12289.t1;Pocillopora_acuta_HIv2___RNAseq.g9334.t1;Pocillopora_acuta_HIv2___TS.g1768.t1"	"Tyrosine-protein phosphatase Lar (EC 3.1.3.48) (Protein-tyrosine-phosphate phosphohydrolase) (dLAR);Tyrosine-protein phosphatase Lar (EC 3.1.3.48) (Protein-tyrosine-phosphate phosphohydrolase) (dLAR);Tyrosine-protein phosphatase Lar (EC 3.1.3.48) (Protein-tyrosine-phosphate phosphohydrolase) (dLAR);Tyrosine-protein phosphatase Lar (EC 3.1.3.48) (Protein-tyrosine-phosphate phosphohydrolase) (dLAR)"
"GO:0007605"	"sensory perception of sound"	"The series of events required for an organism to receive an auditory stimulus, convert it to a molecular signal, and recognize and characterize the signal. Sonic stimuli are detected in the form of vibrations and are processed to form a sound."	"17.582% (16/91)"	0.001099018	2.96	"Pocillopora_acuta_HIv2___RNAseq.26564_t;Pocillopora_acuta_HIv2___RNAseq.665_t;Pocillopora_acuta_HIv2___RNAseq.g20688.t1;Pocillopora_acuta_HIv2___RNAseq.g20846.t1;Pocillopora_acuta_HIv2___RNAseq.g23181.t1;Pocillopora_acuta_HIv2___RNAseq.g25708.t1;Pocillopora_acuta_HIv2___RNAseq.g3743.t1;Pocillopora_acuta_HIv2___RNAseq.g6836.t1;Pocillopora_acuta_HIv2___RNAseq.g7241.t1;Pocillopora_acuta_HIv2___RNAseq.g7243.t1;Pocillopora_acuta_HIv2___RNAseq.g7248.t1;Pocillopora_acuta_HIv2___RNAseq.g8093.t1;Pocillopora_acuta_HIv2___TS.g10198.t2;Pocillopora_acuta_HIv2___TS.g14552.t1;Pocillopora_acuta_HIv2___TS.g28111.t1;Pocillopora_acuta_HIv2___TS.g4109.t3"	"Transcription factor AP-2-alpha (AP2-alpha) (AP-2 transcription factor) (Activating enhancer-binding protein 2-alpha) (Activator protein 2) (AP-2);POU domain, class 4, transcription factor 3 (Brain-specific homeobox/POU domain protein 3C) (Brain-3C) (Brn-3C);Thrombospondin-type laminin G domain and EAR repeat-containing protein (TSP-EAR);Fibrocystin-L (Polycystic kidney and hepatic disease 1-like protein 1) (PKHD1-like protein 1) (Protein D86);Myosin-VIIa (Protein crinkled);Lipoxygenase homology domain-containing protein 1;Protein sprouty homolog 2 (Spry-2);Thrombospondin-type laminin G domain and EAR repeat-containing protein (TSP-EAR);Thrombospondin-type laminin G domain and EAR repeat-containing protein (TSP-EAR);Thrombospondin-type laminin G domain and EAR repeat-containing protein (TSP-EAR);Thrombospondin-type laminin G domain and EAR repeat-containing protein (TSP-EAR);Chromodomain-helicase-DNA-binding protein 7 (CHD-7) (EC 3.6.4.-) (ATP-dependent helicase CHD7);Phosphatidylinositol phosphatase PTPRQ (EC 3.1.3.67) (EC 3.1.3.86) (EC 3.1.3.95) (Receptor-type tyrosine-protein phosphatase Q) (PTP-RQ) (R-PTP-Q);Cadherin-23 (Otocadherin);F-box only protein 11;Pejvakin (Autosomal recessive deafness type 59 protein)"
"GO:0016079"	"synaptic vesicle exocytosis"	"Fusion of intracellular membrane-bounded vesicles with the pre-synaptic membrane of the neuronal cell resulting in release of neurotransmitter into the synaptic cleft."	"22.414% (13/58)"	0.006227542	2.21	"Pocillopora_acuta_HIv2___RNAseq.g12223.t1;Pocillopora_acuta_HIv2___RNAseq.g13403.t1;Pocillopora_acuta_HIv2___RNAseq.g19452.t1;Pocillopora_acuta_HIv2___RNAseq.g26700.t1;Pocillopora_acuta_HIv2___RNAseq.g2827.t1;Pocillopora_acuta_HIv2___RNAseq.g28815.t1;Pocillopora_acuta_HIv2___RNAseq.g30836.t1;Pocillopora_acuta_HIv2___RNAseq.g4028.t1;Pocillopora_acuta_HIv2___RNAseq.g4031.t1c;Pocillopora_acuta_HIv2___RNAseq.g8004.t1;Pocillopora_acuta_HIv2___TS.g18947.t1;Pocillopora_acuta_HIv2___TS.g28908.t1;Pocillopora_acuta_HIv2___TS.g3024.t4"	"Ras-related protein Rab-3;Synaptotagmin-9 (Synaptotagmin IX) (SytIX);Oxysterol-binding protein-related protein 2 (ORP-2) (OSBP-related protein 2);Proline-rich transmembrane protein 2 (Dispanin subfamily B member 3) (DSPB3);Synaptotagmin-7 (IPCA-7) (Prostate cancer-associated protein 7) (Synaptotagmin VII) (SytVII);Synaptotagmin-1 (Synaptotagmin I) (SytI);Spectrin beta chain, non-erythrocytic 2 (Beta SpIII sigma 1) (Beta-III spectrin) (Glutamate transporter EAAT4-associated protein 41) (SPNB-3) (Spectrin-like protein GTRAP41);Synaptotagmin-7 (IPCA-7) (Prostate cancer-associated protein 7) (Synaptotagmin VII) (SytVII);Synaptotagmin-1 (Synaptotagmin I) (SytI);Dysbindin (Biogenesis of lysosome-related organelles complex 1 subunit 8) (BLOC-1 subunit 8) (Dysbindin-1) (Dystrobrevin-binding protein 1) (Hermansky-Pudlak syndrome 7 protein) (HPS7 protein);Spectrin beta chain, non-erythrocytic 2 (Beta SpIII sigma 1) (Beta-III spectrin) (Glutamate transporter EAAT4-associated protein 41) (SPNB-3) (Spectrin-like protein GTRAP41);Complexin-1;Protein unc-13 homolog C (Munc13-3)"
"GO:1990926"	"short-term synaptic potentiation"	NA	"60% (3/5)"	0.003759128	2.42	"Pocillopora_acuta_HIv2___RNAseq.g26700.t1;Pocillopora_acuta_HIv2___RNAseq.g2827.t1;Pocillopora_acuta_HIv2___RNAseq.g4028.t1"	"Proline-rich transmembrane protein 2 (Dispanin subfamily B member 3) (DSPB3);Synaptotagmin-7 (IPCA-7) (Prostate cancer-associated protein 7) (Synaptotagmin VII) (SytVII);Synaptotagmin-7 (IPCA-7) (Prostate cancer-associated protein 7) (Synaptotagmin VII) (SytVII)"
"GO:1903825"	"organic acid transmembrane transport"	NA	"27.692% (18/65)"	0.0004995367	3.3	"Pocillopora_acuta_HIv2___RNAseq.25384_t;Pocillopora_acuta_HIv2___RNAseq.g1200.t1;Pocillopora_acuta_HIv2___RNAseq.g12410.t1;Pocillopora_acuta_HIv2___RNAseq.g12617.t1;Pocillopora_acuta_HIv2___RNAseq.g14744.t1;Pocillopora_acuta_HIv2___RNAseq.g19152.t1;Pocillopora_acuta_HIv2___RNAseq.g21527.t1;Pocillopora_acuta_HIv2___RNAseq.g22644.t1;Pocillopora_acuta_HIv2___RNAseq.g25241.t1;Pocillopora_acuta_HIv2___RNAseq.g26586.t1;Pocillopora_acuta_HIv2___RNAseq.g30992.t1;Pocillopora_acuta_HIv2___RNAseq.g7215.t1;Pocillopora_acuta_HIv2___RNAseq.g7217.t1;Pocillopora_acuta_HIv2___TS.g16482.t1;Pocillopora_acuta_HIv2___TS.g16484.t1;Pocillopora_acuta_HIv2___TS.g22105.t1;Pocillopora_acuta_HIv2___TS.g3863.t1;Pocillopora_acuta_HIv2___TS.g5171.t1"	"Cationic amino acid transporter 2 (CAT-2) (CAT2) (cCAT-2) (Low affinity cationic amino acid transporter 2) (Solute carrier family 7 member 2);Sodium- and chloride-dependent GABA transporter 2 (GAT-2) (Sodium- and chloride-dependent GABA transporter 3) (GAT-3) (Solute carrier family 6 member 13);Excitatory amino acid transporter 2 (GLT-1) (Sodium-dependent glutamate/aspartate transporter 2) (Solute carrier family 1 member 2);Calcium-binding mitochondrial carrier protein (Mitochondrial substrate carrier family protein O);Protein btn-1;High affinity cationic amino acid transporter 1 (CAT-1) (CAT1) (Ecotropic retroviral leukemia receptor homolog) (Ecotropic retrovirus receptor homolog) (Solute carrier family 7 member 1) (System Y+ basic amino acid transporter);Protein BTN1;Excitatory amino acid transporter 3 (Excitatory amino-acid carrier 1) (Sodium-dependent glutamate/aspartate transporter 3) (Solute carrier family 1 member 1);Mitochondrial basic amino acids transporter (Carnitine/acylcarnitine translocase-like) (CACT-like) (Mitochondrial carnitine/acylcarnitine carrier protein CACL) (Mitochondrial ornithine transporter 3) (Solute carrier family 25 member 29);Monocarboxylate transporter 9 (MCT 9) (Solute carrier family 16 member 9);Solute carrier family 23 member 1 (Na(+)/L-ascorbic acid transporter 1) (Sodium-dependent vitamin C transporter 1) (Yolk sac permease-like molecule 3);Major facilitator superfamily domain-containing protein 12 (Protein grizzled);Major facilitator superfamily domain-containing protein 12 (Protein grizzled);Sodium- and chloride-dependent GABA transporter 2 (GAT-2) (Sodium- and chloride-dependent GABA transporter 3) (GAT-3) (Solute carrier family 6 member 13);Sodium- and chloride-dependent GABA transporter 2 (GAT-2) (Sodium- and chloride-dependent GABA transporter 3) (GAT-3) (Solute carrier family 6 member 13);Major facilitator superfamily domain-containing protein 12;Long-chain-fatty-acid--CoA ligase 5 (EC 6.2.1.3) (Arachidonate--CoA ligase) (EC 6.2.1.15) (Long-chain acyl-CoA synthetase 5) (LACS 5);Cationic amino acid transporter 2 (CAT-2) (CAT2) (Low affinity cationic amino acid transporter 2) (Solute carrier family 7 member 2)"
"GO:1903826"	"L-arginine transmembrane transport"	NA	"50% (5/10)"	0.0004314756	3.37	"Pocillopora_acuta_HIv2___RNAseq.g14744.t1;Pocillopora_acuta_HIv2___RNAseq.g19152.t1;Pocillopora_acuta_HIv2___RNAseq.g21527.t1;Pocillopora_acuta_HIv2___RNAseq.g25241.t1;Pocillopora_acuta_HIv2___TS.g5171.t1"	"Protein btn-1;High affinity cationic amino acid transporter 1 (CAT-1) (CAT1) (Ecotropic retroviral leukemia receptor homolog) (Ecotropic retrovirus receptor homolog) (Solute carrier family 7 member 1) (System Y+ basic amino acid transporter);Protein BTN1;Mitochondrial basic amino acids transporter (Carnitine/acylcarnitine translocase-like) (CACT-like) (Mitochondrial carnitine/acylcarnitine carrier protein CACL) (Mitochondrial ornithine transporter 3) (Solute carrier family 25 member 29);Cationic amino acid transporter 2 (CAT-2) (CAT2) (Low affinity cationic amino acid transporter 2) (Solute carrier family 7 member 2)"
"GO:0050802"	"circadian sleep/wake cycle, sleep"	"The part of the circadian sleep/wake cycle where the organism is asleep."	"33.333% (6/18)"	0.001488178	2.83	"Pocillopora_acuta_HIv2___RNAseq.g1217.t1;Pocillopora_acuta_HIv2___RNAseq.g16948.t1;Pocillopora_acuta_HIv2___RNAseq.g18966.t1;Pocillopora_acuta_HIv2___RNAseq.g21572.t1a;Pocillopora_acuta_HIv2___RNAseq.g27413.t1;Pocillopora_acuta_HIv2___RNAseq.g29275.t1"	"Adenosine receptor A2a;Neurocalcin homolog (DrosNCa);Potassium voltage-gated channel subfamily A member 2 (RAK) (RBK2) (RCK5) (Voltage-gated potassium channel subunit Kv1.2);Gamma-aminobutyric acid receptor subunit beta-3 (GABA(A) receptor subunit beta-3) (GABAAR subunit beta-3);Gamma-aminobutyric acid receptor subunit beta-3 (GABA(A) receptor subunit beta-3) (GABAAR subunit beta-3);Potassium voltage-gated channel subfamily A member 2 (KC22) (Voltage-gated potassium channel subunit Kv1.2)"
"GO:0001868"	"regulation of complement activation, lectin pathway"	"Any process that modulates the frequency, rate or extent of the lectin pathway of complement activation."	"66.667% (4/6)"	0.0004184989	3.38	"Pocillopora_acuta_HIv2___RNAseq.g12286.t1;Pocillopora_acuta_HIv2___RNAseq.g12290.t1;Pocillopora_acuta_HIv2___RNAseq.g12292.t1;Pocillopora_acuta_HIv2___TS.g3256.t1"	"Fucolectin-4;Fucolectin;Fucolectin;Fucolectin-3"
"GO:0021545"	"cranial nerve development"	"The process whose specific outcome is the progression of the cranial nerves over time, from its formation to the mature structure. The cranial nerves are composed of twelve pairs of nerves that emanate from the nervous tissue of the hindbrain. These nerves are sensory, motor, or mixed in nature, and provide the motor and general sensory innervation of the head, neck and viscera. They mediate vision, hearing, olfaction and taste and carry the parasympathetic innervation of the autonomic ganglia that control visceral functions."	"30.769% (8/26)"	0.0004493496	3.35	"Pocillopora_acuta_HIv2___RNAseq.26564_t;Pocillopora_acuta_HIv2___RNAseq.665_t;Pocillopora_acuta_HIv2___RNAseq.g12898.t1;Pocillopora_acuta_HIv2___RNAseq.g13400.t1;Pocillopora_acuta_HIv2___RNAseq.g13552.t1;Pocillopora_acuta_HIv2___RNAseq.g18966.t1;Pocillopora_acuta_HIv2___RNAseq.g29275.t1;Pocillopora_acuta_HIv2___RNAseq.g8093.t1"	"Transcription factor AP-2-alpha (AP2-alpha) (AP-2 transcription factor) (Activating enhancer-binding protein 2-alpha) (Activator protein 2) (AP-2);POU domain, class 4, transcription factor 3 (Brain-specific homeobox/POU domain protein 3C) (Brain-3C) (Brn-3C);Sodium/potassium/calcium exchanger 4 (Na(+)/K(+)/Ca(2+)-exchange protein 4) (Solute carrier family 24 member 4);Double-stranded RNA-specific editase 1 (EC 3.5.4.37) (RNA-editing deaminase 1) (RNA-editing enzyme 1) (dsRNA adenosine deaminase);Voltage-gated potassium channel KCNC1 (NGK2) (Potassium voltage-gated channel subfamily C member 1) (Voltage-gated potassium channel subunit Kv3.1) (Voltage-gated potassium channel subunit Kv4);Potassium voltage-gated channel subfamily A member 2 (RAK) (RBK2) (RCK5) (Voltage-gated potassium channel subunit Kv1.2);Potassium voltage-gated channel subfamily A member 2 (KC22) (Voltage-gated potassium channel subunit Kv1.2);Chromodomain-helicase-DNA-binding protein 7 (CHD-7) (EC 3.6.4.-) (ATP-dependent helicase CHD7)"
"GO:0009812"	"flavonoid metabolic process"	"The chemical reactions and pathways involving flavonoids, a group of water-soluble phenolic derivatives containing a flavan skeleton including flavones, flavonols and flavanoids, and anthocyanins."	"71.429% (5/7)"	4.354457e-05	4.36	"Pocillopora_acuta_HIv2___RNAseq.10969_t;Pocillopora_acuta_HIv2___RNAseq.g12481.t1;Pocillopora_acuta_HIv2___RNAseq.g21538.t1;Pocillopora_acuta_HIv2___RNAseq.g9089.t1;Pocillopora_acuta_HIv2___RNAseq.g9093.t1"	"Sulfotransferase 1B1 (ST1B1) (EC 2.8.2.1) (Sulfotransferase 1B2) (Sulfotransferase family cytosolic 1B member 1) (Thyroid hormone sulfotransferase);Sulfotransferase 1C4 (ST1C4) (EC 2.8.2.1);Sulfotransferase 1B1 (ST1B1) (EC 2.8.2.1) (Sulfotransferase 1B2) (Sulfotransferase family cytosolic 1B member 1) (Thyroid hormone sulfotransferase);Sulfotransferase 1C4 (ST1C4) (EC 2.8.2.1);Sulfotransferase 1C4 (ST1C4) (EC 2.8.2.1) (Sulfotransferase 1C2) (SULT1C#2)"
"GO:0089718"	"amino acid import across plasma membrane"	"The directed movement of an amino acid from outside of a cell, across the plasma membrane and into the cytosol."	"47.059% (8/17)"	1.284285e-05	4.89	"Pocillopora_acuta_HIv2___RNAseq.25384_t;Pocillopora_acuta_HIv2___RNAseq.g1200.t1;Pocillopora_acuta_HIv2___RNAseq.g12410.t1;Pocillopora_acuta_HIv2___RNAseq.g19152.t1;Pocillopora_acuta_HIv2___RNAseq.g22644.t1;Pocillopora_acuta_HIv2___TS.g16482.t1;Pocillopora_acuta_HIv2___TS.g16484.t1;Pocillopora_acuta_HIv2___TS.g5171.t1"	"Cationic amino acid transporter 2 (CAT-2) (CAT2) (cCAT-2) (Low affinity cationic amino acid transporter 2) (Solute carrier family 7 member 2);Sodium- and chloride-dependent GABA transporter 2 (GAT-2) (Sodium- and chloride-dependent GABA transporter 3) (GAT-3) (Solute carrier family 6 member 13);Excitatory amino acid transporter 2 (GLT-1) (Sodium-dependent glutamate/aspartate transporter 2) (Solute carrier family 1 member 2);High affinity cationic amino acid transporter 1 (CAT-1) (CAT1) (Ecotropic retroviral leukemia receptor homolog) (Ecotropic retrovirus receptor homolog) (Solute carrier family 7 member 1) (System Y+ basic amino acid transporter);Excitatory amino acid transporter 3 (Excitatory amino-acid carrier 1) (Sodium-dependent glutamate/aspartate transporter 3) (Solute carrier family 1 member 1);Sodium- and chloride-dependent GABA transporter 2 (GAT-2) (Sodium- and chloride-dependent GABA transporter 3) (GAT-3) (Solute carrier family 6 member 13);Sodium- and chloride-dependent GABA transporter 2 (GAT-2) (Sodium- and chloride-dependent GABA transporter 3) (GAT-3) (Solute carrier family 6 member 13);Cationic amino acid transporter 2 (CAT-2) (CAT2) (Low affinity cationic amino acid transporter 2) (Solute carrier family 7 member 2)"
"GO:0006068"	"ethanol catabolic process"	"The chemical reactions and pathways resulting in the breakdown of ethanol, CH3-CH2-OH, a colorless, water-miscible, flammable liquid produced by alcoholic fermentation."	"60% (3/5)"	0.003759128	2.42	"Pocillopora_acuta_HIv2___RNAseq.10969_t;Pocillopora_acuta_HIv2___RNAseq.g21538.t1;Pocillopora_acuta_HIv2___RNAseq.g9093.t1"	"Sulfotransferase 1B1 (ST1B1) (EC 2.8.2.1) (Sulfotransferase 1B2) (Sulfotransferase family cytosolic 1B member 1) (Thyroid hormone sulfotransferase);Sulfotransferase 1B1 (ST1B1) (EC 2.8.2.1) (Sulfotransferase 1B2) (Sulfotransferase family cytosolic 1B member 1) (Thyroid hormone sulfotransferase);Sulfotransferase 1C4 (ST1C4) (EC 2.8.2.1) (Sulfotransferase 1C2) (SULT1C#2)"
"GO:0009581"	"detection of external stimulus"	"The series of events in which an external stimulus is received by a cell and converted into a molecular signal."	"17.5% (14/80)"	0.002305384	2.64	"Pocillopora_acuta_HIv2___RNAseq.10010_t;Pocillopora_acuta_HIv2___RNAseq.g12898.t1;Pocillopora_acuta_HIv2___RNAseq.g26058.t1;Pocillopora_acuta_HIv2___RNAseq.g3166.t1;Pocillopora_acuta_HIv2___RNAseq.g5711.t2;Pocillopora_acuta_HIv2___RNAseq.g701.t1;Pocillopora_acuta_HIv2___RNAseq.g702.t1;Pocillopora_acuta_HIv2___RNAseq.g9466.t1;Pocillopora_acuta_HIv2___TS.g10198.t2;Pocillopora_acuta_HIv2___TS.g14960.t2;Pocillopora_acuta_HIv2___TS.g15134.t1;Pocillopora_acuta_HIv2___TS.g21857.t1;Pocillopora_acuta_HIv2___TS.g4109.t3;Pocillopora_acuta_HIv2___TS.g9513.t1"	"Transient receptor potential cation channel subfamily A member 1 (Ankyrin-like with transmembrane domains protein 1) (Transformation-sensitive protein p120) (p120) (Wasabi receptor);Sodium/potassium/calcium exchanger 4 (Na(+)/K(+)/Ca(2+)-exchange protein 4) (Solute carrier family 24 member 4);Rhodopsin, GQ-coupled (GQ-rhodopsin);Rhodopsin;WD repeat-containing protein 47 (Neuronal enriched MAP interacting protein) (Nemitin);Polycystin-2 (Polycystic kidney disease 2 protein homolog);Sperm receptor for egg jelly (suREJ);Transient receptor potential cation channel subfamily A member 1 (Ankyrin-like with transmembrane domains protein 1) (Wasabi receptor);Phosphatidylinositol phosphatase PTPRQ (EC 3.1.3.67) (EC 3.1.3.86) (EC 3.1.3.95) (Receptor-type tyrosine-protein phosphatase Q) (PTP-RQ) (R-PTP-Q);Glutamate receptor ionotropic, kainate 2 (GluK2) (Glutamate receptor 6) (GluR-6) (GluR6);Mechanosensory protein 2;Polycystin-1-like protein 3 (Polycystin-1L3) (PC1-like 3 protein) (Polycystic kidney disease protein 1-like 3);Pejvakin (Autosomal recessive deafness type 59 protein);Carcinine transporter"
"GO:0009582"	"detection of abiotic stimulus"	"The series of events in which an (non-living) abiotic stimulus is received by a cell and converted into a molecular signal."	"18.293% (15/82)"	0.001023255	2.99	"Pocillopora_acuta_HIv2___RNAseq.10010_t;Pocillopora_acuta_HIv2___RNAseq.g12898.t1;Pocillopora_acuta_HIv2___RNAseq.g14869.t1;Pocillopora_acuta_HIv2___RNAseq.g26058.t1;Pocillopora_acuta_HIv2___RNAseq.g3166.t1;Pocillopora_acuta_HIv2___RNAseq.g5711.t2;Pocillopora_acuta_HIv2___RNAseq.g701.t1;Pocillopora_acuta_HIv2___RNAseq.g702.t1;Pocillopora_acuta_HIv2___RNAseq.g9466.t1;Pocillopora_acuta_HIv2___TS.g10198.t2;Pocillopora_acuta_HIv2___TS.g14960.t2;Pocillopora_acuta_HIv2___TS.g15134.t1;Pocillopora_acuta_HIv2___TS.g21857.t1;Pocillopora_acuta_HIv2___TS.g4109.t3;Pocillopora_acuta_HIv2___TS.g9513.t1"	"Transient receptor potential cation channel subfamily A member 1 (Ankyrin-like with transmembrane domains protein 1) (Transformation-sensitive protein p120) (p120) (Wasabi receptor);Sodium/potassium/calcium exchanger 4 (Na(+)/K(+)/Ca(2+)-exchange protein 4) (Solute carrier family 24 member 4);Neuropeptide FF receptor 2 (G-protein coupled receptor 74) (G-protein coupled receptor HLWAR77) (Neuropeptide G-protein coupled receptor);Rhodopsin, GQ-coupled (GQ-rhodopsin);Rhodopsin;WD repeat-containing protein 47 (Neuronal enriched MAP interacting protein) (Nemitin);Polycystin-2 (Polycystic kidney disease 2 protein homolog);Sperm receptor for egg jelly (suREJ);Transient receptor potential cation channel subfamily A member 1 (Ankyrin-like with transmembrane domains protein 1) (Wasabi receptor);Phosphatidylinositol phosphatase PTPRQ (EC 3.1.3.67) (EC 3.1.3.86) (EC 3.1.3.95) (Receptor-type tyrosine-protein phosphatase Q) (PTP-RQ) (R-PTP-Q);Glutamate receptor ionotropic, kainate 2 (GluK2) (Glutamate receptor 6) (GluR-6) (GluR6);Mechanosensory protein 2;Polycystin-1-like protein 3 (Polycystin-1L3) (PC1-like 3 protein) (Polycystic kidney disease protein 1-like 3);Pejvakin (Autosomal recessive deafness type 59 protein);Carcinine transporter"
"GO:0042883"	"cysteine transport"	"The directed movement of cysteine into, out of or within a cell, or between cells, by means of some agent such as a transporter or pore."	"44.444% (4/9)"	0.002926368	2.53	"Pocillopora_acuta_HIv2___RNAseq.g22644.t1;Pocillopora_acuta_HIv2___RNAseq.g7215.t1;Pocillopora_acuta_HIv2___RNAseq.g7217.t1;Pocillopora_acuta_HIv2___TS.g22105.t1"	"Excitatory amino acid transporter 3 (Excitatory amino-acid carrier 1) (Sodium-dependent glutamate/aspartate transporter 3) (Solute carrier family 1 member 1);Major facilitator superfamily domain-containing protein 12 (Protein grizzled);Major facilitator superfamily domain-containing protein 12 (Protein grizzled);Major facilitator superfamily domain-containing protein 12"
"GO:0099502"	"calcium-dependent activation of synaptic vesicle fusion"	"The regulatory process by which increased cytosolic calcium levels lead to the the fusion of synaptic vesicles with the presynaptic active zone membrane by bringing primed synaptic vesicle membrane into contact with membrane presynaptic active zone membrane."	"33.333% (4/12)"	0.009584994	2.02	"Pocillopora_acuta_HIv2___RNAseq.g13403.t1;Pocillopora_acuta_HIv2___RNAseq.g26700.t1;Pocillopora_acuta_HIv2___RNAseq.g2827.t1;Pocillopora_acuta_HIv2___RNAseq.g4028.t1"	"Synaptotagmin-9 (Synaptotagmin IX) (SytIX);Proline-rich transmembrane protein 2 (Dispanin subfamily B member 3) (DSPB3);Synaptotagmin-7 (IPCA-7) (Prostate cancer-associated protein 7) (Synaptotagmin VII) (SytVII);Synaptotagmin-7 (IPCA-7) (Prostate cancer-associated protein 7) (Synaptotagmin VII) (SytVII)"
