GO.ID	term	definition	Oral_elim.genes_frequency	Oral_elim.pvalue	Oral_elim.-log10_pvalue	Oral_elim.Significant_genes	Oral_elim.Significant_genes_symbol
"GO:0051939"	"gamma-aminobutyric acid import"	"The directed movement of gamma-aminobutyric acid (GABA, 4-aminobutyrate) into a cell or organelle."	"33.333% (4/12)"	0.009584994	2.02	"Pocillopora_acuta_HIv2___RNAseq.g1200.t1;Pocillopora_acuta_HIv2___RNAseq.g28251.t1;Pocillopora_acuta_HIv2___TS.g16482.t1;Pocillopora_acuta_HIv2___TS.g16484.t1"	"Sodium- and chloride-dependent GABA transporter 2 (GAT-2) (Sodium- and chloride-dependent GABA transporter 3) (GAT-3) (Solute carrier family 6 member 13);Sodium- and chloride-dependent GABA transporter 1 (GAT-1) (Solute carrier family 6 member 1);Sodium- and chloride-dependent GABA transporter 2 (GAT-2) (Sodium- and chloride-dependent GABA transporter 3) (GAT-3) (Solute carrier family 6 member 13);Sodium- and chloride-dependent GABA transporter 2 (GAT-2) (Sodium- and chloride-dependent GABA transporter 3) (GAT-3) (Solute carrier family 6 member 13)"
"GO:0007412"	"axon target recognition"	"The process in which an axon recognizes and binds to a set of cells with which it may form stable connections."	"55.556% (5/9)"	0.000229928	3.64	"Pocillopora_acuta_HIv2___RNAseq.g12287.t1;Pocillopora_acuta_HIv2___RNAseq.g12289.t1;Pocillopora_acuta_HIv2___RNAseq.g28466.t1;Pocillopora_acuta_HIv2___RNAseq.g9334.t1;Pocillopora_acuta_HIv2___TS.g1768.t1"	"Tyrosine-protein phosphatase Lar (EC 3.1.3.48) (Protein-tyrosine-phosphate phosphohydrolase) (dLAR);Tyrosine-protein phosphatase Lar (EC 3.1.3.48) (Protein-tyrosine-phosphate phosphohydrolase) (dLAR);Ephrin-B2a;Tyrosine-protein phosphatase Lar (EC 3.1.3.48) (Protein-tyrosine-phosphate phosphohydrolase) (dLAR);Tyrosine-protein phosphatase Lar (EC 3.1.3.48) (Protein-tyrosine-phosphate phosphohydrolase) (dLAR)"
"GO:0007417"	"central nervous system development"	"The process whose specific outcome is the progression of the central nervous system over time, from its formation to the mature structure. The central nervous system is the core nervous system that serves an integrating and coordinating function. In vertebrates it consists of the brain and spinal cord. In those invertebrates with a central nervous system it typically consists of a brain, cerebral ganglia and a nerve cord."	"10.843% (54/498)"	0.00363633	2.44	"Pocillopora_acuta_HIv2___RNAseq.26564_t;Pocillopora_acuta_HIv2___RNAseq.g11589.t1;Pocillopora_acuta_HIv2___RNAseq.g11673.t1;Pocillopora_acuta_HIv2___RNAseq.g12115.t1;Pocillopora_acuta_HIv2___RNAseq.g1217.t1;Pocillopora_acuta_HIv2___RNAseq.g12410.t1;Pocillopora_acuta_HIv2___RNAseq.g13060.t1;Pocillopora_acuta_HIv2___RNAseq.g13400.t1;Pocillopora_acuta_HIv2___RNAseq.g13552.t1;Pocillopora_acuta_HIv2___RNAseq.g13576.t1;Pocillopora_acuta_HIv2___RNAseq.g13970.t2;Pocillopora_acuta_HIv2___RNAseq.g14615.t1;Pocillopora_acuta_HIv2___RNAseq.g16957.t1;Pocillopora_acuta_HIv2___RNAseq.g18966.t1;Pocillopora_acuta_HIv2___RNAseq.g21572.t1a;Pocillopora_acuta_HIv2___RNAseq.g21637.t1;Pocillopora_acuta_HIv2___RNAseq.g21912.t1;Pocillopora_acuta_HIv2___RNAseq.g22366.t1;Pocillopora_acuta_HIv2___RNAseq.g22749.t1;Pocillopora_acuta_HIv2___RNAseq.g23053.t1;Pocillopora_acuta_HIv2___RNAseq.g25686.t1;Pocillopora_acuta_HIv2___RNAseq.g26743.t1;Pocillopora_acuta_HIv2___RNAseq.g27413.t1;Pocillopora_acuta_HIv2___RNAseq.g27673.t1;Pocillopora_acuta_HIv2___RNAseq.g27978.t1;Pocillopora_acuta_HIv2___RNAseq.g28466.t1;Pocillopora_acuta_HIv2___RNAseq.g2915.t1;Pocillopora_acuta_HIv2___RNAseq.g30836.t1;Pocillopora_acuta_HIv2___RNAseq.g30992.t1;Pocillopora_acuta_HIv2___RNAseq.g3482.t1;Pocillopora_acuta_HIv2___RNAseq.g3580.t1;Pocillopora_acuta_HIv2___RNAseq.g3837.t1a;Pocillopora_acuta_HIv2___RNAseq.g4399.t2;Pocillopora_acuta_HIv2___RNAseq.g4502.t1;Pocillopora_acuta_HIv2___RNAseq.g4770.t1;Pocillopora_acuta_HIv2___RNAseq.g5711.t2;Pocillopora_acuta_HIv2___RNAseq.g626.t1;Pocillopora_acuta_HIv2___RNAseq.g687.t1;Pocillopora_acuta_HIv2___RNAseq.g7803.t1;Pocillopora_acuta_HIv2___RNAseq.g7833.t1;Pocillopora_acuta_HIv2___RNAseq.g8093.t1;Pocillopora_acuta_HIv2___RNAseq.g8876.t1;Pocillopora_acuta_HIv2___RNAseq.g898.t1b;Pocillopora_acuta_HIv2___RNAseq.g9609.t1;Pocillopora_acuta_HIv2___TS.g15672.t1;Pocillopora_acuta_HIv2___TS.g18947.t1;Pocillopora_acuta_HIv2___TS.g19097.t2;Pocillopora_acuta_HIv2___TS.g201.t2;Pocillopora_acuta_HIv2___TS.g24662.t1;Pocillopora_acuta_HIv2___TS.g25792.t1c;Pocillopora_acuta_HIv2___TS.g29618.t1;Pocillopora_acuta_HIv2___TS.g29621.t1;Pocillopora_acuta_HIv2___TS.g5347.t1;Pocillopora_acuta_HIv2___TS.g800.t1"	"Transcription factor AP-2-alpha (AP2-alpha) (AP-2 transcription factor) (Activating enhancer-binding protein 2-alpha) (Activator protein 2) (AP-2);All trans-polyprenyl-diphosphate synthase PDSS2 (All-trans-decaprenyl-diphosphate synthase subunit 2) (EC 2.5.1.91) (Candidate tumor suppressor protein) (Decaprenyl pyrophosphate synthase subunit 2) (Decaprenyl-diphosphate synthase subunit 2) (Solanesyl-diphosphate synthase subunit 2);POU domain, class 3, transcription factor 2-B (Transcription factor POU3-B) (XlPOU3B);Phospholipid phosphatase 3 (EC 3.1.3.-) (EC 3.1.3.4) (Lipid phosphate phosphohydrolase 3) (PAP2-beta) (Phosphatidate phosphohydrolase type 2b) (Phosphatidic acid phosphatase 2b) (PAP-2b) (PAP2b) (Vascular endothelial growth factor and type I collagen-inducible protein) (VCIP);Adenosine receptor A2a;Excitatory amino acid transporter 2 (GLT-1) (Sodium-dependent glutamate/aspartate transporter 2) (Solute carrier family 1 member 2);Low-density lipoprotein receptor-related protein 6 (LRP-6);Double-stranded RNA-specific editase 1 (EC 3.5.4.37) (RNA-editing deaminase 1) (RNA-editing enzyme 1) (dsRNA adenosine deaminase);Voltage-gated potassium channel KCNC1 (NGK2) (Potassium voltage-gated channel subfamily C member 1) (Voltage-gated potassium channel subunit Kv3.1) (Voltage-gated potassium channel subunit Kv4);Aggrecan core protein (Cartilage-specific proteoglycan core protein) (CSPCP);Tetratricopeptide repeat protein 8 (TPR repeat protein 8) (Bardet-Biedl syndrome 8 protein);Microtubule organization protein AKNA (AT-hook-containing transcription factor);Transcription factor SOX-4;Potassium voltage-gated channel subfamily A member 2 (RAK) (RBK2) (RCK5) (Voltage-gated potassium channel subunit Kv1.2);Gamma-aminobutyric acid receptor subunit beta-3 (GABA(A) receptor subunit beta-3) (GABAAR subunit beta-3);Reversion-inducing cysteine-rich protein with Kazal motifs;Homeobox protein HMX3 (Homeobox protein H6 family member 3) (Homeobox protein Nkx-5.1);Neuronal migration protein doublecortin (Doublin) (Lissencephalin-X) (Lis-X);Transcription factor Sox-3;Protein capicua homolog;Transcription factor Sox-14;Ceramide synthase 1 (CerS1) (Longevity assurance gene 1 protein homolog 1) (Protein UOG-1) (Sphingoid base N-stearoyltransferase CERS1) (EC 2.3.1.299);Gamma-aminobutyric acid receptor subunit beta-3 (GABA(A) receptor subunit beta-3) (GABAAR subunit beta-3);Paired box protein Pax-6 (Oculorhombin);Plasma membrane calcium-transporting ATPase 4 (PMCA4) (EC 7.2.2.10) (Matrix-remodeling-associated protein 1) (Plasma membrane calcium ATPase isoform 4) (Plasma membrane calcium pump isoform 4);Ephrin-B2a;Cadherin EGF LAG seven-pass G-type receptor 1 (Cadherin family member 9) (Flamingo homolog 2) (hFmi2);Spectrin beta chain, non-erythrocytic 2 (Beta SpIII sigma 1) (Beta-III spectrin) (Glutamate transporter EAAT4-associated protein 41) (SPNB-3) (Spectrin-like protein GTRAP41);Solute carrier family 23 member 1 (Na(+)/L-ascorbic acid transporter 1) (Sodium-dependent vitamin C transporter 1) (Yolk sac permease-like molecule 3);Polycomb complex protein BMI-1-A (Polycomb group RING finger protein 4-A);Pancreas transcription factor 1 subunit alpha (Pancreas-specific transcription factor 1a) (bHLH transcription factor p48);Paired box protein Pax-2a (No isthmus protein) (Pax[Zf-b]);Low-density lipoprotein receptor-related protein 8 (LRP-8) (Apolipoprotein E receptor 2);Glutamine--tRNA ligase (EC 6.1.1.18) (Glutaminyl-tRNA synthetase) (GlnRS);Dynein axonemal heavy chain 5 (Axonemal beta dynein heavy chain 5) (Ciliary dynein heavy chain 5);WD repeat-containing protein 47 (Neuronal enriched MAP interacting protein) (Nemitin);Serine/threonine-protein kinase PAK mbt (EC 2.7.11.1) (Protein mushroom bodies tiny) (p21-activated kinase-related protein);Ribitol 5-phosphate transferase FKRP (EC 2.7.8.-) (Fukutin-related protein) (Ribitol-5-phosphate transferase);Transcription factor sox-2;N(6)-adenosine-methyltransferase catalytic subunit METTL3 (EC 2.1.1.348) (Methyltransferase-like protein 3) (hMETTL3) (N(6)-adenosine-methyltransferase 70 kDa subunit) (MT-A70);Chromodomain-helicase-DNA-binding protein 7 (CHD-7) (EC 3.6.4.-) (ATP-dependent helicase CHD7);Homeobox protein not2 (Xnot-2) (Xnot2);RAC-gamma serine/threonine-protein kinase (EC 2.7.11.1) (Protein kinase Akt-3) (Protein kinase B gamma) (PKB gamma) (RAC-PK-gamma);Monocarboxylate transporter 8 (MCT 8) (Solute carrier family 16 member 2);Low-density lipoprotein receptor-related protein 5 (LRP-5) (Low-density lipoprotein receptor-related protein 7) (LRP-7);Spectrin beta chain, non-erythrocytic 2 (Beta SpIII sigma 1) (Beta-III spectrin) (Glutamate transporter EAAT4-associated protein 41) (SPNB-3) (Spectrin-like protein GTRAP41);Neurexin-4 (Neurexin IV);Dynein axonemal heavy chain 5 (Axonemal beta dynein heavy chain 5) (Ciliary dynein heavy chain 5);Neuronal cell adhesion molecule (Nr-CAM) (Ankyrin-binding cell adhesion molecule NrCAM) (Neuronal surface protein Bravo) (rBravo) (NgCAM-related cell adhesion molecule) (Ng-CAM-related);Cell adhesion molecule DSCAML1 (Down syndrome cell adhesion molecule 2) (Down syndrome cell adhesion molecule-like protein 1);Low-density lipoprotein receptor-related protein 6 (LRP-6);Low-density lipoprotein receptor-related protein 6 (LRP-6);Peroxisomal targeting signal 1 receptor (PTS1 receptor) (PTS1R) (PTS1-BP) (PXR1P) (Peroxin-5) (Peroxisomal C-terminal targeting signal import receptor) (Peroxisome receptor 1);Netrin receptor UNC5C (Protein unc-5 homolog 3) (Protein unc-5 homolog C)"
"GO:0007193"	"adenylate cyclase-inhibiting G protein-coupled receptor signaling pathway"	"A G protein-coupled receptor signaling pathway in which the signal is transmitted via the inhibition of adenylyl cyclase activity and a subsequent decrease in the intracellular concentration of cyclic AMP (cAMP)."	"20.513% (8/39)"	0.007427863	2.13	"Pocillopora_acuta_HIv2___RNAseq.g13056.t1;Pocillopora_acuta_HIv2___RNAseq.g14871.t1;Pocillopora_acuta_HIv2___RNAseq.g19870.t1;Pocillopora_acuta_HIv2___RNAseq.g23414.t1;Pocillopora_acuta_HIv2___RNAseq.g2519.t1;Pocillopora_acuta_HIv2___RNAseq.g25689.t1;Pocillopora_acuta_HIv2___RNAseq.g27609.t1;Pocillopora_acuta_HIv2___TS.g305.t1"	"Dopamine receptor 4;Extracellular calcium-sensing receptor (CaSR) (Parathyroid cell calcium-sensing receptor) (PCaR1) (RaKCaR);Gamma-aminobutyric acid type B receptor subunit 1 (GABA-B receptor 1) (GABA-B-R1) (GABA-BR1) (GABABR1) (Gb1);5-hydroxytryptamine receptor 1B (5-HT-1B) (5-HT1B) (Serotonin receptor 1B);Gamma-aminobutyric acid type B receptor subunit 2 (GABA-B receptor 2) (GABA-B-R2) (GABA-BR2) (GABABR2) (Gb2) (G-protein coupled receptor 51) (HG20);Melatonin receptor type 1A (Mel-1A-R) (Mel1a receptor);cGMP-dependent 3',5'-cyclic phosphodiesterase (EC 3.1.4.17) (Cyclic GMP-stimulated phosphodiesterase) (CGS-PDE) (cGSPDE);Gamma-aminobutyric acid type B receptor subunit 2 (GABA-B receptor 2) (GABA-B-R2) (GABA-BR2) (GABABR2) (Gb2) (G-protein coupled receptor 51) (HG20)"
"GO:0007156"	"homophilic cell adhesion via plasma membrane adhesion molecules"	"The attachment of a plasma membrane adhesion molecule in one cell to an identical molecule in an adjacent cell."	"18.367% (18/98)"	0.008817408	2.05	"Pocillopora_acuta_HIv2___RNAseq.g11580.t1;Pocillopora_acuta_HIv2___RNAseq.g12287.t1;Pocillopora_acuta_HIv2___RNAseq.g12289.t1;Pocillopora_acuta_HIv2___RNAseq.g12293.t1;Pocillopora_acuta_HIv2___RNAseq.g13533.t1;Pocillopora_acuta_HIv2___RNAseq.g26596.t1;Pocillopora_acuta_HIv2___RNAseq.g2915.t1;Pocillopora_acuta_HIv2___RNAseq.g7553.t1;Pocillopora_acuta_HIv2___RNAseq.g8520.t1;Pocillopora_acuta_HIv2___RNAseq.g9334.t1;Pocillopora_acuta_HIv2___TS.g14552.t1;Pocillopora_acuta_HIv2___TS.g1768.t1;Pocillopora_acuta_HIv2___TS.g23175.t1;Pocillopora_acuta_HIv2___TS.g24662.t1;Pocillopora_acuta_HIv2___TS.g24807.t1;Pocillopora_acuta_HIv2___TS.g25792.t1c;Pocillopora_acuta_HIv2___TS.g6578.t1;Pocillopora_acuta_HIv2___TS.g9752.t3"	"Hemicentin-1 (Fibulin-6) (FIBL-6);Tyrosine-protein phosphatase Lar (EC 3.1.3.48) (Protein-tyrosine-phosphate phosphohydrolase) (dLAR);Tyrosine-protein phosphatase Lar (EC 3.1.3.48) (Protein-tyrosine-phosphate phosphohydrolase) (dLAR);Receptor-type tyrosine-protein phosphatase T (R-PTP-T) (EC 3.1.3.48) (Receptor-type tyrosine-protein phosphatase rho) (RPTP-rho);Protein sidekick-2;Hemicentin-2;Cadherin EGF LAG seven-pass G-type receptor 1 (Cadherin family member 9) (Flamingo homolog 2) (hFmi2);Protocadherin Fat 1 (Cadherin family member 7) (Cadherin-related tumor suppressor homolog) (Protein fat homolog) [Cleaved into: Protocadherin Fat 1, nuclear form];Hemicentin-1 (Fibulin-6) (FIBL-6);Tyrosine-protein phosphatase Lar (EC 3.1.3.48) (Protein-tyrosine-phosphate phosphohydrolase) (dLAR);Cadherin-23 (Otocadherin);Tyrosine-protein phosphatase Lar (EC 3.1.3.48) (Protein-tyrosine-phosphate phosphohydrolase) (dLAR);Hemicentin-1 (Fibulin-6) (FIBL-6);Neuronal cell adhesion molecule (Nr-CAM) (Ankyrin-binding cell adhesion molecule NrCAM) (Neuronal surface protein Bravo) (rBravo) (NgCAM-related cell adhesion molecule) (Ng-CAM-related);Hemicentin-1 (Fibulin-6) (FIBL-6);Cell adhesion molecule DSCAML1 (Down syndrome cell adhesion molecule 2) (Down syndrome cell adhesion molecule-like protein 1);Protocadherin-like protein;Protocadherin Fat 1 (Cadherin family member 7) (Cadherin-related tumor suppressor homolog) (Protein fat homolog) [Cleaved into: Protocadherin Fat 1, nuclear form]"
"GO:0007186"	"G protein-coupled receptor signaling pathway"	"The series of molecular signals initiated by a ligand binding to its receptor, in which the activated receptor promotes the exchange of GDP for GTP on the alpha-subunit of an associated heterotrimeric G-protein complex. The GTP-bound activated alpha-G-protein then dissociates from the beta- and gamma-subunits to further transmit the signal within the cell. The pathway begins with receptor-ligand interaction, and ends with regulation of a downstream cellular process. The pathway can start from the plasma membrane, Golgi or nuclear membrane."	"12.291% (44/358)"	0.00792723	2.1	"Pocillopora_acuta_HIv2___RNAseq.18788_t;Pocillopora_acuta_HIv2___RNAseq.5883_t;Pocillopora_acuta_HIv2___RNAseq.g10339.t1;Pocillopora_acuta_HIv2___RNAseq.g1102.t1;Pocillopora_acuta_HIv2___RNAseq.g11214.t1;Pocillopora_acuta_HIv2___RNAseq.g11547.t1;Pocillopora_acuta_HIv2___RNAseq.g11548.t1;Pocillopora_acuta_HIv2___RNAseq.g1217.t1;Pocillopora_acuta_HIv2___RNAseq.g12898.t1;Pocillopora_acuta_HIv2___RNAseq.g13056.t1;Pocillopora_acuta_HIv2___RNAseq.g14013.t1a;Pocillopora_acuta_HIv2___RNAseq.g14576.t1;Pocillopora_acuta_HIv2___RNAseq.g14869.t1;Pocillopora_acuta_HIv2___RNAseq.g14871.t1;Pocillopora_acuta_HIv2___RNAseq.g17965.t1;Pocillopora_acuta_HIv2___RNAseq.g19392.t1;Pocillopora_acuta_HIv2___RNAseq.g19870.t1;Pocillopora_acuta_HIv2___RNAseq.g20413.t2;Pocillopora_acuta_HIv2___RNAseq.g22296.t1;Pocillopora_acuta_HIv2___RNAseq.g2263.t1b;Pocillopora_acuta_HIv2___RNAseq.g22964.t1;Pocillopora_acuta_HIv2___RNAseq.g23414.t1;Pocillopora_acuta_HIv2___RNAseq.g2519.t1;Pocillopora_acuta_HIv2___RNAseq.g25689.t1;Pocillopora_acuta_HIv2___RNAseq.g25867.t1;Pocillopora_acuta_HIv2___RNAseq.g27609.t1;Pocillopora_acuta_HIv2___RNAseq.g27978.t1;Pocillopora_acuta_HIv2___RNAseq.g28213.t1;Pocillopora_acuta_HIv2___RNAseq.g28741.t1;Pocillopora_acuta_HIv2___RNAseq.g28742.t1;Pocillopora_acuta_HIv2___RNAseq.g30398.t1;Pocillopora_acuta_HIv2___RNAseq.g3723.t1;Pocillopora_acuta_HIv2___RNAseq.g3854.t1;Pocillopora_acuta_HIv2___RNAseq.g6366.t1;Pocillopora_acuta_HIv2___RNAseq.g6379.t1;Pocillopora_acuta_HIv2___RNAseq.g6468.t1;Pocillopora_acuta_HIv2___RNAseq.g8004.t1;Pocillopora_acuta_HIv2___RNAseq.g8217.t1;Pocillopora_acuta_HIv2___RNAseq.g8890.t1;Pocillopora_acuta_HIv2___RNAseq.g9811.t1;Pocillopora_acuta_HIv2___TS.g1253.t1;Pocillopora_acuta_HIv2___TS.g14962.t1;Pocillopora_acuta_HIv2___TS.g2952.t1;Pocillopora_acuta_HIv2___TS.g305.t1"	"Metabotropic glutamate receptor 3 (mGluR3);Calcium/calmodulin-dependent protein kinase type II subunit alpha (CaM kinase II subunit alpha) (CaMK-II subunit alpha) (EC 2.7.11.17);Adenosine receptor A2b;Neuropeptide FF receptor 2 (G-protein coupled receptor 74) (Neuropeptide G-protein coupled receptor);Histamine H2 receptor (H2R) (HH2R) (Gastric receptor I);Pyroglutamylated RF-amide peptide receptor (AQ27) (G-protein coupled receptor 103) (Orexigenic neuropeptide QRFP receptor) (SP9155);Pyroglutamylated RF-amide peptide receptor (AQ27) (G-protein coupled receptor 103) (Orexigenic neuropeptide QRFP receptor) (SP9155);Adenosine receptor A2a;Sodium/potassium/calcium exchanger 4 (Na(+)/K(+)/Ca(2+)-exchange protein 4) (Solute carrier family 24 member 4);Dopamine receptor 4;Beta-1 adrenergic receptor (Beta-1 adrenoreceptor) (Beta-1 adrenoceptor) (x-BETA1AR);G-protein coupled receptor GRL101;Neuropeptide FF receptor 2 (G-protein coupled receptor 74) (G-protein coupled receptor HLWAR77) (Neuropeptide G-protein coupled receptor);Extracellular calcium-sensing receptor (CaSR) (Parathyroid cell calcium-sensing receptor) (PCaR1) (RaKCaR);Alpha-1A adrenergic receptor (Alpha-1A adrenoreceptor) (Alpha-1A adrenoceptor) (Alpha-1C adrenergic receptor);1-phosphatidylinositol 4,5-bisphosphate phosphodiesterase eta-2 (EC 3.1.4.11) (Phosphoinositide phospholipase C-eta-2) (Phosphoinositide phospholipase C-like 4) (PLC-L4) (Phospholipase C-like protein 4) (Phospholipase C-eta-2) (PLC-eta2);Gamma-aminobutyric acid type B receptor subunit 1 (GABA-B receptor 1) (GABA-B-R1) (GABA-BR1) (GABABR1) (Gb1);Ectonucleoside triphosphate diphosphohydrolase 1 (EC 3.6.1.5) (ATP diphosphohydrolase) (ATP-DPH) (ATPDase) (Ecto-ATP diphosphohydrolase 1) (Ecto-ATPDase 1) (Ecto-ATPase 1) (Ecto-apyrase) (Lymphoid cell activation antigen) (Nucleoside triphosphate diphosphohydrolase 1) (NTPDase1) (CD antigen CD39);BTB/POZ domain-containing protein KCTD16;Endothelin-converting enzyme 1 (ECE-1) (EC 3.4.24.71);Adhesion G-protein coupled receptor D1 (G-protein coupled receptor 133) (G-protein coupled receptor PGR25) [Cleaved into: Adhesion G-protein coupled receptor D1, N-terminal fragment (ADGRD1 N-terminal fragment); Adhesion G-protein coupled receptor D1, C-terminal fragment (ADGRD1 C-terminal fragment)];5-hydroxytryptamine receptor 1B (5-HT-1B) (5-HT1B) (Serotonin receptor 1B);Gamma-aminobutyric acid type B receptor subunit 2 (GABA-B receptor 2) (GABA-B-R2) (GABA-BR2) (GABABR2) (Gb2) (G-protein coupled receptor 51) (HG20);Melatonin receptor type 1A (Mel-1A-R) (Mel1a receptor);Arrestin domain-containing protein 3;cGMP-dependent 3',5'-cyclic phosphodiesterase (EC 3.1.4.17) (Cyclic GMP-stimulated phosphodiesterase) (CGS-PDE) (cGSPDE);Plasma membrane calcium-transporting ATPase 4 (PMCA4) (EC 7.2.2.10) (Matrix-remodeling-associated protein 1) (Plasma membrane calcium ATPase isoform 4) (Plasma membrane calcium pump isoform 4);QRFP-like peptide receptor;Glycine receptor subunit alpha-1 (Glycine receptor 48 kDa subunit) (Glycine receptor strychnine-binding subunit);LWamide neuropeptides [Cleaved into: LWamide I; LWamide II; LWS];Pyroglutamylated RF-amide peptide receptor (AQ27) (G-protein coupled receptor 103) (Orexigenic neuropeptide QRFP receptor) (SP9155);Adhesion G-protein coupled receptor D1 (G-protein coupled receptor 133) [Cleaved into: Adhesion G-protein coupled receptor D1, N-terminal fragment (ADGRD1 N-terminal fragment); Adhesion G-protein coupled receptor D1, C-terminal fragment (ADGRD1 C-terminal fragment)];Tachykinin-like peptides receptor 86C (NKD);Adhesion G protein-coupled receptor L4;Adhesion G-protein coupled receptor D1 (G-protein coupled receptor 133) [Cleaved into: Adhesion G-protein coupled receptor D1, N-terminal fragment (ADGRD1 N-terminal fragment); Adhesion G-protein coupled receptor D1, C-terminal fragment (ADGRD1 C-terminal fragment)];Adenosine receptor A2a;Dysbindin (Biogenesis of lysosome-related organelles complex 1 subunit 8) (BLOC-1 subunit 8) (Dysbindin-1) (Dystrobrevin-binding protein 1) (Hermansky-Pudlak syndrome 7 protein) (HPS7 protein);LWamide neuropeptides [Cleaved into: LWamide I; Metamorphosin A (MMA) (LWamide II); LWamide III; LWamide IV; LWamide V; LWamide VI; LWamide VII; LWamide VIII; LWamide IX];Follicle-stimulating hormone receptor (FSH-R) (Follitropin receptor);Neuropeptide FF receptor 2 (G-protein coupled receptor 74) (Neuropeptide NPFF receptor);Alpha-1A adrenergic receptor (Alpha-1A adrenoreceptor) (Alpha-1A adrenoceptor) (MAR1);Diacylglycerol kinase beta (DAG kinase beta) (EC 2.7.1.107) (Diglyceride kinase beta) (DGK-beta);Adhesion G-protein coupled receptor D1 (G-protein coupled receptor 133) [Cleaved into: Adhesion G-protein coupled receptor D1, N-terminal fragment (ADGRD1 N-terminal fragment); Adhesion G-protein coupled receptor D1, C-terminal fragment (ADGRD1 C-terminal fragment)];Gamma-aminobutyric acid type B receptor subunit 2 (GABA-B receptor 2) (GABA-B-R2) (GABA-BR2) (GABABR2) (Gb2) (G-protein coupled receptor 51) (HG20)"
"GO:0002088"	"lens development in camera-type eye"	"The process whose specific outcome is the progression of the lens over time, from its formation to the mature structure. The lens is a transparent structure in the eye through which light is focused onto the retina. An example of this process is found in Mus musculus."	"22.857% (8/35)"	0.003706427	2.43	"Pocillopora_acuta_HIv2___RNAseq.22067_t;Pocillopora_acuta_HIv2___RNAseq.26564_t;Pocillopora_acuta_HIv2___RNAseq.g11345.t1;Pocillopora_acuta_HIv2___RNAseq.g27673.t1;Pocillopora_acuta_HIv2___RNAseq.g2995.t1;Pocillopora_acuta_HIv2___RNAseq.g3743.t1;Pocillopora_acuta_HIv2___RNAseq.g7553.t1;Pocillopora_acuta_HIv2___TS.g9752.t3"	"Protein Wnt-2b;Transcription factor AP-2-alpha (AP2-alpha) (AP-2 transcription factor) (Activating enhancer-binding protein 2-alpha) (Activator protein 2) (AP-2);Tropomodulin-1 (Erythrocyte tropomodulin) (E-Tmod);Paired box protein Pax-6 (Oculorhombin);Transcription factor HES-4-A (Hairy and enhancer of split 4-A) (Protein hairy-2) (Xhairy2) (Protein hairy-2a) (Xhairy2a);Protein sprouty homolog 2 (Spry-2);Protocadherin Fat 1 (Cadherin family member 7) (Cadherin-related tumor suppressor homolog) (Protein fat homolog) [Cleaved into: Protocadherin Fat 1, nuclear form];Protocadherin Fat 1 (Cadherin family member 7) (Cadherin-related tumor suppressor homolog) (Protein fat homolog) [Cleaved into: Protocadherin Fat 1, nuclear form]"
"GO:1902476"	"chloride transmembrane transport"	NA	"30% (9/30)"	0.0002452925	3.61	"Pocillopora_acuta_HIv2___RNAseq.g14871.t1;Pocillopora_acuta_HIv2___RNAseq.g17622.t1;Pocillopora_acuta_HIv2___RNAseq.g19042.t1;Pocillopora_acuta_HIv2___RNAseq.g21572.t1a;Pocillopora_acuta_HIv2___RNAseq.g22644.t1;Pocillopora_acuta_HIv2___RNAseq.g27413.t1;Pocillopora_acuta_HIv2___RNAseq.g28251.t1;Pocillopora_acuta_HIv2___RNAseq.g28741.t1;Pocillopora_acuta_HIv2___TS.g14315.t1b"	"Extracellular calcium-sensing receptor (CaSR) (Parathyroid cell calcium-sensing receptor) (PCaR1) (RaKCaR);Methylosome subunit pICln (Chloride channel, nucleotide sensitive 1A) (Chloride conductance regulatory protein ICln) (I(Cln));Anoctamin-7 (Dresden transmembrane protein of the prostate) (D-TMPP) (IPCA-5) (New gene expressed in prostate) (Prostate cancer-associated protein 5) (Transmembrane protein 16G);Gamma-aminobutyric acid receptor subunit beta-3 (GABA(A) receptor subunit beta-3) (GABAAR subunit beta-3);Excitatory amino acid transporter 3 (Excitatory amino-acid carrier 1) (Sodium-dependent glutamate/aspartate transporter 3) (Solute carrier family 1 member 1);Gamma-aminobutyric acid receptor subunit beta-3 (GABA(A) receptor subunit beta-3) (GABAAR subunit beta-3);Sodium- and chloride-dependent GABA transporter 1 (GAT-1) (Solute carrier family 6 member 1);Glycine receptor subunit alpha-1 (Glycine receptor 48 kDa subunit) (Glycine receptor strychnine-binding subunit);Solute carrier family 12 member 8"
