GO.ID	term	definition	Oral_elim.genes_frequency	Oral_elim.pvalue	Oral_elim.-log10_pvalue	Oral_elim.Significant_genes	Oral_elim.Significant_genes_symbol
"GO:0009612"	"response to mechanical stimulus"	"Any process that results in a change in state or activity of a cell or an organism (in terms of movement, secretion, enzyme production, gene expression, etc.) as a result of a mechanical stimulus."	"15.929% (18/113)"	0.001800111	2.74	"Pocillopora_acuta_HIv2___RNAseq.10010_t;Pocillopora_acuta_HIv2___RNAseq.g13552.t1;Pocillopora_acuta_HIv2___RNAseq.g14886.t1;Pocillopora_acuta_HIv2___RNAseq.g21476.t1;Pocillopora_acuta_HIv2___RNAseq.g21572.t1a;Pocillopora_acuta_HIv2___RNAseq.g2263.t1b;Pocillopora_acuta_HIv2___RNAseq.g27413.t1;Pocillopora_acuta_HIv2___RNAseq.g27609.t1;Pocillopora_acuta_HIv2___RNAseq.g28270.t1;Pocillopora_acuta_HIv2___RNAseq.g31038.t1;Pocillopora_acuta_HIv2___RNAseq.g701.t1;Pocillopora_acuta_HIv2___RNAseq.g702.t1;Pocillopora_acuta_HIv2___RNAseq.g9027.t1;Pocillopora_acuta_HIv2___RNAseq.g9466.t1;Pocillopora_acuta_HIv2___TS.g10198.t2;Pocillopora_acuta_HIv2___TS.g15134.t1;Pocillopora_acuta_HIv2___TS.g21857.t1;Pocillopora_acuta_HIv2___TS.g4109.t3"	"Transient receptor potential cation channel subfamily A member 1 (Ankyrin-like with transmembrane domains protein 1) (Transformation-sensitive protein p120) (p120) (Wasabi receptor);Voltage-gated potassium channel KCNC1 (NGK2) (Potassium voltage-gated channel subfamily C member 1) (Voltage-gated potassium channel subunit Kv3.1) (Voltage-gated potassium channel subunit Kv4);Mitogen-activated protein kinase kinase kinase 2 (EC 2.7.11.25) (MAPK/ERK kinase kinase 2) (MEK kinase 2) (MEKK 2);Tenascin (TN) (Cytotactin) (GMEM) (GP 150-225) (Glioma-associated-extracellular matrix antigen) (Hexabrachion) (JI) (Myotendinous antigen) (Neuronectin) (Tenascin-C) (TN-C);Gamma-aminobutyric acid receptor subunit beta-3 (GABA(A) receptor subunit beta-3) (GABAAR subunit beta-3);Endothelin-converting enzyme 1 (ECE-1) (EC 3.4.24.71);Gamma-aminobutyric acid receptor subunit beta-3 (GABA(A) receptor subunit beta-3) (GABAAR subunit beta-3);cGMP-dependent 3',5'-cyclic phosphodiesterase (EC 3.1.4.17) (Cyclic GMP-stimulated phosphodiesterase) (CGS-PDE) (cGSPDE);Bcl-2 homologous antagonist/killer (Apoptosis regulator BAK);ETS translocation variant 1 (Ets-related protein 81);Polycystin-2 (Polycystic kidney disease 2 protein homolog);Sperm receptor for egg jelly (suREJ);Bone morphogenetic protein 6 (BMP-6) (VG-1-related protein) (VG-1-R) (VGR-1);Transient receptor potential cation channel subfamily A member 1 (Ankyrin-like with transmembrane domains protein 1) (Wasabi receptor);Phosphatidylinositol phosphatase PTPRQ (EC 3.1.3.67) (EC 3.1.3.86) (EC 3.1.3.95) (Receptor-type tyrosine-protein phosphatase Q) (PTP-RQ) (R-PTP-Q);Mechanosensory protein 2;Polycystin-1-like protein 3 (Polycystin-1L3) (PC1-like 3 protein) (Polycystic kidney disease protein 1-like 3);Pejvakin (Autosomal recessive deafness type 59 protein)"
"GO:0045467"	"R7 cell development"	"The process whose specific outcome is the progression of the R7 photoreceptor over time, from its formation to the mature structure. The R7 photoreceptor is the last photoreceptor to develop in the ommatidium."	"66.667% (4/6)"	0.0004184989	3.38	"Pocillopora_acuta_HIv2___RNAseq.g12287.t1;Pocillopora_acuta_HIv2___RNAseq.g12289.t1;Pocillopora_acuta_HIv2___RNAseq.g9334.t1;Pocillopora_acuta_HIv2___TS.g1768.t1"	"Tyrosine-protein phosphatase Lar (EC 3.1.3.48) (Protein-tyrosine-phosphate phosphohydrolase) (dLAR);Tyrosine-protein phosphatase Lar (EC 3.1.3.48) (Protein-tyrosine-phosphate phosphohydrolase) (dLAR);Tyrosine-protein phosphatase Lar (EC 3.1.3.48) (Protein-tyrosine-phosphate phosphohydrolase) (dLAR);Tyrosine-protein phosphatase Lar (EC 3.1.3.48) (Protein-tyrosine-phosphate phosphohydrolase) (dLAR)"
"GO:0051693"	"actin filament capping"	"The binding of a protein or protein complex to the end of an actin filament, thus preventing the addition, exchange or removal of further actin subunits."	"26.923% (7/26)"	0.002430033	2.61	"Pocillopora_acuta_HIv2___RNAseq.g11345.t1;Pocillopora_acuta_HIv2___RNAseq.g11810.t1;Pocillopora_acuta_HIv2___RNAseq.g3051.t1;Pocillopora_acuta_HIv2___RNAseq.g30836.t1;Pocillopora_acuta_HIv2___RNAseq.g3142.t1a;Pocillopora_acuta_HIv2___RNAseq.g3840.t1;Pocillopora_acuta_HIv2___TS.g18947.t1"	"Tropomodulin-1 (Erythrocyte tropomodulin) (E-Tmod);Spectrin beta chain, erythrocytic (Beta-I spectrin);Villin-1;Spectrin beta chain, non-erythrocytic 2 (Beta SpIII sigma 1) (Beta-III spectrin) (Glutamate transporter EAAT4-associated protein 41) (SPNB-3) (Spectrin-like protein GTRAP41);Myotrophin;Advillin (p92);Spectrin beta chain, non-erythrocytic 2 (Beta SpIII sigma 1) (Beta-III spectrin) (Glutamate transporter EAAT4-associated protein 41) (SPNB-3) (Spectrin-like protein GTRAP41)"
"GO:0046314"	"phosphocreatine biosynthetic process"	"The chemical reactions and pathways resulting in the formation of phosphocreatine, a phosphagen of creatine which is synthesized and broken down by creatine phosphokinase."	"66.667% (4/6)"	0.0004184989	3.38	"Pocillopora_acuta_HIv2___RNAseq.g15574.t1;Pocillopora_acuta_HIv2___RNAseq.g15577.t1;Pocillopora_acuta_HIv2___RNAseq.g15584.t1;Pocillopora_acuta_HIv2___RNAseq.g2258.t1"	"Creatine kinase, testis isozyme (EC 2.7.3.2);Creatine kinase M-type (EC 2.7.3.2) (Creatine kinase M chain) (Creatine phosphokinase M-type) (CPK-M) (M-CK);Creatine kinase M-type (EC 2.7.3.2) (Creatine kinase M chain) (Creatine phosphokinase M-type) (CPK-M) (M-CK);Arginine kinase (AK) (EC 2.7.3.3)"
"GO:0030001"	"metal ion transport"	"The directed movement of metal ions, any metal ion with an electric charge, into, out of or within a cell, or between cells, by means of some agent such as a transporter or pore."	"11.239% (39/347)"	0.007046026	2.15	"Pocillopora_acuta_HIv2___RNAseq.10010_t;Pocillopora_acuta_HIv2___RNAseq.g1217.t1;Pocillopora_acuta_HIv2___RNAseq.g12898.t1;Pocillopora_acuta_HIv2___RNAseq.g13552.t1;Pocillopora_acuta_HIv2___RNAseq.g14489.t1;Pocillopora_acuta_HIv2___RNAseq.g14817.t1;Pocillopora_acuta_HIv2___RNAseq.g14871.t1;Pocillopora_acuta_HIv2___RNAseq.g15097.t1;Pocillopora_acuta_HIv2___RNAseq.g16474.t1;Pocillopora_acuta_HIv2___RNAseq.g17559.t1;Pocillopora_acuta_HIv2___RNAseq.g17622.t1;Pocillopora_acuta_HIv2___RNAseq.g18121.t1;Pocillopora_acuta_HIv2___RNAseq.g18123.t1;Pocillopora_acuta_HIv2___RNAseq.g1838.t1;Pocillopora_acuta_HIv2___RNAseq.g18966.t1;Pocillopora_acuta_HIv2___RNAseq.g24029.t1;Pocillopora_acuta_HIv2___RNAseq.g24761.t1;Pocillopora_acuta_HIv2___RNAseq.g26118.t1;Pocillopora_acuta_HIv2___RNAseq.g26672.t1;Pocillopora_acuta_HIv2___RNAseq.g27978.t1;Pocillopora_acuta_HIv2___RNAseq.g2813.t4;Pocillopora_acuta_HIv2___RNAseq.g28251.t1;Pocillopora_acuta_HIv2___RNAseq.g28270.t1;Pocillopora_acuta_HIv2___RNAseq.g28816.t1;Pocillopora_acuta_HIv2___RNAseq.g29275.t1;Pocillopora_acuta_HIv2___RNAseq.g30992.t1;Pocillopora_acuta_HIv2___RNAseq.g30994.t1a;Pocillopora_acuta_HIv2___RNAseq.g4469.t1;Pocillopora_acuta_HIv2___RNAseq.g4879.t1;Pocillopora_acuta_HIv2___RNAseq.g4919.t1;Pocillopora_acuta_HIv2___RNAseq.g6094.t2;Pocillopora_acuta_HIv2___RNAseq.g701.t1;Pocillopora_acuta_HIv2___RNAseq.g8093.t1;Pocillopora_acuta_HIv2___RNAseq.g898.t1b;Pocillopora_acuta_HIv2___RNAseq.g9466.t1;Pocillopora_acuta_HIv2___TS.g14315.t1b;Pocillopora_acuta_HIv2___TS.g14552.t1;Pocillopora_acuta_HIv2___TS.g15134.t1;Pocillopora_acuta_HIv2___TS.g21857.t1"	"Transient receptor potential cation channel subfamily A member 1 (Ankyrin-like with transmembrane domains protein 1) (Transformation-sensitive protein p120) (p120) (Wasabi receptor);Adenosine receptor A2a;Sodium/potassium/calcium exchanger 4 (Na(+)/K(+)/Ca(2+)-exchange protein 4) (Solute carrier family 24 member 4);Voltage-gated potassium channel KCNC1 (NGK2) (Potassium voltage-gated channel subfamily C member 1) (Voltage-gated potassium channel subunit Kv3.1) (Voltage-gated potassium channel subunit Kv4);Transmembrane protein 94 (Endoplasmic reticulum magnesium ATPase);Kelch-like protein 3;Extracellular calcium-sensing receptor (CaSR) (Parathyroid cell calcium-sensing receptor) (PCaR1) (RaKCaR);Potassium voltage-gated channel subfamily A member 10 (Voltage-gated potassium channel subunit Kv1.8);Solute carrier family 12 member 2 (Bumetanide-sensitive sodium-(potassium)-chloride cotransporter 2) (BSC2) (Na-K-2Cl cotransporter 1) (NKCC1) (Na-K-CL symporter);TWiK family of potassium channels protein 7;Methylosome subunit pICln (Chloride channel, nucleotide sensitive 1A) (Chloride conductance regulatory protein ICln) (I(Cln));Sodium/calcium exchanger NCL2 (Na(+)/Ca(2+)-exchange protein NCL2) (OsEFCAX2) (Protein NCX-like 2) (OsNCL2);Melanotransferrin (Membrane-bound transferrin-like protein p97) (MTf) (CD antigen CD228);m-AAA protease-interacting protein 1, mitochondrial (Matrix AAA peptidase-interacting protein 1);Potassium voltage-gated channel subfamily A member 2 (RAK) (RBK2) (RCK5) (Voltage-gated potassium channel subunit Kv1.2);Epithelial sodium channel subunit alpha (Alpha-ENaC) (Epithelial Na(+) channel subunit alpha) (Alpha-NaCH) (Amiloride-sensitive sodium channel subunit alpha) (Nonvoltage-gated sodium channel 1 subunit alpha) (SCNEA);Annexin A6 (Annexin VI) (Annexin-6);Voltage-dependent calcium channel type A subunit alpha-1 (Cacophony protein);Neuronal acetylcholine receptor subunit alpha-7 (nAChR7) (Nicotinic acetylcholine receptor subunit alpha-7);Plasma membrane calcium-transporting ATPase 4 (PMCA4) (EC 7.2.2.10) (Matrix-remodeling-associated protein 1) (Plasma membrane calcium ATPase isoform 4) (Plasma membrane calcium pump isoform 4);EF-hand calcium-binding domain-containing protein 4B (Calcium release-activated channel regulator 2A) (Ras-related protein Rab-46) (EC 3.6.5.2);Sodium- and chloride-dependent GABA transporter 1 (GAT-1) (Solute carrier family 6 member 1);Bcl-2 homologous antagonist/killer (Apoptosis regulator BAK);Proton-coupled zinc antiporter SLC30A8 (Solute carrier family 30 member 8) (Zinc transporter 8) (ZnT-8);Potassium voltage-gated channel subfamily A member 2 (KC22) (Voltage-gated potassium channel subunit Kv1.2);Solute carrier family 23 member 1 (Na(+)/L-ascorbic acid transporter 1) (Sodium-dependent vitamin C transporter 1) (Yolk sac permease-like molecule 3);Solute carrier family 23 member 2 (Na(+)/L-ascorbic acid transporter 2) (Sodium-dependent vitamin C transporter 2);Endosomal/lysosomal proton channel TMEM175 (Potassium channel TMEM175) (Transmembrane protein 175);Serotransferrin;Ankyrin-2 (ANK-2) (Ankyrin-B) (Brain ankyrin) (Non-erythroid ankyrin);Calcium-activated potassium channel subunit alpha-1 (BK channel) (BKCA alpha) (Calcium-activated potassium channel, subfamily M subunit alpha-1) (K(VCA)alpha) (KCa1.1) (Maxi K channel) (MaxiK) (Slo-alpha) (Slo1) (Slowpoke homolog) (Slo homolog) (hSlo);Polycystin-2 (Polycystic kidney disease 2 protein homolog);Chromodomain-helicase-DNA-binding protein 7 (CHD-7) (EC 3.6.4.-) (ATP-dependent helicase CHD7);RAC-gamma serine/threonine-protein kinase (EC 2.7.11.1) (Protein kinase Akt-3) (Protein kinase B gamma) (PKB gamma) (RAC-PK-gamma);Transient receptor potential cation channel subfamily A member 1 (Ankyrin-like with transmembrane domains protein 1) (Wasabi receptor);Solute carrier family 12 member 8;Cadherin-23 (Otocadherin);Mechanosensory protein 2;Polycystin-1-like protein 3 (Polycystin-1L3) (PC1-like 3 protein) (Polycystic kidney disease protein 1-like 3)"
"GO:1902022"	"L-lysine transport"	NA	"71.429% (5/7)"	4.354457e-05	4.36	"Pocillopora_acuta_HIv2___RNAseq.25384_t;Pocillopora_acuta_HIv2___RNAseq.g14744.t1;Pocillopora_acuta_HIv2___RNAseq.g19152.t1;Pocillopora_acuta_HIv2___RNAseq.g21527.t1;Pocillopora_acuta_HIv2___RNAseq.g25241.t1"	"Cationic amino acid transporter 2 (CAT-2) (CAT2) (cCAT-2) (Low affinity cationic amino acid transporter 2) (Solute carrier family 7 member 2);Protein btn-1;High affinity cationic amino acid transporter 1 (CAT-1) (CAT1) (Ecotropic retroviral leukemia receptor homolog) (Ecotropic retrovirus receptor homolog) (Solute carrier family 7 member 1) (System Y+ basic amino acid transporter);Protein BTN1;Mitochondrial basic amino acids transporter (Carnitine/acylcarnitine translocase-like) (CACT-like) (Mitochondrial carnitine/acylcarnitine carrier protein CACL) (Mitochondrial ornithine transporter 3) (Solute carrier family 25 member 29)"
"GO:0014832"	"urinary bladder smooth muscle contraction"	"A process in which force is generated within smooth muscle tissue, resulting in a change in muscle geometry. This process occurs in the urinary bladder. Force generation involves a chemo-mechanical energy conversion step that is carried out by the actin/myosin complex activity, which generates force through ATP hydrolysis. The urinary bladder is a musculomembranous sac along the urinary tract."	"44.444% (4/9)"	0.002926368	2.53	"Pocillopora_acuta_HIv2___RNAseq.10010_t;Pocillopora_acuta_HIv2___RNAseq.g27978.t1;Pocillopora_acuta_HIv2___RNAseq.g6094.t2;Pocillopora_acuta_HIv2___RNAseq.g9466.t1"	"Transient receptor potential cation channel subfamily A member 1 (Ankyrin-like with transmembrane domains protein 1) (Transformation-sensitive protein p120) (p120) (Wasabi receptor);Plasma membrane calcium-transporting ATPase 4 (PMCA4) (EC 7.2.2.10) (Matrix-remodeling-associated protein 1) (Plasma membrane calcium ATPase isoform 4) (Plasma membrane calcium pump isoform 4);Calcium-activated potassium channel subunit alpha-1 (BK channel) (BKCA alpha) (Calcium-activated potassium channel, subfamily M subunit alpha-1) (K(VCA)alpha) (KCa1.1) (Maxi K channel) (MaxiK) (Slo-alpha) (Slo1) (Slowpoke homolog) (Slo homolog) (hSlo);Transient receptor potential cation channel subfamily A member 1 (Ankyrin-like with transmembrane domains protein 1) (Wasabi receptor)"
"GO:0050953"	"sensory perception of light stimulus"	"The series of events required for an organism to receive a sensory light stimulus, convert it to a molecular signal, and recognize and characterize the signal. This is a neurological process."	"14.851% (15/101)"	0.008111374	2.09	"Pocillopora_acuta_HIv2___RNAseq.665_t;Pocillopora_acuta_HIv2___RNAseq.g11580.t1;Pocillopora_acuta_HIv2___RNAseq.g21265.t1;Pocillopora_acuta_HIv2___RNAseq.g243.t1;Pocillopora_acuta_HIv2___RNAseq.g26058.t1;Pocillopora_acuta_HIv2___RNAseq.g28741.t1;Pocillopora_acuta_HIv2___RNAseq.g29670.t2;Pocillopora_acuta_HIv2___RNAseq.g3166.t1;Pocillopora_acuta_HIv2___RNAseq.g7452.t1;Pocillopora_acuta_HIv2___RNAseq.g7454.t2;Pocillopora_acuta_HIv2___RNAseq.g8520.t1;Pocillopora_acuta_HIv2___TS.g14552.t1;Pocillopora_acuta_HIv2___TS.g23175.t1;Pocillopora_acuta_HIv2___TS.g24807.t1;Pocillopora_acuta_HIv2___TS.g9513.t1"	"POU domain, class 4, transcription factor 3 (Brain-specific homeobox/POU domain protein 3C) (Brain-3C) (Brn-3C);Hemicentin-1 (Fibulin-6) (FIBL-6);Retinol dehydrogenase 8 (EC 1.1.1.300) (Photoreceptor outer segment all-trans retinol dehydrogenase);Nephrocystin-3;Rhodopsin, GQ-coupled (GQ-rhodopsin);Glycine receptor subunit alpha-1 (Glycine receptor 48 kDa subunit) (Glycine receptor strychnine-binding subunit);Cyclic nucleotide-gated channel alpha-3 (CNG channel alpha-3) (CNG-3) (CNG3) (Cone photoreceptor cGMP-gated channel subunit alpha-3);Rhodopsin;Nephrocystin-3;Nephrocystin-3;Hemicentin-1 (Fibulin-6) (FIBL-6);Cadherin-23 (Otocadherin);Hemicentin-1 (Fibulin-6) (FIBL-6);Hemicentin-1 (Fibulin-6) (FIBL-6);Carcinine transporter"
"GO:0050955"	"thermoception"	"The series of events required for an organism to receive a temperature stimulus, convert it to a molecular signal, and recognize and characterize the signal. Thermoception in larger animals is mainly done in the skin; mammals have at least two types of sensor, for detecting heat (temperatures above body temperature) and cold (temperatures below body temperature)."	"40% (4/10)"	0.00458963	2.34	"Pocillopora_acuta_HIv2___RNAseq.10010_t;Pocillopora_acuta_HIv2___RNAseq.g5711.t2;Pocillopora_acuta_HIv2___RNAseq.g9466.t1;Pocillopora_acuta_HIv2___TS.g14960.t2"	"Transient receptor potential cation channel subfamily A member 1 (Ankyrin-like with transmembrane domains protein 1) (Transformation-sensitive protein p120) (p120) (Wasabi receptor);WD repeat-containing protein 47 (Neuronal enriched MAP interacting protein) (Nemitin);Transient receptor potential cation channel subfamily A member 1 (Ankyrin-like with transmembrane domains protein 1) (Wasabi receptor);Glutamate receptor ionotropic, kainate 2 (GluK2) (Glutamate receptor 6) (GluR-6) (GluR6)"
"GO:0050906"	"detection of stimulus involved in sensory perception"	"The series of events involved in sensory perception in which a sensory stimulus is received and converted into a molecular signal."	"25.641% (10/39)"	0.0004598441	3.34	"Pocillopora_acuta_HIv2___RNAseq.10010_t;Pocillopora_acuta_HIv2___RNAseq.g12898.t1;Pocillopora_acuta_HIv2___RNAseq.g5711.t2;Pocillopora_acuta_HIv2___RNAseq.g9466.t1;Pocillopora_acuta_HIv2___TS.g10198.t2;Pocillopora_acuta_HIv2___TS.g14960.t2;Pocillopora_acuta_HIv2___TS.g15134.t1;Pocillopora_acuta_HIv2___TS.g21857.t1;Pocillopora_acuta_HIv2___TS.g4109.t3;Pocillopora_acuta_HIv2___TS.g9513.t1"	"Transient receptor potential cation channel subfamily A member 1 (Ankyrin-like with transmembrane domains protein 1) (Transformation-sensitive protein p120) (p120) (Wasabi receptor);Sodium/potassium/calcium exchanger 4 (Na(+)/K(+)/Ca(2+)-exchange protein 4) (Solute carrier family 24 member 4);WD repeat-containing protein 47 (Neuronal enriched MAP interacting protein) (Nemitin);Transient receptor potential cation channel subfamily A member 1 (Ankyrin-like with transmembrane domains protein 1) (Wasabi receptor);Phosphatidylinositol phosphatase PTPRQ (EC 3.1.3.67) (EC 3.1.3.86) (EC 3.1.3.95) (Receptor-type tyrosine-protein phosphatase Q) (PTP-RQ) (R-PTP-Q);Glutamate receptor ionotropic, kainate 2 (GluK2) (Glutamate receptor 6) (GluR-6) (GluR6);Mechanosensory protein 2;Polycystin-1-like protein 3 (Polycystin-1L3) (PC1-like 3 protein) (Polycystic kidney disease protein 1-like 3);Pejvakin (Autosomal recessive deafness type 59 protein);Carcinine transporter"
"GO:0001956"	"positive regulation of neurotransmitter secretion"	"Any process that activates or increases the frequency, rate or extent of the regulated release of a neurotransmitter."	"40% (4/10)"	0.00458963	2.34	"Pocillopora_acuta_HIv2___RNAseq.g1217.t1;Pocillopora_acuta_HIv2___RNAseq.g28815.t1;Pocillopora_acuta_HIv2___RNAseq.g4031.t1c;Pocillopora_acuta_HIv2___RNAseq.g8004.t1"	"Adenosine receptor A2a;Synaptotagmin-1 (Synaptotagmin I) (SytI);Synaptotagmin-1 (Synaptotagmin I) (SytI);Dysbindin (Biogenesis of lysosome-related organelles complex 1 subunit 8) (BLOC-1 subunit 8) (Dysbindin-1) (Dystrobrevin-binding protein 1) (Hermansky-Pudlak syndrome 7 protein) (HPS7 protein)"
"GO:0060080"	"inhibitory postsynaptic potential"	"A process that causes a temporary decrease in postsynaptic membrane potential due to the flow of negatively charged ions into the postsynaptic cell. The flow of ions that causes an IPSP is an inhibitory postsynaptic current (IPSC) and makes it more difficult for the neuron to fire an action potential."	"55.556% (5/9)"	0.000229928	3.64	"Pocillopora_acuta_HIv2___RNAseq.g1217.t1;Pocillopora_acuta_HIv2___RNAseq.g21572.t1a;Pocillopora_acuta_HIv2___RNAseq.g27413.t1;Pocillopora_acuta_HIv2___RNAseq.g28741.t1;Pocillopora_acuta_HIv2___RNAseq.g6468.t1"	"Adenosine receptor A2a;Gamma-aminobutyric acid receptor subunit beta-3 (GABA(A) receptor subunit beta-3) (GABAAR subunit beta-3);Gamma-aminobutyric acid receptor subunit beta-3 (GABA(A) receptor subunit beta-3) (GABAAR subunit beta-3);Glycine receptor subunit alpha-1 (Glycine receptor 48 kDa subunit) (Glycine receptor strychnine-binding subunit);Adenosine receptor A2a"
"GO:0034505"	"tooth mineralization"	"The process in which calcium salts are deposited into calcareous tooth structures such as dental enamel, dentin and cementum."	"36.842% (7/19)"	0.0002957958	3.53	"Pocillopora_acuta_HIv2___RNAseq.26564_t;Pocillopora_acuta_HIv2___RNAseq.g12898.t1;Pocillopora_acuta_HIv2___RNAseq.g20688.t1;Pocillopora_acuta_HIv2___RNAseq.g6836.t1;Pocillopora_acuta_HIv2___RNAseq.g7241.t1;Pocillopora_acuta_HIv2___RNAseq.g7243.t1;Pocillopora_acuta_HIv2___RNAseq.g7248.t1"	"Transcription factor AP-2-alpha (AP2-alpha) (AP-2 transcription factor) (Activating enhancer-binding protein 2-alpha) (Activator protein 2) (AP-2);Sodium/potassium/calcium exchanger 4 (Na(+)/K(+)/Ca(2+)-exchange protein 4) (Solute carrier family 24 member 4);Thrombospondin-type laminin G domain and EAR repeat-containing protein (TSP-EAR);Thrombospondin-type laminin G domain and EAR repeat-containing protein (TSP-EAR);Thrombospondin-type laminin G domain and EAR repeat-containing protein (TSP-EAR);Thrombospondin-type laminin G domain and EAR repeat-containing protein (TSP-EAR);Thrombospondin-type laminin G domain and EAR repeat-containing protein (TSP-EAR)"
"GO:0060041"	"retina development in camera-type eye"	"The process whose specific outcome is the progression of the retina over time, from its formation to the mature structure. The retina is the innermost layer or coating at the back of the eyeball, which is sensitive to light and in which the optic nerve terminates."	"15% (15/100)"	0.007403548	2.13	"Pocillopora_acuta_HIv2___RNAseq.22067_t;Pocillopora_acuta_HIv2___RNAseq.26564_t;Pocillopora_acuta_HIv2___RNAseq.g11960.t1;Pocillopora_acuta_HIv2___RNAseq.g13060.t1;Pocillopora_acuta_HIv2___RNAseq.g13533.t1;Pocillopora_acuta_HIv2___RNAseq.g13970.t2;Pocillopora_acuta_HIv2___RNAseq.g22366.t1;Pocillopora_acuta_HIv2___RNAseq.g25248.t1a;Pocillopora_acuta_HIv2___RNAseq.g27673.t1;Pocillopora_acuta_HIv2___RNAseq.g27978.t1;Pocillopora_acuta_HIv2___RNAseq.g3580.t1;Pocillopora_acuta_HIv2___RNAseq.g8004.t1;Pocillopora_acuta_HIv2___RNAseq.g8093.t1;Pocillopora_acuta_HIv2___TS.g15672.t1;Pocillopora_acuta_HIv2___TS.g19999.t1"	"Protein Wnt-2b;Transcription factor AP-2-alpha (AP2-alpha) (AP-2 transcription factor) (Activating enhancer-binding protein 2-alpha) (Activator protein 2) (AP-2);Trafficking protein particle complex subunit 11 (Protein foie gras);Low-density lipoprotein receptor-related protein 6 (LRP-6);Protein sidekick-2;Tetratricopeptide repeat protein 8 (TPR repeat protein 8) (Bardet-Biedl syndrome 8 protein);Neuronal migration protein doublecortin (Doublin) (Lissencephalin-X) (Lis-X);U4/U6 small nuclear ribonucleoprotein Prp31 (Pre-mRNA-processing factor 31);Paired box protein Pax-6 (Oculorhombin);Plasma membrane calcium-transporting ATPase 4 (PMCA4) (EC 7.2.2.10) (Matrix-remodeling-associated protein 1) (Plasma membrane calcium ATPase isoform 4) (Plasma membrane calcium pump isoform 4);Pancreas transcription factor 1 subunit alpha (Pancreas-specific transcription factor 1a) (bHLH transcription factor p48);Dysbindin (Biogenesis of lysosome-related organelles complex 1 subunit 8) (BLOC-1 subunit 8) (Dysbindin-1) (Dystrobrevin-binding protein 1) (Hermansky-Pudlak syndrome 7 protein) (HPS7 protein);Chromodomain-helicase-DNA-binding protein 7 (CHD-7) (EC 3.6.4.-) (ATP-dependent helicase CHD7);Low-density lipoprotein receptor-related protein 5 (LRP-5) (Low-density lipoprotein receptor-related protein 7) (LRP-7);Retinal homeobox protein Rx2"
"GO:0051923"	"sulfation"	"The addition of a sulfate group to a molecule."	"44.444% (4/9)"	0.002926368	2.53	"Pocillopora_acuta_HIv2___RNAseq.10969_t;Pocillopora_acuta_HIv2___RNAseq.g21538.t1;Pocillopora_acuta_HIv2___RNAseq.g9090.t1;Pocillopora_acuta_HIv2___RNAseq.g9093.t1"	"Sulfotransferase 1B1 (ST1B1) (EC 2.8.2.1) (Sulfotransferase 1B2) (Sulfotransferase family cytosolic 1B member 1) (Thyroid hormone sulfotransferase);Sulfotransferase 1B1 (ST1B1) (EC 2.8.2.1) (Sulfotransferase 1B2) (Sulfotransferase family cytosolic 1B member 1) (Thyroid hormone sulfotransferase);Sulfotransferase 1C2A (ST1C2A) (rSULT1C2A) (EC 2.8.2.1) (Sulfotransferase K2);Sulfotransferase 1C4 (ST1C4) (EC 2.8.2.1) (Sulfotransferase 1C2) (SULT1C#2)"
"GO:0051932"	"synaptic transmission, GABAergic"	"The vesicular release of gamma-aminobutyric acid (GABA). from a presynapse, across a chemical synapse, the subsequent activation of GABA receptors at the postsynapse of a target cell (neuron, muscle, or secretory cell) and the effects of this activation on the postsynaptic membrane potential and ionic composition of the postsynaptic cytosol. This process encompasses both spontaneous and evoked release of neurotransmitter and all parts of synaptic vesicle exocytosis. Evoked transmission starts with the arrival of an action potential at the presynapse."	"25.714% (9/35)"	0.0008618782	3.06	"Pocillopora_acuta_HIv2___RNAseq.g1217.t1;Pocillopora_acuta_HIv2___RNAseq.g13672.t1;Pocillopora_acuta_HIv2___RNAseq.g19870.t1;Pocillopora_acuta_HIv2___RNAseq.g21572.t1a;Pocillopora_acuta_HIv2___RNAseq.g2519.t1;Pocillopora_acuta_HIv2___RNAseq.g27413.t1;Pocillopora_acuta_HIv2___RNAseq.g28251.t1;Pocillopora_acuta_HIv2___RNAseq.g6468.t1;Pocillopora_acuta_HIv2___TS.g305.t1"	"Adenosine receptor A2a;Carbonic anhydrase 7 (EC 4.2.1.1) (Carbonate dehydratase VII) (Carbonic anhydrase VII) (CA-VII);Gamma-aminobutyric acid type B receptor subunit 1 (GABA-B receptor 1) (GABA-B-R1) (GABA-BR1) (GABABR1) (Gb1);Gamma-aminobutyric acid receptor subunit beta-3 (GABA(A) receptor subunit beta-3) (GABAAR subunit beta-3);Gamma-aminobutyric acid type B receptor subunit 2 (GABA-B receptor 2) (GABA-B-R2) (GABA-BR2) (GABABR2) (Gb2) (G-protein coupled receptor 51) (HG20);Gamma-aminobutyric acid receptor subunit beta-3 (GABA(A) receptor subunit beta-3) (GABAAR subunit beta-3);Sodium- and chloride-dependent GABA transporter 1 (GAT-1) (Solute carrier family 6 member 1);Adenosine receptor A2a;Gamma-aminobutyric acid type B receptor subunit 2 (GABA-B receptor 2) (GABA-B-R2) (GABA-BR2) (GABABR2) (Gb2) (G-protein coupled receptor 51) (HG20)"
