GO.cluster	IC	GO.ID	term	definition	Oral_elim.genes_frequency	Oral_elim.pvalue	Oral_elim.-log10_pvalue	Oral_elim.Significant_genes	Oral_elim.Significant_genes_symbol	Aboral_elim.genes_frequency	Aboral_elim.pvalue	Aboral_elim.-log10_pvalue	Aboral_elim.Significant_genes	Aboral_elim.Significant_genes_symbol
"6"	5.65	"GO:0005539"	"glycosaminoglycan binding"	"Binding to a glycan (polysaccharide) containing a substantial proportion of aminomonosaccharide residues."	"7.692% (8/104)"	0.5160146	0.29	NA	NA	"15.385% (16/104)"	0.001103398	2.96	"Pocillopora_acuta_HIv2___RNAseq.10263_t;Pocillopora_acuta_HIv2___RNAseq.g10385.t1;Pocillopora_acuta_HIv2___RNAseq.g10557.t1;Pocillopora_acuta_HIv2___RNAseq.g1075.t1;Pocillopora_acuta_HIv2___RNAseq.g12258.t1;Pocillopora_acuta_HIv2___RNAseq.g12281.t1;Pocillopora_acuta_HIv2___RNAseq.g15290.t1;Pocillopora_acuta_HIv2___RNAseq.g21518.t1;Pocillopora_acuta_HIv2___RNAseq.g28196.t1;Pocillopora_acuta_HIv2___RNAseq.g3780.t1;Pocillopora_acuta_HIv2___RNAseq.g3826.t1;Pocillopora_acuta_HIv2___RNAseq.g802.t1;Pocillopora_acuta_HIv2___TS.g1462.t1;Pocillopora_acuta_HIv2___TS.g18622.t1b;Pocillopora_acuta_HIv2___TS.g5006.t1b;Pocillopora_acuta_HIv2___TS.g5115.t2"	"Extracellular sulfatase Sulf-2 (hSulf-2) (Arylsulfatase) (EC 3.1.6.1) (N-acetylglucosamine-6-sulfatase) (EC 3.1.6.14) [Cleaved into: Extracellular sulfatase Sulf-2 secreted form];Fibroblast growth factor receptor-like 1 (FGF receptor-like protein 1) (FGF homologous factor receptor) (FGFR-like protein) (Fibroblast growth factor receptor 5) (FGFR-5);Fibroblast growth factor receptor-like 1;SPARC-related modular calcium-binding protein 2 (Secreted modular calcium-binding protein 2) (SMOC-2) (Smooth muscle-associated protein 2) (SMAP-2);Receptor-type tyrosine-protein phosphatase S (R-PTP-S) (EC 3.1.3.48) (Chick receptor tyrosine phosphatase alpha) (CRYP alpha) (CRYPalpha);Receptor-type tyrosine-protein phosphatase F (EC 3.1.3.48) (Leukocyte common antigen related) (LAR);Prothrombin (EC 3.4.21.5) (Coagulation factor II) [Cleaved into: Activation peptide fragment 1; Activation peptide fragment 2; Thrombin light chain; Thrombin heavy chain];Diamine oxidase [copper-containing] (Diamine oxidase) (EC 1.4.3.22) (Amine oxidase copper domain-containing protein 1) (Histaminase);Aggrecan core protein (Cartilage-specific proteoglycan core protein) (CSPCP) (Chondroitin sulfate proteoglycan core protein 1) (Chondroitin sulfate proteoglycan 1) [Cleaved into: Aggrecan core protein 2];Protein kinase C-binding protein NELL1 (NEL-like protein 1);Testican-2 (SPARC/osteonectin, CWCV, and Kazal-like domains proteoglycan 2);Fibroblast growth factor receptor 1-A (FGFR-1-A) (bFGF-R-1-A) (EC 2.7.10.1) (Basic fibroblast growth factor receptor 1-A);Fibrillin-1 (MP340) [Cleaved into: Asprosin];Agrin [Cleaved into: Agrin N-terminal 110 kDa subunit; Agrin C-terminal 110 kDa subunit; Agrin C-terminal 90 kDa fragment (C90); Agrin C-terminal 22 kDa fragment (C22)];Fibroblast growth factor receptor 1-A (FGFR-1-A) (bFGF-R-1-A) (EC 2.7.10.1) (Basic fibroblast growth factor receptor 1-A);Aggrecan core protein (Cartilage-specific proteoglycan core protein) (CSPCP)"
"6"	5.91	"GO:0008201"	"heparin binding"	"Binding to heparin, a member of a group of glycosaminoglycans found mainly as an intracellular component of mast cells and which consist predominantly of alternating alpha-(1->4)-linked D-galactose and N-acetyl-D-glucosamine-6-sulfate residues."	"8.642% (7/81)"	0.3992797	0.4	NA	NA	"13.58% (11/81)"	0.000160875	3.79	"Pocillopora_acuta_HIv2___RNAseq.g10385.t1;Pocillopora_acuta_HIv2___RNAseq.g10557.t1;Pocillopora_acuta_HIv2___RNAseq.g1075.t1;Pocillopora_acuta_HIv2___RNAseq.g12258.t1;Pocillopora_acuta_HIv2___RNAseq.g12281.t1;Pocillopora_acuta_HIv2___RNAseq.g15290.t1;Pocillopora_acuta_HIv2___RNAseq.g21518.t1;Pocillopora_acuta_HIv2___RNAseq.g3780.t1;Pocillopora_acuta_HIv2___RNAseq.g802.t1;Pocillopora_acuta_HIv2___TS.g1462.t1;Pocillopora_acuta_HIv2___TS.g5006.t1b"	"Fibroblast growth factor receptor-like 1 (FGF receptor-like protein 1) (FGF homologous factor receptor) (FGFR-like protein) (Fibroblast growth factor receptor 5) (FGFR-5);Fibroblast growth factor receptor-like 1;SPARC-related modular calcium-binding protein 2 (Secreted modular calcium-binding protein 2) (SMOC-2) (Smooth muscle-associated protein 2) (SMAP-2);Receptor-type tyrosine-protein phosphatase S (R-PTP-S) (EC 3.1.3.48) (Chick receptor tyrosine phosphatase alpha) (CRYP alpha) (CRYPalpha);Receptor-type tyrosine-protein phosphatase F (EC 3.1.3.48) (Leukocyte common antigen related) (LAR);Prothrombin (EC 3.4.21.5) (Coagulation factor II) [Cleaved into: Activation peptide fragment 1; Activation peptide fragment 2; Thrombin light chain; Thrombin heavy chain];Diamine oxidase [copper-containing] (Diamine oxidase) (EC 1.4.3.22) (Amine oxidase copper domain-containing protein 1) (Histaminase);Protein kinase C-binding protein NELL1 (NEL-like protein 1);Fibroblast growth factor receptor 1-A (FGFR-1-A) (bFGF-R-1-A) (EC 2.7.10.1) (Basic fibroblast growth factor receptor 1-A);Fibrillin-1 (MP340) [Cleaved into: Asprosin];Fibroblast growth factor receptor 1-A (FGFR-1-A) (bFGF-R-1-A) (EC 2.7.10.1) (Basic fibroblast growth factor receptor 1-A)"
"5"	7.82	"GO:0005158"	"insulin receptor binding"	"Binding to an insulin receptor."	"33.333% (4/12)"	0.009316571	2.03	"Pocillopora_acuta_HIv2___RNAseq.g12287.t1;Pocillopora_acuta_HIv2___RNAseq.g12289.t1;Pocillopora_acuta_HIv2___RNAseq.g9334.t1;Pocillopora_acuta_HIv2___TS.g1768.t1"	"Tyrosine-protein phosphatase Lar (EC 3.1.3.48) (Protein-tyrosine-phosphate phosphohydrolase) (dLAR);Tyrosine-protein phosphatase Lar (EC 3.1.3.48) (Protein-tyrosine-phosphate phosphohydrolase) (dLAR);Tyrosine-protein phosphatase Lar (EC 3.1.3.48) (Protein-tyrosine-phosphate phosphohydrolase) (dLAR);Tyrosine-protein phosphatase Lar (EC 3.1.3.48) (Protein-tyrosine-phosphate phosphohydrolase) (dLAR)"	"0% (0/12)"	1	0	NA	NA
"5"	6.94	"GO:0005109"	"frizzled binding"	"Binding to a frizzled (fz) receptor."	"10.345% (3/29)"	0.3682542	0.43	NA	NA	"20.69% (6/29)"	0.0005290573	3.28	"Pocillopora_acuta_HIv2___RNAseq.g17508.t1b;Pocillopora_acuta_HIv2___RNAseq.g27038.t1;Pocillopora_acuta_HIv2___RNAseq.g27039.t1;Pocillopora_acuta_HIv2___RNAseq.g27047.t1;Pocillopora_acuta_HIv2___TS.g18100.t1;Pocillopora_acuta_HIv2___TS.g18104.t1"	"Collagen triple helix repeat-containing protein 1;Protein Wnt-7a;Protein Wnt-8b;Protein Wnt-8a;Protein Wnt-8b;Protein Wnt-8b"
"5"	8.36	"GO:0048407"	"platelet-derived growth factor binding"	"Binding to platelet-derived growth factor."	"0% (0/7)"	1	0	NA	NA	"71.429% (5/7)"	1.24834e-06	5.9	"Pocillopora_acuta_HIv2___RNAseq.g26200.t1;Pocillopora_acuta_HIv2___RNAseq.g28794.t1;Pocillopora_acuta_HIv2___RNAseq.g28803.t1b;Pocillopora_acuta_HIv2___TS.g1350.t1;Pocillopora_acuta_HIv2___TS.g15832.t1"	"Collagen alpha-2(I) chain (Alpha-2 type I collagen);Collagen alpha-2(I) chain (Alpha-2 type I collagen);Collagen alpha-2(I) chain (Alpha-2 type I collagen);Collagen alpha-2(I) chain (Alpha-2 type I collagen);Collagen alpha-2(I) chain (Alpha-2 type I collagen)"
"5"	5.89	"GO:0019838"	"growth factor binding"	"Binding to a growth factor, proteins or polypeptides that stimulate a cell or organism to grow or proliferate."	"2.74% (2/73)"	0.9762326	0.01	NA	NA	"17.808% (13/73)"	0.002412101	2.62	"Pocillopora_acuta_HIv2___RNAseq.g10385.t1;Pocillopora_acuta_HIv2___RNAseq.g10557.t1;Pocillopora_acuta_HIv2___RNAseq.g26200.t1;Pocillopora_acuta_HIv2___RNAseq.g28794.t1;Pocillopora_acuta_HIv2___RNAseq.g28803.t1b;Pocillopora_acuta_HIv2___RNAseq.g802.t1;Pocillopora_acuta_HIv2___TS.g1350.t1;Pocillopora_acuta_HIv2___TS.g14528.t1a;Pocillopora_acuta_HIv2___TS.g15832.t1;Pocillopora_acuta_HIv2___TS.g18622.t1b;Pocillopora_acuta_HIv2___TS.g23133.t3;Pocillopora_acuta_HIv2___TS.g28528.t1b;Pocillopora_acuta_HIv2___TS.g5006.t1b"	"Fibroblast growth factor receptor-like 1 (FGF receptor-like protein 1) (FGF homologous factor receptor) (FGFR-like protein) (Fibroblast growth factor receptor 5) (FGFR-5);Fibroblast growth factor receptor-like 1;Collagen alpha-2(I) chain (Alpha-2 type I collagen);Collagen alpha-2(I) chain (Alpha-2 type I collagen);Collagen alpha-2(I) chain (Alpha-2 type I collagen);Fibroblast growth factor receptor 1-A (FGFR-1-A) (bFGF-R-1-A) (EC 2.7.10.1) (Basic fibroblast growth factor receptor 1-A);Collagen alpha-2(I) chain (Alpha-2 type I collagen);Peroxidasin homolog (EC 1.11.2.-) (Melanoma-associated antigen MG50) (Peroxidasin 1) (hsPxd01) (Vascular peroxidase 1) (p53-responsive gene 2 protein) [Cleaved into: PXDN active fragment];Collagen alpha-2(I) chain (Alpha-2 type I collagen);Agrin [Cleaved into: Agrin N-terminal 110 kDa subunit; Agrin C-terminal 110 kDa subunit; Agrin C-terminal 90 kDa fragment (C90); Agrin C-terminal 22 kDa fragment (C22)];Pregnancy zone protein (Alpha-2-macroglobulin) (Alpha-2-M) [Cleaved into: Alpha-2-macroglobulin 165 kDa subunit; Alpha-2-macroglobulin 35 kDa subunit];Fibroblast growth factor receptor 3 (FGFR-3) (EC 2.7.10.1) (Tyrosine kinase receptor CEK2);Fibroblast growth factor receptor 1-A (FGFR-1-A) (bFGF-R-1-A) (EC 2.7.10.1) (Basic fibroblast growth factor receptor 1-A)"
"5"	6.67	"GO:0050840"	"extracellular matrix binding"	"Binding to a component of the extracellular matrix."	"2.703% (1/37)"	0.9433192	0.03	NA	NA	"16.216% (6/37)"	0.002024999	2.69	"Pocillopora_acuta_HIv2___RNAseq.g1075.t1;Pocillopora_acuta_HIv2___RNAseq.g28109.t1;Pocillopora_acuta_HIv2___RNAseq.g29795.t1;Pocillopora_acuta_HIv2___RNAseq.g3826.t1;Pocillopora_acuta_HIv2___TS.g10825.t1;Pocillopora_acuta_HIv2___TS.g14528.t1a"	"SPARC-related modular calcium-binding protein 2 (Secreted modular calcium-binding protein 2) (SMOC-2) (Smooth muscle-associated protein 2) (SMAP-2);Fibulin-2 (FIBL-2);Zonadhesin;Testican-2 (SPARC/osteonectin, CWCV, and Kazal-like domains proteoglycan 2);Thrombospondin type-1 domain-containing protein 1 (Transmembrane molecule with thrombospondin module);Peroxidasin homolog (EC 1.11.2.-) (Melanoma-associated antigen MG50) (Peroxidasin 1) (hsPxd01) (Vascular peroxidase 1) (p53-responsive gene 2 protein) [Cleaved into: PXDN active fragment]"
"5"	6.91	"GO:0019894"	"kinesin binding"	"Interacting selectively and non-covalently and stoichiometrically with kinesin, a member of a superfamily of microtubule-based motor proteins that perform force-generating tasks such as organelle transport and chromosome segregation."	"26.667% (8/30)"	0.001220281	2.91	"Pocillopora_acuta_HIv2___RNAseq.g13552.t1;Pocillopora_acuta_HIv2___RNAseq.g14867.t1;Pocillopora_acuta_HIv2___RNAseq.g14868.t1b;Pocillopora_acuta_HIv2___RNAseq.g18966.t1;Pocillopora_acuta_HIv2___RNAseq.g21831.t1;Pocillopora_acuta_HIv2___RNAseq.g30425.t2;Pocillopora_acuta_HIv2___RNAseq.g4399.t2;Pocillopora_acuta_HIv2___TS.g20127.t1b"	"Voltage-gated potassium channel KCNC1 (NGK2) (Potassium voltage-gated channel subfamily C member 1) (Voltage-gated potassium channel subunit Kv3.1) (Voltage-gated potassium channel subunit Kv4);Kinesin light chain 4 (KLC 4) (Kinesin-like protein 8);Kinesin light chain (KLC);Potassium voltage-gated channel subfamily A member 2 (RAK) (RBK2) (RCK5) (Voltage-gated potassium channel subunit Kv1.2);Kinesin-like protein KIF3C;Rootletin (Ciliary rootlet coiled-coil protein);Low-density lipoprotein receptor-related protein 8 (LRP-8) (Apolipoprotein E receptor 2);Kinesin light chain 4 (KLC 4) (Kinesin-like protein 8)"	"3.333% (1/30)"	0.673148	0.17	NA	NA
"5"	6.27	"GO:0002020"	"protease binding"	"Binding to a protease or a peptidase."	"5.357% (3/56)"	0.7980611	0.1	NA	NA	"16.071% (9/56)"	0.0001727003	3.76	"Pocillopora_acuta_HIv2___RNAseq.g12374.t1;Pocillopora_acuta_HIv2___RNAseq.g12378.t1;Pocillopora_acuta_HIv2___RNAseq.g26200.t1;Pocillopora_acuta_HIv2___RNAseq.g28794.t1;Pocillopora_acuta_HIv2___RNAseq.g28803.t1b;Pocillopora_acuta_HIv2___RNAseq.g30027.t1;Pocillopora_acuta_HIv2___TS.g1350.t1;Pocillopora_acuta_HIv2___TS.g15832.t1;Pocillopora_acuta_HIv2___TS.g23133.t3"	"Tissue inhibitor of metalloproteinase;Metalloproteinase inhibitor 1 (Tissue inhibitor of metalloproteinases 1) (TIMP-1);Collagen alpha-2(I) chain (Alpha-2 type I collagen);Collagen alpha-2(I) chain (Alpha-2 type I collagen);Collagen alpha-2(I) chain (Alpha-2 type I collagen);Metalloproteinase inhibitor 4 (Tissue inhibitor of metalloproteinases 4) (TIMP-4);Collagen alpha-2(I) chain (Alpha-2 type I collagen);Collagen alpha-2(I) chain (Alpha-2 type I collagen);Pregnancy zone protein (Alpha-2-macroglobulin) (Alpha-2-M) [Cleaved into: Alpha-2-macroglobulin 165 kDa subunit; Alpha-2-macroglobulin 35 kDa subunit]"
"7"	7.13	"GO:0099529"	"neurotransmitter receptor activity involved in regulation of postsynaptic membrane potential"	"Neurotransmitter receptor activity occurring in the postsynaptic membrane that is involved in regulating postsynaptic membrane potential, either directly (ionotropic receptors) or indirectly (e.g. via GPCR activation of an ion channel)."	"27.273% (6/22)"	0.004435689	2.35	"Pocillopora_acuta_HIv2___RNAseq.g11916.t1;Pocillopora_acuta_HIv2___RNAseq.g19870.t1;Pocillopora_acuta_HIv2___RNAseq.g21572.t1a;Pocillopora_acuta_HIv2___RNAseq.g26672.t1;Pocillopora_acuta_HIv2___RNAseq.g27413.t1;Pocillopora_acuta_HIv2___RNAseq.g28202.t1"	"Neuronal acetylcholine receptor subunit alpha-10 (Alpha 10 nAChR) (Nicotinic acetylcholine receptor subunit alpha-10) (NACHR alpha-10);Gamma-aminobutyric acid type B receptor subunit 1 (GABA-B receptor 1) (GABA-B-R1) (GABA-BR1) (GABABR1) (Gb1);Gamma-aminobutyric acid receptor subunit beta-3 (GABA(A) receptor subunit beta-3) (GABAAR subunit beta-3);Neuronal acetylcholine receptor subunit alpha-7;Gamma-aminobutyric acid receptor subunit beta-3 (GABA(A) receptor subunit beta-3) (GABAAR subunit beta-3);Neuronal acetylcholine receptor subunit beta-3"	"0% (0/22)"	1	0	NA	NA
"7"	7.31	"GO:0008046"	"axon guidance receptor activity"	"Combining with an extracellular messenger and transmitting the signal from one side of the membrane to the other to results in a change in cellular activity involved in axon guidance."	"5% (1/20)"	0.7877535	0.1	NA	NA	"35% (7/20)"	4.188954e-06	5.38	"Pocillopora_acuta_HIv2___RNAseq.g23178.t1;Pocillopora_acuta_HIv2___RNAseq.g23210.t1;Pocillopora_acuta_HIv2___RNAseq.g29143.t2;Pocillopora_acuta_HIv2___RNAseq.g5181.t1;Pocillopora_acuta_HIv2___RNAseq.g682.t1;Pocillopora_acuta_HIv2___TS.g24743.t1;Pocillopora_acuta_HIv2___TS.g8258.t1"	"Hemicentin-2;Hemicentin-2;Roundabout homolog 2;Roundabout homolog 2;Roundabout homolog 1;Hemicentin-2;Hemicentin-2"
"7"	7.82	"GO:0016917"	"GABA receptor activity"	"Combining with gamma-aminobutyric acid (GABA), and transmitting the signal from one side of the membrane to the other to initiate a change in cell activity. (GABA, 4-aminobutyrate) is an amino acid which acts as a neurotransmitter in some organisms."	"41.667% (5/12)"	0.001150884	2.94	"Pocillopora_acuta_HIv2___RNAseq.g19870.t1;Pocillopora_acuta_HIv2___RNAseq.g21572.t1a;Pocillopora_acuta_HIv2___RNAseq.g2519.t1;Pocillopora_acuta_HIv2___RNAseq.g27413.t1;Pocillopora_acuta_HIv2___TS.g305.t1"	"Gamma-aminobutyric acid type B receptor subunit 1 (GABA-B receptor 1) (GABA-B-R1) (GABA-BR1) (GABABR1) (Gb1);Gamma-aminobutyric acid receptor subunit beta-3 (GABA(A) receptor subunit beta-3) (GABAAR subunit beta-3);Gamma-aminobutyric acid type B receptor subunit 2 (GABA-B receptor 2) (GABA-B-R2) (GABA-BR2) (GABABR2) (Gb2) (G-protein coupled receptor 51) (HG20);Gamma-aminobutyric acid receptor subunit beta-3 (GABA(A) receptor subunit beta-3) (GABAAR subunit beta-3);Gamma-aminobutyric acid type B receptor subunit 2 (GABA-B receptor 2) (GABA-B-R2) (GABA-BR2) (GABABR2) (Gb2) (G-protein coupled receptor 51) (HG20)"	"0% (0/12)"	1	0	NA	NA
"7"	4.48	"GO:0004930"	"G protein-coupled receptor activity"	"Combining with an extracellular signal and transmitting the signal across the membrane by activating an associated G-protein; promotes the exchange of GDP for GTP on the alpha subunit of a heterotrimeric G-protein complex."	"12.546% (34/271)"	0.001790974	2.75	"Pocillopora_acuta_HIv2___RNAseq.18788_t;Pocillopora_acuta_HIv2___RNAseq.g10339.t1;Pocillopora_acuta_HIv2___RNAseq.g1102.t1;Pocillopora_acuta_HIv2___RNAseq.g11214.t1;Pocillopora_acuta_HIv2___RNAseq.g11547.t1;Pocillopora_acuta_HIv2___RNAseq.g11548.t1;Pocillopora_acuta_HIv2___RNAseq.g1217.t1;Pocillopora_acuta_HIv2___RNAseq.g13056.t1;Pocillopora_acuta_HIv2___RNAseq.g14013.t1a;Pocillopora_acuta_HIv2___RNAseq.g14576.t1;Pocillopora_acuta_HIv2___RNAseq.g14869.t1;Pocillopora_acuta_HIv2___RNAseq.g14871.t1;Pocillopora_acuta_HIv2___RNAseq.g17965.t1;Pocillopora_acuta_HIv2___RNAseq.g19870.t1;Pocillopora_acuta_HIv2___RNAseq.g21169.t1;Pocillopora_acuta_HIv2___RNAseq.g22964.t1;Pocillopora_acuta_HIv2___RNAseq.g23414.t1;Pocillopora_acuta_HIv2___RNAseq.g2519.t1;Pocillopora_acuta_HIv2___RNAseq.g25689.t1;Pocillopora_acuta_HIv2___RNAseq.g26058.t1;Pocillopora_acuta_HIv2___RNAseq.g28213.t1;Pocillopora_acuta_HIv2___RNAseq.g2915.t1;Pocillopora_acuta_HIv2___RNAseq.g30398.t1;Pocillopora_acuta_HIv2___RNAseq.g3166.t1;Pocillopora_acuta_HIv2___RNAseq.g3854.t1;Pocillopora_acuta_HIv2___RNAseq.g6366.t1;Pocillopora_acuta_HIv2___RNAseq.g6379.t1;Pocillopora_acuta_HIv2___RNAseq.g6468.t1;Pocillopora_acuta_HIv2___RNAseq.g8890.t1;Pocillopora_acuta_HIv2___RNAseq.g9811.t1;Pocillopora_acuta_HIv2___TS.g1253.t1;Pocillopora_acuta_HIv2___TS.g17699.t2;Pocillopora_acuta_HIv2___TS.g2952.t1;Pocillopora_acuta_HIv2___TS.g305.t1"	"Metabotropic glutamate receptor 3 (mGluR3);Adenosine receptor A2b;Neuropeptide FF receptor 2 (G-protein coupled receptor 74) (Neuropeptide G-protein coupled receptor);Histamine H2 receptor (H2R) (HH2R) (Gastric receptor I);Pyroglutamylated RF-amide peptide receptor (AQ27) (G-protein coupled receptor 103) (Orexigenic neuropeptide QRFP receptor) (SP9155);Pyroglutamylated RF-amide peptide receptor (AQ27) (G-protein coupled receptor 103) (Orexigenic neuropeptide QRFP receptor) (SP9155);Adenosine receptor A2a;Dopamine receptor 4;Beta-1 adrenergic receptor (Beta-1 adrenoreceptor) (Beta-1 adrenoceptor) (x-BETA1AR);G-protein coupled receptor GRL101;Neuropeptide FF receptor 2 (G-protein coupled receptor 74) (G-protein coupled receptor HLWAR77) (Neuropeptide G-protein coupled receptor);Extracellular calcium-sensing receptor (CaSR) (Parathyroid cell calcium-sensing receptor) (PCaR1) (RaKCaR);Alpha-1A adrenergic receptor (Alpha-1A adrenoreceptor) (Alpha-1A adrenoceptor) (Alpha-1C adrenergic receptor);Gamma-aminobutyric acid type B receptor subunit 1 (GABA-B receptor 1) (GABA-B-R1) (GABA-BR1) (GABABR1) (Gb1);Substance-K receptor (SKR) (NK-2 receptor) (NK-2R) (Neurokinin A receptor) (Tachykinin receptor 2);Adhesion G-protein coupled receptor D1 (G-protein coupled receptor 133) (G-protein coupled receptor PGR25);5-hydroxytryptamine receptor 1B (5-HT-1B) (5-HT1B) (Serotonin receptor 1B);Gamma-aminobutyric acid type B receptor subunit 2 (GABA-B receptor 2) (GABA-B-R2) (GABA-BR2) (GABABR2) (Gb2) (G-protein coupled receptor 51) (HG20);Melatonin receptor type 1A (Mel-1A-R) (Mel1a receptor);Rhodopsin, GQ-coupled (GQ-rhodopsin);QRFP-like peptide receptor;Cadherin EGF LAG seven-pass G-type receptor 1 (Cadherin family member 9) (Flamingo homolog 2) (hFmi2);Pyroglutamylated RF-amide peptide receptor (AQ27) (G-protein coupled receptor 103) (Orexigenic neuropeptide QRFP receptor) (SP9155);Rhodopsin;Tachykinin-like peptides receptor 86C (NKD);Adhesion G protein-coupled receptor L4;Adhesion G-protein coupled receptor D1 (G-protein coupled receptor 133);Adenosine receptor A2a;Follicle-stimulating hormone receptor (FSH-R) (Follitropin receptor);Neuropeptide FF receptor 2 (G-protein coupled receptor 74) (Neuropeptide NPFF receptor);Alpha-1A adrenergic receptor (Alpha-1A adrenoreceptor) (Alpha-1A adrenoceptor) (MAR1);Leucine-rich repeat-containing G-protein coupled receptor 6;Adhesion G-protein coupled receptor D1 (G-protein coupled receptor 133);Gamma-aminobutyric acid type B receptor subunit 2 (GABA-B receptor 2) (GABA-B-R2) (GABA-BR2) (GABABR2) (Gb2) (G-protein coupled receptor 51) (HG20)"	"5.535% (15/271)"	0.0714757	1.15	NA	NA
"7"	3.53	"GO:0038023"	"signaling receptor activity"	"Receiving a signal and transmitting it in the cell to initiate a change in cell activity. A signal is a physical entity or change in state that is used to transfer information in order to trigger a response."	"12.211% (74/606)"	0.08093722	1.09	NA	NA	"7.261% (44/606)"	0.004322441	2.36	"Pocillopora_acuta_HIv2___RNAseq.g10378.t1;Pocillopora_acuta_HIv2___RNAseq.g10385.t1;Pocillopora_acuta_HIv2___RNAseq.g10557.t1;Pocillopora_acuta_HIv2___RNAseq.g10855.t1;Pocillopora_acuta_HIv2___RNAseq.g12088.t1;Pocillopora_acuta_HIv2___RNAseq.g12281.t1;Pocillopora_acuta_HIv2___RNAseq.g12306.t1;Pocillopora_acuta_HIv2___RNAseq.g15290.t1;Pocillopora_acuta_HIv2___RNAseq.g15948.t1;Pocillopora_acuta_HIv2___RNAseq.g15953.t1;Pocillopora_acuta_HIv2___RNAseq.g16484.t1;Pocillopora_acuta_HIv2___RNAseq.g17517.t1;Pocillopora_acuta_HIv2___RNAseq.g17519.t1;Pocillopora_acuta_HIv2___RNAseq.g23178.t1;Pocillopora_acuta_HIv2___RNAseq.g23210.t1;Pocillopora_acuta_HIv2___RNAseq.g24196.t1;Pocillopora_acuta_HIv2___RNAseq.g24413.t1;Pocillopora_acuta_HIv2___RNAseq.g24688.t1;Pocillopora_acuta_HIv2___RNAseq.g26057.t1;Pocillopora_acuta_HIv2___RNAseq.g28226.t2;Pocillopora_acuta_HIv2___RNAseq.g29143.t2;Pocillopora_acuta_HIv2___RNAseq.g30377.t2;Pocillopora_acuta_HIv2___RNAseq.g3094.t1;Pocillopora_acuta_HIv2___RNAseq.g4073.t1;Pocillopora_acuta_HIv2___RNAseq.g434.t1;Pocillopora_acuta_HIv2___RNAseq.g5181.t1;Pocillopora_acuta_HIv2___RNAseq.g562.t1;Pocillopora_acuta_HIv2___RNAseq.g565.t1;Pocillopora_acuta_HIv2___RNAseq.g682.t1;Pocillopora_acuta_HIv2___RNAseq.g775.t1;Pocillopora_acuta_HIv2___RNAseq.g802.t1;Pocillopora_acuta_HIv2___RNAseq.g8670.t1;Pocillopora_acuta_HIv2___RNAseq.g8914.t1;Pocillopora_acuta_HIv2___RNAseq.g8916.t1;Pocillopora_acuta_HIv2___TS.g11002.t4;Pocillopora_acuta_HIv2___TS.g13017.t1;Pocillopora_acuta_HIv2___TS.g24743.t1;Pocillopora_acuta_HIv2___TS.g28528.t1a;Pocillopora_acuta_HIv2___TS.g28528.t1b;Pocillopora_acuta_HIv2___TS.g5006.t1b;Pocillopora_acuta_HIv2___TS.g5308.t2;Pocillopora_acuta_HIv2___TS.g5618.t1;Pocillopora_acuta_HIv2___TS.g8131.t1;Pocillopora_acuta_HIv2___TS.g8258.t1"	"Macrophage mannose receptor 1 (MMR) (C-type lectin domain family 13 member D) (C-type lectin domain family 13 member D-like) (Human mannose receptor) (hMR) (Macrophage mannose receptor 1-like protein 1) (CD antigen CD206);Fibroblast growth factor receptor-like 1 (FGF receptor-like protein 1) (FGF homologous factor receptor) (FGFR-like protein) (Fibroblast growth factor receptor 5) (FGFR-5);Fibroblast growth factor receptor-like 1;Adrenocorticotropic hormone receptor (ACTH receptor) (ACTH-R) (Adrenocorticotropin receptor) (Melanocortin receptor 2) (MC2-R);Neuropeptide FF receptor 2 (G-protein coupled receptor 74) (Neuropeptide G-protein coupled receptor);Receptor-type tyrosine-protein phosphatase F (EC 3.1.3.48) (Leukocyte common antigen related) (LAR);Adhesion G-protein coupled receptor G4 (G-protein coupled receptor 112);Prothrombin (EC 3.4.21.5) (Coagulation factor II) [Cleaved into: Activation peptide fragment 1; Activation peptide fragment 2; Thrombin light chain; Thrombin heavy chain];Trace amine-associated receptor 1 (TaR-1) (Trace amine receptor 1);Trace amine-associated receptor 1 (TaR-1) (Trace amine receptor 1);Tyrosine kinase receptor Cad96Ca (EC 2.7.10.1) (Cadherin-96Ca) (Tyrosine kinase receptor HD-14);Tyrosine kinase receptor Cad96Ca (EC 2.7.10.1) (Cadherin-96Ca) (Tyrosine kinase receptor HD-14);Tyrosine kinase receptor Cad96Ca (EC 2.7.10.1) (Cadherin-96Ca) (Tyrosine kinase receptor HD-14);Hemicentin-2;Hemicentin-2;Adrenocorticotropic hormone receptor (ACTH receptor) (ACTH-R) (Adrenocorticotropin receptor) (Melanocortin receptor 2) (MC2-R);Toll-like receptor 2 (CD antigen CD282);Neurexin-1 (Neurexin I-alpha) (Neurexin-1-alpha);Pyroglutamylated RF-amide peptide receptor (AQ27) (G-protein coupled receptor 103) (Orexigenic neuropeptide QRFP receptor) (SP9155);Neurogenic locus Notch protein [Cleaved into: Processed neurogenic locus Notch protein];Roundabout homolog 2;Rhodopsin, GQ-coupled (GQ-rhodopsin);Melatonin receptor type 1C (Mel-1C-R) (Mel1c receptor) (CKB);Histamine H2 receptor (H2R) (HH2R) (Gastric receptor I);Frizzled-5 (Fz-5) (Xfz5);Roundabout homolog 2;Frizzled-5 (Fz-5);Frizzled-5 (Fz-5) (hFz5) (FzE5);Roundabout homolog 1;Neuropeptide FF receptor 2 (G-protein coupled receptor 74) (Neuropeptide NPFF receptor);Fibroblast growth factor receptor 1-A (FGFR-1-A) (bFGF-R-1-A) (EC 2.7.10.1) (Basic fibroblast growth factor receptor 1-A);Riboflavin-binding protein (RBP) [Cleaved into: Riboflavin-binding protein, plasma form; Riboflavin-binding protein, yolk major form; Riboflavin-binding protein, yolk minor form];Low-density lipoprotein receptor-related protein 4 (LRP-4) (Multiple epidermal growth factor-like domains 7);Low-density lipoprotein receptor-related protein 4 (LRP-4) (Multiple epidermal growth factor-like domains 7);Neurogenic locus Notch protein [Cleaved into: Processed neurogenic locus Notch protein];Aryl hydrocarbon receptor (Ah receptor) (AhR);Hemicentin-2;C-type mannose receptor 2 (C-type lectin domain family 13 member E) (Endocytic receptor 180) (Macrophage mannose receptor 2) (Urokinase-type plasminogen activator receptor-associated protein) (UPAR-associated protein) (Urokinase receptor-associated protein) (CD antigen CD280);Fibroblast growth factor receptor 3 (FGFR-3) (EC 2.7.10.1) (Tyrosine kinase receptor CEK2);Fibroblast growth factor receptor 1-A (FGFR-1-A) (bFGF-R-1-A) (EC 2.7.10.1) (Basic fibroblast growth factor receptor 1-A);Tyrosine kinase receptor Cad96Ca (EC 2.7.10.1) (Cadherin-96Ca) (Tyrosine kinase receptor HD-14);Scavenger receptor cysteine-rich domain-containing protein DMBT1 (Deleted in malignant brain tumors 1 protein) (Glycoprotein 340) (Gp-340) (Hensin) (Salivary agglutinin) (SAG) (Surfactant pulmonary-associated D-binding protein);Metabotropic glycine receptor (mGlyR) (G-protein coupled receptor 158);Hemicentin-2"
