GO.cluster	IC	GO.ID	term	definition	Oral_elim.genes_frequency	Oral_elim.pvalue	Oral_elim.-log10_pvalue	Oral_elim.Significant_genes	Oral_elim.Significant_genes_symbol	Aboral_elim.genes_frequency	Aboral_elim.pvalue	Aboral_elim.-log10_pvalue	Aboral_elim.Significant_genes	Aboral_elim.Significant_genes_symbol
"8"	8.7	"GO:0016505"	"peptidase activator activity involved in apoptotic process"	"Binds to and increases the activity of a peptidase that is involved in the apoptotic process."	"0% (0/5)"	1	0	NA	NA	"60% (3/5)"	0.000457361	3.34	"Pocillopora_acuta_HIv2___RNAseq.g21967.t1;Pocillopora_acuta_HIv2___RNAseq.g8098.t1;Pocillopora_acuta_HIv2___TS.g7062.t1"	"Dipeptidyl peptidase 1 (EC 3.4.14.1) (Cathepsin C) (Cathepsin J) (Dipeptidyl peptidase I) (DPP-I) (DPPI) (Dipeptidyl transferase) [Cleaved into: Dipeptidyl peptidase 1 exclusion domain chain (Dipeptidyl peptidase I exclusion domain chain); Dipeptidyl peptidase 1 heavy chain (Dipeptidyl peptidase I heavy chain); Dipeptidyl peptidase 1 light chain (Dipeptidyl peptidase I light chain)];Cathepsin L1 (EC 3.4.22.15) (Cysteine proteinase 1) [Cleaved into: Cathepsin L heavy chain; Cathepsin L light chain];Dipeptidyl peptidase 1 (EC 3.4.14.1) (Cathepsin C) (Cathepsin J) (Dipeptidyl peptidase I) (DPP-I) (DPPI) (Dipeptidyl transferase) [Cleaved into: Dipeptidyl peptidase 1 exclusion domain chain (Dipeptidyl peptidase I exclusion domain chain); Dipeptidyl peptidase 1 heavy chain (Dipeptidyl peptidase I heavy chain); Dipeptidyl peptidase 1 light chain (Dipeptidyl peptidase I light chain)]"
"8"	6.21	"GO:0004866"	"endopeptidase inhibitor activity"	"Binds to and stops, prevents or reduces the activity of an endopeptidase."	"7.547% (4/53)"	0.5641659	0.25	NA	NA	"18.868% (10/53)"	0.001064877	2.97	"Pocillopora_acuta_HIv2___RNAseq.g12374.t1;Pocillopora_acuta_HIv2___RNAseq.g12378.t1;Pocillopora_acuta_HIv2___RNAseq.g24766.t1;Pocillopora_acuta_HIv2___RNAseq.g28195.t1;Pocillopora_acuta_HIv2___RNAseq.g30027.t1;Pocillopora_acuta_HIv2___RNAseq.g31347.t1;Pocillopora_acuta_HIv2___RNAseq.g8821.t1;Pocillopora_acuta_HIv2___RNAseq.g8922.t1;Pocillopora_acuta_HIv2___TS.g23133.t3;Pocillopora_acuta_HIv2___TS.g23144.t1"	"Tissue inhibitor of metalloproteinase;Metalloproteinase inhibitor 1 (Tissue inhibitor of metalloproteinases 1) (TIMP-1);Papilin;Serine protease inhibitor dipetalogastin (Dipetalin);Metalloproteinase inhibitor 4 (Tissue inhibitor of metalloproteinases 4) (TIMP-4);Equistatin (EI) (Cysteine proteinase inhibitor);Complement C3 [Cleaved into: Complement C3 beta chain; C3-beta-c (C3bc) (Neutrophil chemotactic factor-2) (ENCF-2); Complement C3 alpha chain; C3a anaphylatoxin (Neutrophil chemotactic factor-1) (ENCF-1); Acylation stimulating protein (ASP) (C3adesArg); Complement C3b alpha' chain; Complement C3c alpha' chain fragment 1; Complement C3dg fragment; Complement C3g fragment; Complement C3d fragment; Complement C3f fragment; Complement C3c alpha' chain fragment 2];Complement C3 [Cleaved into: Complement C3 beta chain; Complement C3 alpha chain; C3a anaphylatoxin; Complement C3 gamma chain];Pregnancy zone protein (Alpha-2-macroglobulin) (Alpha-2-M) [Cleaved into: Alpha-2-macroglobulin 165 kDa subunit; Alpha-2-macroglobulin 35 kDa subunit];Complement C3 [Cleaved into: Complement C3 beta chain; Complement C3 alpha chain; C3a anaphylatoxin; Complement C3 gamma chain]"
"8"	8.23	"GO:0008191"	"metalloendopeptidase inhibitor activity"	"Binds to and stops, prevents or reduces the activity of metalloendopeptidases, enzymes that catalyze the hydrolysis of nonterminal peptide bonds in a polypeptide chain and contain a chelated metal ion at their active sites which is essential to their catalytic activity."	"12.5% (1/8)"	0.4618272	0.34	NA	NA	"37.5% (3/8)"	0.002359221	2.63	"Pocillopora_acuta_HIv2___RNAseq.g12374.t1;Pocillopora_acuta_HIv2___RNAseq.g12378.t1;Pocillopora_acuta_HIv2___RNAseq.g30027.t1"	"Tissue inhibitor of metalloproteinase;Metalloproteinase inhibitor 1 (Tissue inhibitor of metalloproteinases 1) (TIMP-1);Metalloproteinase inhibitor 4 (Tissue inhibitor of metalloproteinases 4) (TIMP-4)"
"9"	7.91	"GO:0005001"	"transmembrane receptor protein tyrosine phosphatase activity"	"Combining with a signal and transmitting the signal from one side of the membrane to the other to initiate a change in cell activity by catalysis of the reaction: protein tyrosine phosphate + H2O = protein tyrosine + phosphate."	"45.455% (5/11)"	0.0007149386	3.15	"Pocillopora_acuta_HIv2___RNAseq.g12287.t1;Pocillopora_acuta_HIv2___RNAseq.g12289.t1;Pocillopora_acuta_HIv2___RNAseq.g12293.t1;Pocillopora_acuta_HIv2___RNAseq.g9334.t1;Pocillopora_acuta_HIv2___TS.g1768.t1"	"Tyrosine-protein phosphatase Lar (EC 3.1.3.48) (Protein-tyrosine-phosphate phosphohydrolase) (dLAR);Tyrosine-protein phosphatase Lar (EC 3.1.3.48) (Protein-tyrosine-phosphate phosphohydrolase) (dLAR);Receptor-type tyrosine-protein phosphatase T (R-PTP-T) (EC 3.1.3.48) (Receptor-type tyrosine-protein phosphatase rho) (RPTP-rho);Tyrosine-protein phosphatase Lar (EC 3.1.3.48) (Protein-tyrosine-phosphate phosphohydrolase) (dLAR);Tyrosine-protein phosphatase Lar (EC 3.1.3.48) (Protein-tyrosine-phosphate phosphohydrolase) (dLAR)"	"9.091% (1/11)"	0.3360747	0.47	NA	NA
"9"	5.91	"GO:0004725"	"protein tyrosine phosphatase activity"	"Catalysis of the reaction: protein tyrosine phosphate + H2O = protein tyrosine + phosphate."	"9.677% (6/62)"	0.9804361	0.01	NA	NA	"11.29% (7/62)"	0.007138701	2.15	"Pocillopora_acuta_HIv2___RNAseq.g12258.t1;Pocillopora_acuta_HIv2___RNAseq.g12272.t1;Pocillopora_acuta_HIv2___RNAseq.g12278.t1;Pocillopora_acuta_HIv2___RNAseq.g12281.t1;Pocillopora_acuta_HIv2___RNAseq.g9253.t1;Pocillopora_acuta_HIv2___TS.g30914.t1;Pocillopora_acuta_HIv2___TS.g3265.t1"	"Receptor-type tyrosine-protein phosphatase S (R-PTP-S) (EC 3.1.3.48) (Chick receptor tyrosine phosphatase alpha) (CRYP alpha) (CRYPalpha);Receptor-type tyrosine-protein phosphatase alpha (Protein-tyrosine phosphatase alpha) (R-PTP-alpha) (EC 3.1.3.48) (LCA-related phosphatase) (PTPTY-28);Receptor-type tyrosine-protein phosphatase alpha (Protein-tyrosine phosphatase alpha) (R-PTP-alpha) (EC 3.1.3.48) (LCA-related phosphatase) (PTPTY-28);Receptor-type tyrosine-protein phosphatase F (EC 3.1.3.48) (Leukocyte common antigen related) (LAR);Receptor-type tyrosine-protein phosphatase delta (Protein-tyrosine phosphatase delta) (R-PTP-delta) (EC 3.1.3.48);Receptor-type tyrosine-protein phosphatase delta (Protein-tyrosine phosphatase delta) (R-PTP-delta) (EC 3.1.3.48);Receptor-type tyrosine-protein phosphatase delta (Protein-tyrosine phosphatase delta) (R-PTP-delta) (EC 3.1.3.48)"
"9"	6.1	"GO:0004252"	"serine-type endopeptidase activity"	"Catalysis of the hydrolysis of internal, alpha-peptide bonds in a polypeptide chain by a catalytic mechanism that involves a catalytic triad consisting of a serine nucleophile that is activated by a proton relay involving an acidic residue (e.g. aspartate or glutamate) and a basic residue (usually histidine)."	"5.97% (4/67)"	0.7455855	0.13	NA	NA	"19.403% (13/67)"	6.958938e-07	6.16	"Pocillopora_acuta_HIv2___RNAseq.21012_t;Pocillopora_acuta_HIv2___RNAseq.21015_t;Pocillopora_acuta_HIv2___RNAseq.g13818.t1;Pocillopora_acuta_HIv2___RNAseq.g15290.t1;Pocillopora_acuta_HIv2___RNAseq.g21967.t1;Pocillopora_acuta_HIv2___RNAseq.g28450.t1;Pocillopora_acuta_HIv2___RNAseq.g30322.t1;Pocillopora_acuta_HIv2___RNAseq.g8820.t1;Pocillopora_acuta_HIv2___RNAseq.g9068.t1;Pocillopora_acuta_HIv2___RNAseq.g9084.t1;Pocillopora_acuta_HIv2___RNAseq.g9098.t1;Pocillopora_acuta_HIv2___TS.g5338.t1;Pocillopora_acuta_HIv2___TS.g7062.t1"	"Mannan-binding lectin serine protease 1 (EC 3.4.21.-) (Complement factor MASP-3) (Complement-activating component of Ra-reactive factor) (Mannose-binding lectin-associated serine protease 1) (MASP-1) (Mannose-binding protein-associated serine protease) (Ra-reactive factor serine protease p100) (RaRF) (Serine protease 5) [Cleaved into: Mannan-binding lectin serine protease 1 heavy chain; Mannan-binding lectin serine protease 1 light chain];Coagulation factor IX (EC 3.4.21.22) (Christmas factor) [Cleaved into: Coagulation factor IXa light chain; Coagulation factor IXa heavy chain];Serine protease 23 (EC 3.4.21.-) (Putative secreted protein Zsig13);Prothrombin (EC 3.4.21.5) (Coagulation factor II) [Cleaved into: Activation peptide fragment 1; Activation peptide fragment 2; Thrombin light chain; Thrombin heavy chain];Dipeptidyl peptidase 1 (EC 3.4.14.1) (Cathepsin C) (Cathepsin J) (Dipeptidyl peptidase I) (DPP-I) (DPPI) (Dipeptidyl transferase) [Cleaved into: Dipeptidyl peptidase 1 exclusion domain chain (Dipeptidyl peptidase I exclusion domain chain); Dipeptidyl peptidase 1 heavy chain (Dipeptidyl peptidase I heavy chain); Dipeptidyl peptidase 1 light chain (Dipeptidyl peptidase I light chain)];Trypsin-3 (EC 3.4.21.4) (Trypsin III);Mannan-binding lectin serine protease 1 (EC 3.4.21.-) (Complement factor MASP-3) (Complement-activating component of Ra-reactive factor) (Mannose-binding lectin-associated serine protease 1) (MASP-1) (Mannose-binding protein-associated serine protease) (Ra-reactive factor serine protease p100) (RaRF) (Serine protease 5) [Cleaved into: Mannan-binding lectin serine protease 1 heavy chain; Mannan-binding lectin serine protease 1 light chain];Complement C2 (EC 3.4.21.43) (C3/C5 convertase) [Cleaved into: Complement C2b fragment; Complement C2a fragment];Complement factor B (EC 3.4.21.47) (C3/C5 convertase) [Cleaved into: Complement factor B Ba fragment; Complement factor B Bb fragment];Complement C2 (EC 3.4.21.43) (C3/C5 convertase) [Cleaved into: Complement C2b fragment; Complement C2a fragment];Transmembrane protease serine 11D (EC 3.4.21.-) (Airway trypsin-like protease) [Cleaved into: Transmembrane protease serine 11D non-catalytic chain; Transmembrane protease serine 11D catalytic chain];Collagenase 3 (EC 3.4.24.-) (Matrix metalloproteinase-13) (MMP-13);Dipeptidyl peptidase 1 (EC 3.4.14.1) (Cathepsin C) (Cathepsin J) (Dipeptidyl peptidase I) (DPP-I) (DPPI) (Dipeptidyl transferase) [Cleaved into: Dipeptidyl peptidase 1 exclusion domain chain (Dipeptidyl peptidase I exclusion domain chain); Dipeptidyl peptidase 1 heavy chain (Dipeptidyl peptidase I heavy chain); Dipeptidyl peptidase 1 light chain (Dipeptidyl peptidase I light chain)]"
"9"	5.57	"GO:0004222"	"metalloendopeptidase activity"	"Catalysis of the hydrolysis of internal, alpha-peptide bonds in a polypeptide chain by a mechanism in which water acts as a nucleophile, one or two metal ions hold the water molecule in place, and charged amino acid side chains are ligands for the metal ions."	"9.091% (10/110)"	0.302974	0.52	NA	NA	"10% (11/110)"	0.002209501	2.66	"Pocillopora_acuta_HIv2___RNAseq.g19284.t1;Pocillopora_acuta_HIv2___RNAseq.g22527.t1;Pocillopora_acuta_HIv2___RNAseq.g22572.t1;Pocillopora_acuta_HIv2___RNAseq.g24896.t1;Pocillopora_acuta_HIv2___RNAseq.g24899.t1;Pocillopora_acuta_HIv2___RNAseq.g30235.t1;Pocillopora_acuta_HIv2___RNAseq.g8587.t1;Pocillopora_acuta_HIv2___RNAseq.g9118.t1;Pocillopora_acuta_HIv2___TS.g13882.t1c;Pocillopora_acuta_HIv2___TS.g5338.t1;Pocillopora_acuta_HIv2___TS.g8967.t1"	"Matrix metalloproteinase-16 (MMP-16) (EC 3.4.24.-) (Membrane-type matrix metalloproteinase 3) (MT-MMP 3) (MTMMP3) (Membrane-type-3 matrix metalloproteinase) (MT3-MMP) (MT3MMP);Tolloid-like protein 1 (EC 3.4.24.-) (Chicken tolloid-like protein 1) (Metalloprotease colloid);Zinc metalloproteinase nas-15 (EC 3.4.24.-) (Nematode astacin 15);Matrix metalloproteinase-16 (MMP-16) (EC 3.4.24.-) (MMP-X2) (Membrane-type matrix metalloproteinase 3) (MT-MMP 3) (MTMMP3) (Membrane-type-3 matrix metalloproteinase) (MT3-MMP) (MT3MMP);Matrix metalloproteinase-17 (MMP-17) (EC 3.4.24.-) (Membrane-type matrix metalloproteinase 4) (MT-MMP 4) (MTMMP4) (Membrane-type-4 matrix metalloproteinase) (MT4-MMP) (MT4MMP);Zinc metalloproteinase nas-15 (EC 3.4.24.-) (Nematode astacin 15);Zinc metalloproteinase nas-14 (EC 3.4.24.-) (Nematode astacin 14);Pappalysin-1 (EC 3.4.24.79) (Insulin-like growth factor-dependent IGF-binding protein 4 protease) (IGF-dependent IGFBP-4 protease) (IGFBP-4ase) (Pregnancy-associated plasma protein A) (PAPP-A);Zinc metalloproteinase nas-13 (EC 3.4.24.-) (Nematode astacin 13);Collagenase 3 (EC 3.4.24.-) (Matrix metalloproteinase-13) (MMP-13);Extracellular protease (EC 3.4.24.-)"
"8"	8.23	"GO:0004499"	"N,N-dimethylaniline monooxygenase activity"	"Catalysis of the reaction: N,N-dimethylaniline + NADPH + H+ + O2 = N,N-dimethylaniline N-oxide + NADP+ + H2O."	"12.5% (1/8)"	0.4618272	0.34	NA	NA	"37.5% (3/8)"	0.002359221	2.63	"Pocillopora_acuta_HIv2___RNAseq.20930_t;Pocillopora_acuta_HIv2___RNAseq.g8978.t1;Pocillopora_acuta_HIv2___RNAseq.g8980.t1"	"Trimethylamine monooxygenase (TMA monooxygenase) (Tmm) (EC 1.14.13.148);Trimethylamine monooxygenase (TMA monooxygenase) (Tmm) (EC 1.14.13.148);Trimethylamine monooxygenase (TMA monooxygenase) (Tmm) (EC 1.14.13.148)"
"8"	8.52	"GO:0034899"	"trimethylamine monooxygenase activity"	"Catalysis of the reaction: N,N,N-trimethylamine + NADPH + H+ + O2 = N,N,N-trimethylamine N-oxide + NADP+ + H2O."	"16.667% (1/6)"	0.3716314	0.43	NA	NA	"50% (3/6)"	0.000889968	3.05	"Pocillopora_acuta_HIv2___RNAseq.20930_t;Pocillopora_acuta_HIv2___RNAseq.g8978.t1;Pocillopora_acuta_HIv2___RNAseq.g8980.t1"	"Trimethylamine monooxygenase (TMA monooxygenase) (Tmm) (EC 1.14.13.148);Trimethylamine monooxygenase (TMA monooxygenase) (Tmm) (EC 1.14.13.148);Trimethylamine monooxygenase (TMA monooxygenase) (Tmm) (EC 1.14.13.148)"
"8"	5.74	"GO:0005201"	"extracellular matrix structural constituent"	"The action of a molecule that contributes to the structural integrity of the extracellular matrix."	"12.766% (12/94)"	0.0457012	1.34	NA	NA	"28.723% (27/94)"	1.093965e-11	10.96	"Pocillopora_acuta_HIv2___RNAseq.2533_t;Pocillopora_acuta_HIv2___RNAseq.g14253.t1;Pocillopora_acuta_HIv2___RNAseq.g14769.t1;Pocillopora_acuta_HIv2___RNAseq.g21477.t1;Pocillopora_acuta_HIv2___RNAseq.g21479.t1;Pocillopora_acuta_HIv2___RNAseq.g21481.t1;Pocillopora_acuta_HIv2___RNAseq.g22638.t1;Pocillopora_acuta_HIv2___RNAseq.g23886.t1;Pocillopora_acuta_HIv2___RNAseq.g24766.t1;Pocillopora_acuta_HIv2___RNAseq.g26200.t1;Pocillopora_acuta_HIv2___RNAseq.g28196.t1;Pocillopora_acuta_HIv2___RNAseq.g28794.t1;Pocillopora_acuta_HIv2___RNAseq.g28803.t1b;Pocillopora_acuta_HIv2___RNAseq.g28910.t1;Pocillopora_acuta_HIv2___RNAseq.g28911.t1;Pocillopora_acuta_HIv2___RNAseq.g8148.t1;Pocillopora_acuta_HIv2___TS.g12846.t1;Pocillopora_acuta_HIv2___TS.g1340.t1b;Pocillopora_acuta_HIv2___TS.g1350.t1;Pocillopora_acuta_HIv2___TS.g1359.t1;Pocillopora_acuta_HIv2___TS.g14528.t1a;Pocillopora_acuta_HIv2___TS.g1462.t1;Pocillopora_acuta_HIv2___TS.g15590.t1;Pocillopora_acuta_HIv2___TS.g15832.t1;Pocillopora_acuta_HIv2___TS.g17199.t1;Pocillopora_acuta_HIv2___TS.g23178.t1;Pocillopora_acuta_HIv2___TS.g24066.t1"	"Hemicentin-1 (Fibulin-6) (FIBL-6);Hemicentin-1 (Fibulin-6) (FIBL-6);Fibrillin-2 [Cleaved into: Placensin];Tenascin (TN) (Cytotactin) (GMEM) (GP 150-225) (Glioma-associated-extracellular matrix antigen) (Hexabrachion) (JI) (Myotendinous antigen) (Neuronectin) (Tenascin-C) (TN-C);Tenascin (TN) (Cytotactin) (GMEM) (GP 150-225) (Glioma-associated-extracellular matrix antigen) (Hexabrachion) (JI) (Myotendinous antigen) (Neuronectin) (Tenascin-C) (TN-C);Tenascin (TN) (Cytotactin) (GMEM) (GP 150-225) (Glioma-associated-extracellular matrix antigen) (Hexabrachion) (JI) (Myotendinous antigen) (Neuronectin) (Tenascin-C) (TN-C);Collagen alpha-1(IV) chain (Collagen type IV alpha 1);Laminin subunit beta-1 (Laminin B1 chain) (Laminin-1 subunit beta) (Laminin-10 subunit beta) (Laminin-12 subunit beta) (Laminin-2 subunit beta) (Laminin-6 subunit beta) (Laminin-8 subunit beta);Papilin;Collagen alpha-2(I) chain (Alpha-2 type I collagen);Aggrecan core protein (Cartilage-specific proteoglycan core protein) (CSPCP) (Chondroitin sulfate proteoglycan core protein 1) (Chondroitin sulfate proteoglycan 1) [Cleaved into: Aggrecan core protein 2];Collagen alpha-2(I) chain (Alpha-2 type I collagen);Collagen alpha-2(I) chain (Alpha-2 type I collagen);Matrilin-2;Fibrillin-3 [Cleaved into: Fibrillin-3 C-terminal peptide];Hemicentin-1 (Fibulin-6) (FIBL-6);Collagen alpha-1(XVII) chain (180 kDa bullous pemphigoid antigen 2) (Bullous pemphigoid antigen 2) [Cleaved into: 120 kDa linear IgA disease antigen homolog];Collagen alpha-2(I) chain (Alpha-2 type I collagen);Collagen alpha-2(I) chain (Alpha-2 type I collagen);Collagen alpha chain;Peroxidasin homolog (EC 1.11.2.-) (Melanoma-associated antigen MG50) (Peroxidasin 1) (hsPxd01) (Vascular peroxidase 1) (p53-responsive gene 2 protein) [Cleaved into: PXDN active fragment];Fibrillin-1 (MP340) [Cleaved into: Asprosin];Hemicentin-1 (Fibulin-6) (FIBL-6);Collagen alpha-2(I) chain (Alpha-2 type I collagen);Laminin subunit alpha-1 (Laminin A chain) (Laminin-1 subunit alpha) (Laminin-3 subunit alpha) (S-laminin subunit alpha) (S-LAM alpha);Collagen alpha-1(XXVII) chain B;Collagen alpha-2(IV) chain"
"8"	6.75	"GO:0030020"	"extracellular matrix structural constituent conferring tensile strength"	"A constituent of the extracellular matrix that enables the matrix to resist longitudinal stress."	"5.714% (2/35)"	0.7464865	0.13	NA	NA	"28.571% (10/35)"	3.005204e-07	6.52	"Pocillopora_acuta_HIv2___RNAseq.g22638.t1;Pocillopora_acuta_HIv2___RNAseq.g26200.t1;Pocillopora_acuta_HIv2___RNAseq.g28794.t1;Pocillopora_acuta_HIv2___RNAseq.g28803.t1b;Pocillopora_acuta_HIv2___TS.g12846.t1;Pocillopora_acuta_HIv2___TS.g1340.t1b;Pocillopora_acuta_HIv2___TS.g1350.t1;Pocillopora_acuta_HIv2___TS.g15832.t1;Pocillopora_acuta_HIv2___TS.g23178.t1;Pocillopora_acuta_HIv2___TS.g24066.t1"	"Collagen alpha-1(IV) chain (Collagen type IV alpha 1);Collagen alpha-2(I) chain (Alpha-2 type I collagen);Collagen alpha-2(I) chain (Alpha-2 type I collagen);Collagen alpha-2(I) chain (Alpha-2 type I collagen);Collagen alpha-1(XVII) chain (180 kDa bullous pemphigoid antigen 2) (Bullous pemphigoid antigen 2) [Cleaved into: 120 kDa linear IgA disease antigen homolog];Collagen alpha-2(I) chain (Alpha-2 type I collagen);Collagen alpha-2(I) chain (Alpha-2 type I collagen);Collagen alpha-2(I) chain (Alpha-2 type I collagen);Collagen alpha-1(XXVII) chain B;Collagen alpha-2(IV) chain"
"8"	8.52	"GO:0004111"	"creatine kinase activity"	"Catalysis of the reaction: ATP + creatine = N-phosphocreatine + ADP + 2 H+."	"66.667% (4/6)"	0.0004055296	3.39	"Pocillopora_acuta_HIv2___RNAseq.g15574.t1;Pocillopora_acuta_HIv2___RNAseq.g15577.t1;Pocillopora_acuta_HIv2___RNAseq.g15584.t1;Pocillopora_acuta_HIv2___RNAseq.g2258.t1"	"Creatine kinase, testis isozyme (EC 2.7.3.2);Creatine kinase M-type (EC 2.7.3.2) (Creatine kinase M chain) (Creatine phosphokinase M-type) (CPK-M) (M-CK);Creatine kinase M-type (EC 2.7.3.2) (Creatine kinase M chain) (Creatine phosphokinase M-type) (CPK-M) (M-CK);Arginine kinase (AK) (EC 2.7.3.3)"	"0% (0/6)"	1	0	NA	NA
"8"	6.91	"GO:0005007"	"fibroblast growth factor receptor activity"	"Combining with a fibroblast growth factor receptor ligand and transmitting the signal across the plasma membrane to initiate a change in cell activity."	"6.667% (2/30)"	0.6657267	0.18	NA	NA	"16.667% (5/30)"	0.004237091	2.37	"Pocillopora_acuta_HIv2___RNAseq.g10385.t1;Pocillopora_acuta_HIv2___RNAseq.g10557.t1;Pocillopora_acuta_HIv2___RNAseq.g802.t1;Pocillopora_acuta_HIv2___TS.g28528.t1b;Pocillopora_acuta_HIv2___TS.g5006.t1b"	"Fibroblast growth factor receptor-like 1 (FGF receptor-like protein 1) (FGF homologous factor receptor) (FGFR-like protein) (Fibroblast growth factor receptor 5) (FGFR-5);Fibroblast growth factor receptor-like 1;Fibroblast growth factor receptor 1-A (FGFR-1-A) (bFGF-R-1-A) (EC 2.7.10.1) (Basic fibroblast growth factor receptor 1-A);Fibroblast growth factor receptor 3 (FGFR-3) (EC 2.7.10.1) (Tyrosine kinase receptor CEK2);Fibroblast growth factor receptor 1-A (FGFR-1-A) (bFGF-R-1-A) (EC 2.7.10.1) (Basic fibroblast growth factor receptor 1-A)"
"8"	4.11	"GO:0003700"	"DNA-binding transcription factor activity"	"A transcription regulator activity that modulates transcription of gene sets via selective and non-covalent binding to a specific double-stranded genomic DNA sequence (sometimes referred to as a motif) within a cis-regulatory region. Regulatory regions include promoters (proximal and distal) and enhancers. Genes are transcriptional units, and include bacterial operons."	"11.333% (34/300)"	0.008947364	2.05	"Pocillopora_acuta_HIv2___RNAseq.26564_t;Pocillopora_acuta_HIv2___RNAseq.665_t;Pocillopora_acuta_HIv2___RNAseq.g10180.t1;Pocillopora_acuta_HIv2___RNAseq.g10408.t1;Pocillopora_acuta_HIv2___RNAseq.g10896.t1;Pocillopora_acuta_HIv2___RNAseq.g11673.t1;Pocillopora_acuta_HIv2___RNAseq.g14060.t1;Pocillopora_acuta_HIv2___RNAseq.g16169.t1;Pocillopora_acuta_HIv2___RNAseq.g1930.t1;Pocillopora_acuta_HIv2___RNAseq.g1932.t1;Pocillopora_acuta_HIv2___RNAseq.g21912.t1;Pocillopora_acuta_HIv2___RNAseq.g22722.t1;Pocillopora_acuta_HIv2___RNAseq.g22749.t1;Pocillopora_acuta_HIv2___RNAseq.g23053.t1;Pocillopora_acuta_HIv2___RNAseq.g25327.t1;Pocillopora_acuta_HIv2___RNAseq.g25686.t1;Pocillopora_acuta_HIv2___RNAseq.g25869.t1;Pocillopora_acuta_HIv2___RNAseq.g27673.t1;Pocillopora_acuta_HIv2___RNAseq.g28639.t1;Pocillopora_acuta_HIv2___RNAseq.g29836.t1;Pocillopora_acuta_HIv2___RNAseq.g30663.t1;Pocillopora_acuta_HIv2___RNAseq.g31038.t1;Pocillopora_acuta_HIv2___RNAseq.g3322.t1;Pocillopora_acuta_HIv2___RNAseq.g3580.t1;Pocillopora_acuta_HIv2___RNAseq.g3837.t1a;Pocillopora_acuta_HIv2___RNAseq.g7803.t1;Pocillopora_acuta_HIv2___RNAseq.g8690.t1;Pocillopora_acuta_HIv2___RNAseq.g8876.t1;Pocillopora_acuta_HIv2___TS.g11075.t2;Pocillopora_acuta_HIv2___TS.g16611.t1;Pocillopora_acuta_HIv2___TS.g19999.t1;Pocillopora_acuta_HIv2___TS.g21030.t2;Pocillopora_acuta_HIv2___TS.g23568.t2d;Pocillopora_acuta_HIv2___TS.g4588.t1"	"Transcription factor AP-2-alpha (AP2-alpha) (AP-2 transcription factor) (Activating enhancer-binding protein 2-alpha) (Activator protein 2) (AP-2);POU domain, class 4, transcription factor 3 (Brain-specific homeobox/POU domain protein 3C) (Brain-3C) (Brn-3C);Homeobox protein Nkx-2.5 (xNKx-2.5) (Homeobox protein NK-2 homolog E);Nuclear transcription factor Y subunit alpha (CAAT box DNA-binding protein subunit A) (Nuclear transcription factor Y subunit A) (NF-YA);Achaete-scute homolog 4 (ASH-4) (hASH4) (Achaete-scute-like protein 4) (Class A basic helix-loop-helix protein 44) (bHLHa44);POU domain, class 3, transcription factor 2-B (Transcription factor POU3-B) (XlPOU3B);Insulinoma-associated protein 1 (Zinc finger protein IA-1);LIM/homeobox protein Lhx1 (LIM homeobox protein 1) (Homeobox protein Lim-1) (Xlim1) (x-Lhx1) (xLIM-1);Transcriptional regulator Myc-A (c-Myc-A) (zc-Myc);Protein S-Myc;Homeobox protein HMX3 (Homeobox protein H6 family member 3) (Homeobox protein Nkx-5.1);Transcription factor ovo-like homolog lin-48 (Abnormal cell lineage protein 48);Transcription factor Sox-3;Protein capicua homolog;Krueppel-like factor 5 (Basic transcription element-binding protein 2) (BTE-binding protein 2) (Colon krueppel-like factor) (GC-box-binding protein 2) (Intestinal-enriched krueppel-like factor) (Transcription factor BTEB2);Transcription factor Sox-14;DNA-binding protein RFX6 (Regulatory factor X 6);Paired box protein Pax-6 (Oculorhombin);DNA-binding protein RFX7 (Regulatory factor X 7);Circadian locomoter output cycles protein kaput;Cellular tumor antigen p53 (Tumor suppressor p53);ETS translocation variant 1 (Ets-related protein 81);Homeobox protein Dlx4a (DLX-8) (Distal-less homeobox protein 4a);Pancreas transcription factor 1 subunit alpha (Pancreas-specific transcription factor 1a) (bHLH transcription factor p48);Paired box protein Pax-2a (No isthmus protein) (Pax[Zf-b]);Transcription factor sox-2;Forkhead box protein L2;Homeobox protein not2 (Xnot-2) (Xnot2);Transcriptional enhancer factor TEF-1 (NTEF-1) (Protein GT-IIC) (TEA domain family member 1) (TEAD-1) (Transcription factor 13) (TCF-13);Zinc finger protein 709;Retinal homeobox protein Rx2;Doublesex- and mab-3-related transcription factor A2 (Doublesex- and mab-3-related transcription factor 5);DNA-binding protein P3A2;Transcription factor Sp5"	"6.333% (19/300)"	0.01379466	1.86	NA	NA
"8"	6.73	"GO:0030371"	"translation repressor activity"	"Antagonizes ribosome-mediated translation of mRNA into a polypeptide."	"25.714% (9/35)"	0.0008122682	3.09	"Pocillopora_acuta_HIv2___RNAseq.g10158.t1;Pocillopora_acuta_HIv2___RNAseq.g18640.t1;Pocillopora_acuta_HIv2___RNAseq.g18756.t2;Pocillopora_acuta_HIv2___RNAseq.g219.t1;Pocillopora_acuta_HIv2___RNAseq.g24051.t1;Pocillopora_acuta_HIv2___RNAseq.g28169.t1;Pocillopora_acuta_HIv2___RNAseq.g4383.t1;Pocillopora_acuta_HIv2___RNAseq.g763.t1;Pocillopora_acuta_HIv2___TS.g4312.t1"	"Cytoplasmic polyadenylation element-binding protein 2 (CPE-BP2) (CPE-binding protein 2) (mCPEB-2);Tripartite motif-containing protein 2 (EC 2.3.2.27) (E3 ubiquitin-protein ligase TRIM2) (RING-type E3 ubiquitin transferase TRIM2);Tripartite motif-containing protein 3 (EC 2.3.2.27) (Brain-expressed RING finger protein) (RING finger protein 22) (RING finger protein 97);Tripartite motif-containing protein 2 (EC 2.3.2.27) (E3 ubiquitin-protein ligase TRIM2) (RING-type E3 ubiquitin transferase TRIM2);Tripartite motif-containing protein 2 (EC 2.3.2.27) (E3 ubiquitin-protein ligase TRIM2) (RING-type E3 ubiquitin transferase TRIM2);E3 ubiquitin-protein ligase TRIM71 (EC 2.3.2.27) (Protein lin-41 homolog) (RING-type E3 ubiquitin transferase TRIM71) (Tripartite motif-containing protein 71);Tripartite motif-containing protein 2 (EC 2.3.2.27) (E3 ubiquitin-protein ligase TRIM2) (RING-type E3 ubiquitin transferase TRIM2);Tripartite motif-containing protein 3 (EC 2.3.2.27) (Brain-expressed RING finger protein) (RING finger protein 22);Tripartite motif-containing protein 3 (EC 2.3.2.27) (Brain-expressed RING finger protein) (RING finger protein 22)"	"0% (0/35)"	1	0	NA	NA
