GO.cluster	IC	GO.ID	term	definition	Oral_elim.genes_frequency	Oral_elim.pvalue	Oral_elim.-log10_pvalue	Oral_elim.Significant_genes	Oral_elim.Significant_genes_symbol	Aboral_elim.genes_frequency	Aboral_elim.pvalue	Aboral_elim.-log10_pvalue	Aboral_elim.Significant_genes	Aboral_elim.Significant_genes_symbol
"1"	8.23	"GO:0005308"	"creatine transmembrane transporter activity"	"Enables the transfer of creatine from one side of a membrane to the other. Creatine is a compound synthesized from the amino acids arginine, glycine, and methionine that occurs in muscle."	"50% (4/8)"	0.001676142	2.78	"Pocillopora_acuta_HIv2___RNAseq.g1200.t1;Pocillopora_acuta_HIv2___RNAseq.g26586.t1;Pocillopora_acuta_HIv2___TS.g16482.t1;Pocillopora_acuta_HIv2___TS.g16484.t1"	"Sodium- and chloride-dependent GABA transporter 2 (GAT-2) (Sodium- and chloride-dependent GABA transporter 3) (GAT-3) (Solute carrier family 6 member 13);Monocarboxylate transporter 9 (MCT 9) (Solute carrier family 16 member 9);Sodium- and chloride-dependent GABA transporter 2 (GAT-2) (Sodium- and chloride-dependent GABA transporter 3) (GAT-3) (Solute carrier family 6 member 13);Sodium- and chloride-dependent GABA transporter 2 (GAT-2) (Sodium- and chloride-dependent GABA transporter 3) (GAT-3) (Solute carrier family 6 member 13)"	"12.5% (1/8)"	0.2575726	0.59	NA	NA
"1"	8.11	"GO:0005332"	"gamma-aminobutyric acid:sodium:chloride symporter activity"	"Enables the transfer of a solute or solutes from one side of a membrane to the other according to the reaction: gamma-aminobutyric acid(out) + Na+(out) + Cl-(out) = gamma-aminobutyric acid(in) + Na+(in) + Cl(in)."	"44.444% (4/9)"	0.002840089	2.55	"Pocillopora_acuta_HIv2___RNAseq.g1200.t1;Pocillopora_acuta_HIv2___RNAseq.g28251.t1;Pocillopora_acuta_HIv2___TS.g16482.t1;Pocillopora_acuta_HIv2___TS.g16484.t1"	"Sodium- and chloride-dependent GABA transporter 2 (GAT-2) (Sodium- and chloride-dependent GABA transporter 3) (GAT-3) (Solute carrier family 6 member 13);Sodium- and chloride-dependent GABA transporter 1 (GAT-1) (Solute carrier family 6 member 1);Sodium- and chloride-dependent GABA transporter 2 (GAT-2) (Sodium- and chloride-dependent GABA transporter 3) (GAT-3) (Solute carrier family 6 member 13);Sodium- and chloride-dependent GABA transporter 2 (GAT-2) (Sodium- and chloride-dependent GABA transporter 3) (GAT-3) (Solute carrier family 6 member 13)"	"11.111% (1/9)"	0.2847176	0.55	NA	NA
"1"	7.82	"GO:0033229"	"cysteine transmembrane transporter activity"	"Enables the transfer of cysteine from one side of a membrane to the other."	"41.667% (5/12)"	0.001150884	2.94	"Pocillopora_acuta_HIv2___RNAseq.g12410.t1;Pocillopora_acuta_HIv2___RNAseq.g22644.t1;Pocillopora_acuta_HIv2___RNAseq.g7215.t1;Pocillopora_acuta_HIv2___RNAseq.g7217.t1;Pocillopora_acuta_HIv2___TS.g22105.t1"	"Excitatory amino acid transporter 2 (GLT-1) (Sodium-dependent glutamate/aspartate transporter 2) (Solute carrier family 1 member 2);Excitatory amino acid transporter 3 (Excitatory amino-acid carrier 1) (Sodium-dependent glutamate/aspartate transporter 3) (Solute carrier family 1 member 1);Major facilitator superfamily domain-containing protein 12 (Protein grizzled);Major facilitator superfamily domain-containing protein 12 (Protein grizzled);Major facilitator superfamily domain-containing protein 12"	"0% (0/12)"	1	0	NA	NA
"1"	8.7	"GO:0000064"	"L-ornithine transmembrane transporter activity"	"Enables the transfer of L-ornithine from one side of a membrane to the other. L-ornithine is 2,5-diaminopentanoic acid."	"60% (3/5)"	0.003672538	2.44	"Pocillopora_acuta_HIv2___RNAseq.25384_t;Pocillopora_acuta_HIv2___RNAseq.g19152.t1;Pocillopora_acuta_HIv2___TS.g5171.t1"	"Cationic amino acid transporter 2 (CAT-2) (CAT2) (cCAT-2) (Low affinity cationic amino acid transporter 2) (Solute carrier family 7 member 2);High affinity cationic amino acid transporter 1 (CAT-1) (CAT1) (Ecotropic retroviral leukemia receptor homolog) (Ecotropic retrovirus receptor homolog) (Solute carrier family 7 member 1) (System Y+ basic amino acid transporter);Cationic amino acid transporter 2 (CAT-2) (CAT2) (Low affinity cationic amino acid transporter 2) (Solute carrier family 7 member 2)"	"0% (0/5)"	1	0	NA	NA
"1"	8.52	"GO:0015189"	"L-lysine transmembrane transporter activity"	"Enables the transfer of L-lysine from one side of a membrane to the other. L-lysine is 2,6-diaminohexanoic acid."	"66.667% (4/6)"	0.0004055296	3.39	"Pocillopora_acuta_HIv2___RNAseq.25384_t;Pocillopora_acuta_HIv2___RNAseq.g19152.t1;Pocillopora_acuta_HIv2___RNAseq.g25241.t1;Pocillopora_acuta_HIv2___TS.g5171.t1"	"Cationic amino acid transporter 2 (CAT-2) (CAT2) (cCAT-2) (Low affinity cationic amino acid transporter 2) (Solute carrier family 7 member 2);High affinity cationic amino acid transporter 1 (CAT-1) (CAT1) (Ecotropic retroviral leukemia receptor homolog) (Ecotropic retrovirus receptor homolog) (Solute carrier family 7 member 1) (System Y+ basic amino acid transporter);Mitochondrial basic amino acids transporter (Carnitine/acylcarnitine translocase-like) (CACT-like) (Mitochondrial carnitine/acylcarnitine carrier protein CACL) (Mitochondrial ornithine transporter 3) (Solute carrier family 25 member 29);Cationic amino acid transporter 2 (CAT-2) (CAT2) (Low affinity cationic amino acid transporter 2) (Solute carrier family 7 member 2)"	"0% (0/6)"	1	0	NA	NA
"1"	8.52	"GO:0061459"	"L-arginine transmembrane transporter activity"	"Enables the transfer of L-arginine from one side of a membrane to the other."	"66.667% (4/6)"	0.0004055296	3.39	"Pocillopora_acuta_HIv2___RNAseq.25384_t;Pocillopora_acuta_HIv2___RNAseq.g19152.t1;Pocillopora_acuta_HIv2___RNAseq.g25241.t1;Pocillopora_acuta_HIv2___TS.g5171.t1"	"Cationic amino acid transporter 2 (CAT-2) (CAT2) (cCAT-2) (Low affinity cationic amino acid transporter 2) (Solute carrier family 7 member 2);High affinity cationic amino acid transporter 1 (CAT-1) (CAT1) (Ecotropic retroviral leukemia receptor homolog) (Ecotropic retrovirus receptor homolog) (Solute carrier family 7 member 1) (System Y+ basic amino acid transporter);Mitochondrial basic amino acids transporter (Carnitine/acylcarnitine translocase-like) (CACT-like) (Mitochondrial carnitine/acylcarnitine carrier protein CACL) (Mitochondrial ornithine transporter 3) (Solute carrier family 25 member 29);Cationic amino acid transporter 2 (CAT-2) (CAT2) (Low affinity cationic amino acid transporter 2) (Solute carrier family 7 member 2)"	"0% (0/6)"	1	0	NA	NA
"2"	6.62	"GO:0005272"	"sodium channel activity"	"Enables the energy-independent facilitated diffusion of a sodium ion through a transmembrane aqueous pore or channel."	"21.875% (7/32)"	0.008032106	2.1	"Pocillopora_acuta_HIv2___RNAseq.g24029.t1;Pocillopora_acuta_HIv2___RNAseq.g29670.t2;Pocillopora_acuta_HIv2___RNAseq.g701.t1;Pocillopora_acuta_HIv2___TS.g14960.t2;Pocillopora_acuta_HIv2___TS.g15134.t1;Pocillopora_acuta_HIv2___TS.g16172.t3;Pocillopora_acuta_HIv2___TS.g21128.t1"	"Amiloride-sensitive sodium channel subunit alpha (Alpha-NaCH) (Epithelial Na(+) channel subunit alpha) (Alpha-ENaC) (Nonvoltage-gated sodium channel 1 subunit alpha) (SCNEA);Cyclic nucleotide-gated channel alpha-3 (CNG channel alpha-3) (CNG-3) (CNG3) (Cone photoreceptor cGMP-gated channel subunit alpha-3);Polycystin-2 (Polycystic kidney disease 2 protein homolog);Glutamate receptor ionotropic, kainate 2 (GluK2) (Glutamate receptor 6) (GluR-6) (GluR6);Mechanosensory protein 2;Sodium channel protein 1 brain (Sodium channel protein I brain);Sodium channel protein type 4 subunit alpha B (Voltage-gated sodium channel subunit alpha Nav1.4b)"	"0% (0/32)"	1	0	NA	NA
"2"	5.62	"GO:0005262"	"calcium channel activity"	"Enables the energy-independent facilitated diffusion of a calcium ion through a transmembrane aqueous pore or channel."	"17.045% (15/88)"	0.001973255	2.7	"Pocillopora_acuta_HIv2___RNAseq.10010_t;Pocillopora_acuta_HIv2___RNAseq.g11916.t1;Pocillopora_acuta_HIv2___RNAseq.g12898.t1;Pocillopora_acuta_HIv2___RNAseq.g15159.t1;Pocillopora_acuta_HIv2___RNAseq.g23883.t2;Pocillopora_acuta_HIv2___RNAseq.g24761.t1;Pocillopora_acuta_HIv2___RNAseq.g26118.t1;Pocillopora_acuta_HIv2___RNAseq.g29670.t2;Pocillopora_acuta_HIv2___RNAseq.g5755.t1;Pocillopora_acuta_HIv2___RNAseq.g701.t1;Pocillopora_acuta_HIv2___RNAseq.g702.t1;Pocillopora_acuta_HIv2___RNAseq.g710.t1;Pocillopora_acuta_HIv2___RNAseq.g9466.t1;Pocillopora_acuta_HIv2___TS.g14960.t2;Pocillopora_acuta_HIv2___TS.g21857.t1"	"Transient receptor potential cation channel subfamily A member 1 (Ankyrin-like with transmembrane domains protein 1) (Transformation-sensitive protein p120) (p120) (Wasabi receptor);Neuronal acetylcholine receptor subunit alpha-10 (Alpha 10 nAChR) (Nicotinic acetylcholine receptor subunit alpha-10) (NACHR alpha-10);Sodium/potassium/calcium exchanger 4 (Na(+)/K(+)/Ca(2+)-exchange protein 4) (Solute carrier family 24 member 4);Polycystin-1-like protein 2 (Polycystin-1L2) (PC1-like 2 protein) (Polycystic kidney disease protein 1-like 2);VWFA and cache domain-containing protein 1 (Cache domain-containing protein 1);Annexin A6 (Annexin VI) (Annexin-6);Voltage-dependent calcium channel type A subunit alpha-1 (Cacophony protein);Cyclic nucleotide-gated channel alpha-3 (CNG channel alpha-3) (CNG-3) (CNG3) (Cone photoreceptor cGMP-gated channel subunit alpha-3);Short transient receptor potential channel 5 (TrpC5) (Capacitative calcium entry channel 2) (CCE2) (Transient receptor protein 5) (TRP-5) (mTRP5) (Trp-related protein 5);Polycystin-2 (Polycystic kidney disease 2 protein homolog);Sperm receptor for egg jelly (suREJ);Polycystin-1-like protein 2 (Polycystin-1L2) (PC1-like 2 protein) (Polycystic kidney disease protein 1-like 2);Transient receptor potential cation channel subfamily A member 1 (Ankyrin-like with transmembrane domains protein 1) (Wasabi receptor);Glutamate receptor ionotropic, kainate 2 (GluK2) (Glutamate receptor 6) (GluR-6) (GluR6);Polycystin-1-like protein 3 (Polycystin-1L3) (PC1-like 3 protein) (Polycystic kidney disease protein 1-like 3)"	"0% (0/88)"	1	0	NA	NA
"2"	6.38	"GO:0022824"	"transmitter-gated monoatomic ion channel activity"	"Enables the transmembrane transfer of an ion by a channel that opens when a specific neurotransmitter has been bound by the channel complex or one of its constituent parts."	"26.923% (7/26)"	0.002318939	2.63	"Pocillopora_acuta_HIv2___RNAseq.g11916.t1;Pocillopora_acuta_HIv2___RNAseq.g21572.t1a;Pocillopora_acuta_HIv2___RNAseq.g26672.t1;Pocillopora_acuta_HIv2___RNAseq.g27413.t1;Pocillopora_acuta_HIv2___RNAseq.g28202.t1;Pocillopora_acuta_HIv2___RNAseq.g28741.t1;Pocillopora_acuta_HIv2___TS.g14960.t2"	"Neuronal acetylcholine receptor subunit alpha-10 (Alpha 10 nAChR) (Nicotinic acetylcholine receptor subunit alpha-10) (NACHR alpha-10);Gamma-aminobutyric acid receptor subunit beta-3 (GABA(A) receptor subunit beta-3) (GABAAR subunit beta-3);Neuronal acetylcholine receptor subunit alpha-7;Gamma-aminobutyric acid receptor subunit beta-3 (GABA(A) receptor subunit beta-3) (GABAAR subunit beta-3);Neuronal acetylcholine receptor subunit beta-3;Glycine receptor subunit alpha-1 (Glycine receptor 48 kDa subunit) (Glycine receptor strychnine-binding subunit);Glutamate receptor ionotropic, kainate 2 (GluK2) (Glutamate receptor 6) (GluR-6) (GluR6)"	"0% (0/26)"	1	0	NA	NA
"2"	6.48	"GO:0005254"	"chloride channel activity"	"Enables the energy-independent facilitated diffusion of a chloride ion through a transmembrane aqueous pore or channel."	"21.212% (7/33)"	0.00955579	2.02	"Pocillopora_acuta_HIv2___RNAseq.g17622.t1;Pocillopora_acuta_HIv2___RNAseq.g19042.t1;Pocillopora_acuta_HIv2___RNAseq.g19043.t1;Pocillopora_acuta_HIv2___RNAseq.g21572.t1a;Pocillopora_acuta_HIv2___RNAseq.g27413.t1;Pocillopora_acuta_HIv2___RNAseq.g28741.t1;Pocillopora_acuta_HIv2___TS.g19790.t1"	"Methylosome subunit pICln (Chloride channel, nucleotide sensitive 1A) (Chloride conductance regulatory protein ICln) (I(Cln));Anoctamin-7 (Dresden transmembrane protein of the prostate) (D-TMPP) (IPCA-5) (New gene expressed in prostate) (Prostate cancer-associated protein 5) (Transmembrane protein 16G);Anoctamin-7 (New gene expressed in prostate homolog) (Transmembrane protein 16G);Gamma-aminobutyric acid receptor subunit beta-3 (GABA(A) receptor subunit beta-3) (GABAAR subunit beta-3);Gamma-aminobutyric acid receptor subunit beta-3 (GABA(A) receptor subunit beta-3) (GABAAR subunit beta-3);Glycine receptor subunit alpha-1 (Glycine receptor 48 kDa subunit) (Glycine receptor strychnine-binding subunit);Chloride intracellular channel protein 3 (Glutaredoxin-like oxidoreductase CLIC3) (EC 1.8.-.-)"	"0% (0/33)"	1	0	NA	NA
"2"	7.48	"GO:0099095"	"ligand-gated monoatomic anion channel activity"	"Enables the transmembrane transfer of an inorganic anion by a channel that opens when a specific ligand has been bound by the channel complex or one of its constituent parts."	"31.25% (5/16)"	0.004941596	2.31	"Pocillopora_acuta_HIv2___RNAseq.g17622.t1;Pocillopora_acuta_HIv2___RNAseq.g19042.t1;Pocillopora_acuta_HIv2___RNAseq.g21572.t1a;Pocillopora_acuta_HIv2___RNAseq.g27413.t1;Pocillopora_acuta_HIv2___RNAseq.g28741.t1"	"Methylosome subunit pICln (Chloride channel, nucleotide sensitive 1A) (Chloride conductance regulatory protein ICln) (I(Cln));Anoctamin-7 (Dresden transmembrane protein of the prostate) (D-TMPP) (IPCA-5) (New gene expressed in prostate) (Prostate cancer-associated protein 5) (Transmembrane protein 16G);Gamma-aminobutyric acid receptor subunit beta-3 (GABA(A) receptor subunit beta-3) (GABAAR subunit beta-3);Gamma-aminobutyric acid receptor subunit beta-3 (GABA(A) receptor subunit beta-3) (GABAAR subunit beta-3);Glycine receptor subunit alpha-1 (Glycine receptor 48 kDa subunit) (Glycine receptor strychnine-binding subunit)"	"0% (0/16)"	1	0	NA	NA
"3"	6.62	"GO:0035198"	"miRNA binding"	"Binding to a microRNA, a 21-23 nucleotide RNA that is processed from a stem-loop RNA precursor (pre-miRNA) that is encoded within plant and animal genomes."	"20% (8/40)"	0.008285355	2.08	"Pocillopora_acuta_HIv2___RNAseq.g13082.t1;Pocillopora_acuta_HIv2___RNAseq.g16905.t1;Pocillopora_acuta_HIv2___RNAseq.g1800.t1;Pocillopora_acuta_HIv2___RNAseq.g24787.t1;Pocillopora_acuta_HIv2___RNAseq.g24800.t1;Pocillopora_acuta_HIv2___RNAseq.g28169.t1;Pocillopora_acuta_HIv2___RNAseq.g4128.t2;Pocillopora_acuta_HIv2___RNAseq.g4938.t1"	"Putative methyltransferase C9orf114 (EC 2.1.1.-) (Centromere protein 32) (CENP-32) (Kinetochore-associated protein) (SPOUT domain-containing methyltransferase 1);E3 ubiquitin-protein ligase TRIM71 (EC 2.3.2.27) (Protein lin-41 homolog) (RING-type E3 ubiquitin transferase TRIM71) (Tripartite motif-containing protein 71);E3 ubiquitin-protein ligase TRIM71 (EC 2.3.2.27) (Protein lin-41 homolog) (RING-type E3 ubiquitin transferase TRIM71) (Tripartite motif-containing protein 71);E3 ubiquitin-protein ligase TRIM71 (EC 2.3.2.27) (Protein lin-41 homolog) (RING-type E3 ubiquitin transferase TRIM71) (Tripartite motif-containing protein 71);E3 ubiquitin-protein ligase TRIM71 (EC 2.3.2.27) (Protein lin-41 homolog) (RING-type E3 ubiquitin transferase TRIM71) (Tripartite motif-containing protein 71);E3 ubiquitin-protein ligase TRIM71 (EC 2.3.2.27) (Protein lin-41 homolog) (RING-type E3 ubiquitin transferase TRIM71) (Tripartite motif-containing protein 71);Terminal uridylyltransferase 4 (TUTase 4) (EC 2.7.7.52) (Zinc finger CCHC domain-containing protein 11);E3 ubiquitin-protein ligase TRIM71 (EC 2.3.2.27) (Protein lin-41 homolog) (RING-type E3 ubiquitin transferase TRIM71) (Tripartite motif-containing protein 71)"	"0% (0/40)"	1	0	NA	NA
"3"	4.54	"GO:0000977"	"RNA polymerase II transcription regulatory region sequence-specific DNA binding"	"Binding to a specific sequence of DNA that is part of a regulatory region that controls the transcription of a gene or cistron by RNA polymerase II."	"11.806% (34/288)"	0.004819527	2.32	"Pocillopora_acuta_HIv2___RNAseq.26564_t;Pocillopora_acuta_HIv2___RNAseq.665_t;Pocillopora_acuta_HIv2___RNAseq.g10180.t1;Pocillopora_acuta_HIv2___RNAseq.g10408.t1;Pocillopora_acuta_HIv2___RNAseq.g10896.t1;Pocillopora_acuta_HIv2___RNAseq.g14060.t1;Pocillopora_acuta_HIv2___RNAseq.g16169.t1;Pocillopora_acuta_HIv2___RNAseq.g1930.t1;Pocillopora_acuta_HIv2___RNAseq.g1932.t1;Pocillopora_acuta_HIv2___RNAseq.g21912.t1;Pocillopora_acuta_HIv2___RNAseq.g22722.t1;Pocillopora_acuta_HIv2___RNAseq.g22749.t1;Pocillopora_acuta_HIv2___RNAseq.g23053.t1;Pocillopora_acuta_HIv2___RNAseq.g25327.t1;Pocillopora_acuta_HIv2___RNAseq.g25686.t1;Pocillopora_acuta_HIv2___RNAseq.g25869.t1;Pocillopora_acuta_HIv2___RNAseq.g27673.t1;Pocillopora_acuta_HIv2___RNAseq.g28639.t1;Pocillopora_acuta_HIv2___RNAseq.g29836.t1;Pocillopora_acuta_HIv2___RNAseq.g30214.t1;Pocillopora_acuta_HIv2___RNAseq.g31038.t1;Pocillopora_acuta_HIv2___RNAseq.g3322.t1;Pocillopora_acuta_HIv2___RNAseq.g3580.t1;Pocillopora_acuta_HIv2___RNAseq.g3837.t1a;Pocillopora_acuta_HIv2___RNAseq.g439.t1;Pocillopora_acuta_HIv2___RNAseq.g7803.t1;Pocillopora_acuta_HIv2___RNAseq.g8093.t1;Pocillopora_acuta_HIv2___RNAseq.g8690.t1;Pocillopora_acuta_HIv2___TS.g11075.t2;Pocillopora_acuta_HIv2___TS.g16611.t1;Pocillopora_acuta_HIv2___TS.g19999.t1;Pocillopora_acuta_HIv2___TS.g21030.t2;Pocillopora_acuta_HIv2___TS.g23568.t2d;Pocillopora_acuta_HIv2___TS.g4588.t1"	"Transcription factor AP-2-alpha (AP2-alpha) (AP-2 transcription factor) (Activating enhancer-binding protein 2-alpha) (Activator protein 2) (AP-2);POU domain, class 4, transcription factor 3 (Brain-specific homeobox/POU domain protein 3C) (Brain-3C) (Brn-3C);Homeobox protein Nkx-2.5 (xNKx-2.5) (Homeobox protein NK-2 homolog E);Nuclear transcription factor Y subunit alpha (CAAT box DNA-binding protein subunit A) (Nuclear transcription factor Y subunit A) (NF-YA);Achaete-scute homolog 4 (ASH-4) (hASH4) (Achaete-scute-like protein 4) (Class A basic helix-loop-helix protein 44) (bHLHa44);Insulinoma-associated protein 1 (Zinc finger protein IA-1);LIM/homeobox protein Lhx1 (LIM homeobox protein 1) (Homeobox protein Lim-1) (Xlim1) (x-Lhx1) (xLIM-1);Transcriptional regulator Myc-A (c-Myc-A) (zc-Myc);Protein S-Myc;Homeobox protein HMX3 (Homeobox protein H6 family member 3) (Homeobox protein Nkx-5.1);Transcription factor ovo-like homolog lin-48 (Abnormal cell lineage protein 48);Transcription factor Sox-3;Protein capicua homolog;Krueppel-like factor 5 (Basic transcription element-binding protein 2) (BTE-binding protein 2) (Colon krueppel-like factor) (GC-box-binding protein 2) (Intestinal-enriched krueppel-like factor) (Transcription factor BTEB2);Transcription factor Sox-14;DNA-binding protein RFX6 (Regulatory factor X 6);Paired box protein Pax-6 (Oculorhombin);DNA-binding protein RFX7 (Regulatory factor X 7);Circadian locomoter output cycles protein kaput;Storkhead-box protein 1;ETS translocation variant 1 (Ets-related protein 81);Homeobox protein Dlx4a (DLX-8) (Distal-less homeobox protein 4a);Pancreas transcription factor 1 subunit alpha (Pancreas-specific transcription factor 1a) (bHLH transcription factor p48);Paired box protein Pax-2a (No isthmus protein) (Pax[Zf-b]);N-glycosylase/DNA lyase [Includes: 8-oxoguanine DNA glycosylase (EC 3.2.2.-); DNA-(apurinic or apyrimidinic site) lyase (AP lyase) (EC 4.2.99.18)];Transcription factor sox-2;Chromodomain-helicase-DNA-binding protein 7 (CHD-7) (EC 3.6.4.12) (ATP-dependent helicase CHD7);Forkhead box protein L2;Transcriptional enhancer factor TEF-1 (NTEF-1) (Protein GT-IIC) (TEA domain family member 1) (TEAD-1) (Transcription factor 13) (TCF-13);Zinc finger protein 709;Retinal homeobox protein Rx2;Doublesex- and mab-3-related transcription factor A2 (Doublesex- and mab-3-related transcription factor 5);DNA-binding protein P3A2;Transcription factor Sp5"	"4.167% (12/288)"	0.3616209	0.44	NA	NA
"3"	8.23	"GO:0042806"	"fucose binding"	"Binding to fucose, the pentose 6-deoxygalactose."	"62.5% (5/8)"	0.0001047371	3.98	"Pocillopora_acuta_HIv2___RNAseq.g12286.t1;Pocillopora_acuta_HIv2___RNAseq.g12290.t1;Pocillopora_acuta_HIv2___RNAseq.g12292.t1;Pocillopora_acuta_HIv2___RNAseq.g28858.t1;Pocillopora_acuta_HIv2___TS.g3256.t1"	"Fucolectin-4;Fucolectin;Fucolectin;Collectin-11 (Collectin kidney protein 1) (CL-K1);Fucolectin-3"	"0% (0/8)"	1	0	NA	NA
"3"	7.36	"GO:0009374"	"biotin binding"	"Binding to biotin (cis-tetrahydro-2-oxothieno(3,4-d)imidazoline-4-valeric acid), the (+) enantiomer of which is very widely distributed in cells and serves as a carrier in a number of enzymatic beta-carboxylation reactions."	"42.105% (8/19)"	3.284521e-05	4.48	"Pocillopora_acuta_HIv2___RNAseq.g28227.t1;Pocillopora_acuta_HIv2___RNAseq.g3222.t1;Pocillopora_acuta_HIv2___RNAseq.g8913.t1;Pocillopora_acuta_HIv2___RNAseq.g8915.t1;Pocillopora_acuta_HIv2___TS.g1731.t1;Pocillopora_acuta_HIv2___TS.g19499.t2;Pocillopora_acuta_HIv2___TS.g23115.t1;Pocillopora_acuta_HIv2___TS.g9749.t1"	"Fibropellin-1 (Epidermal growth factor-related protein 1) (Fibropellin-I) (SpEGF I) (UEGF-1);Fibropellin-3 (Epidermal growth factor-related protein 3) (Fibropellin III) (Fibropellin-c) (SpEGF III);Fibropellin-1 (Epidermal growth factor-related protein 1) (Fibropellin-I) (SpEGF I) (UEGF-1);Fibropellin-1 (Epidermal growth factor-related protein 1) (Fibropellin-I) (SpEGF I) (UEGF-1);Fibropellin-1 (Epidermal growth factor-related protein 1) (Fibropellin-I) (SpEGF I) (UEGF-1);Fibropellin-3 (Epidermal growth factor-related protein 3) (Fibropellin III) (Fibropellin-c) (SpEGF III);Fibropellin-1 (Epidermal growth factor-related protein 1) (Fibropellin-I) (SpEGF I) (UEGF-1);Fibropellin-1 (Epidermal growth factor-related protein 1) (Fibropellin-I) (SpEGF I) (UEGF-1)"	"5.263% (1/19)"	0.5072655	0.29	NA	NA
"3"	6.52	"GO:0050661"	"NADP binding"	"Binding to nicotinamide-adenine dinucleotide phosphate, a coenzyme involved in many redox and biosynthetic reactions; binding may be to either the oxidized form, NADP+, or the reduced form, NADPH."	"20.455% (9/44)"	0.004465399	2.35	"Pocillopora_acuta_HIv2___RNAseq.g12049.t1;Pocillopora_acuta_HIv2___RNAseq.g17117.t1;Pocillopora_acuta_HIv2___RNAseq.g19367.t1;Pocillopora_acuta_HIv2___RNAseq.g26503.t1;Pocillopora_acuta_HIv2___RNAseq.g30929.t1;Pocillopora_acuta_HIv2___RNAseq.g8058.t1;Pocillopora_acuta_HIv2___RNAseq.g8849.t1;Pocillopora_acuta_HIv2___TS.g23308.t1;Pocillopora_acuta_HIv2___TS.g5148.t1"	"NADPH--cytochrome P450 reductase (CPR) (P450R) (EC 1.6.2.4);Nitric oxide synthase 1 (EC 1.14.13.39) (Constitutive NOS) (NC-NOS) (NOS type I) (Neuronal NOS) (N-NOS) (nNOS) (Nitric oxide synthase, brain) (bNOS) (Peptidyl-cysteine S-nitrosylase NOS1);Methylenetetrahydrofolate reductase (NADPH) (EC 1.5.1.53);3-hydroxyisobutyrate dehydrogenase, mitochondrial (HIBADH) (EC 1.1.1.31);Quinone oxidoreductase PIG3 (EC 1.6.5.5) (NADPH:quinone reductase PIG3) (Tumor protein p53-inducible protein 3) (Protein PIG3) (p53-induced gene 3 protein);GDP-mannose 4,6 dehydratase (EC 4.2.1.47) (GDP-D-mannose dehydratase) (GMD);2-haloacrylate reductase (EC 1.3.1.103);Trimethylamine monooxygenase (TMA monooxygenase) (Tmm) (EC 1.14.13.148);6-phosphogluconate dehydrogenase, decarboxylating (EC 1.1.1.44)"	"6.818% (3/44)"	0.216316	0.66	NA	NA
"4"	6.81	"GO:0005544"	"calcium-dependent phospholipid binding"	"Binding to a phospholipid, a class of lipids containing phosphoric acid as a mono- or diester, in the presence of calcium."	"24.242% (8/33)"	0.002372709	2.62	"Pocillopora_acuta_HIv2___RNAseq.30415_t;Pocillopora_acuta_HIv2___RNAseq.g13403.t1;Pocillopora_acuta_HIv2___RNAseq.g24760.t1;Pocillopora_acuta_HIv2___RNAseq.g24761.t1;Pocillopora_acuta_HIv2___RNAseq.g2827.t1;Pocillopora_acuta_HIv2___RNAseq.g28815.t1;Pocillopora_acuta_HIv2___RNAseq.g4028.t1;Pocillopora_acuta_HIv2___RNAseq.g4031.t1c"	"Synaptotagmin-10 (Synaptotagmin X) (SytX);Synaptotagmin-9 (Synaptotagmin IX) (SytIX);Cytosolic phospholipase A2 (cPLA2) (Phospholipase A2 group IVA) [Includes: Phospholipase A2 (EC 3.1.1.4) (Phosphatidylcholine 2-acylhydrolase); Lysophospholipase (EC 3.1.1.5)];Annexin A6 (Annexin VI) (Annexin-6);Synaptotagmin-7 (IPCA-7) (Prostate cancer-associated protein 7) (Synaptotagmin VII) (SytVII);Synaptotagmin-1 (Synaptotagmin I) (SytI);Synaptotagmin-7 (IPCA-7) (Prostate cancer-associated protein 7) (Synaptotagmin VII) (SytVII);Synaptotagmin-1 (Synaptotagmin I) (SytI)"	"6.061% (2/33)"	0.3408297	0.47	NA	NA
"4"	6.81	"GO:0001786"	"phosphatidylserine binding"	"Binding to phosphatidylserine, a class of glycophospholipids in which a phosphatidyl group is esterified to the hydroxyl group of L-serine."	"21.212% (7/33)"	0.00955579	2.02	"Pocillopora_acuta_HIv2___RNAseq.30415_t;Pocillopora_acuta_HIv2___RNAseq.g13403.t1;Pocillopora_acuta_HIv2___RNAseq.g24761.t1;Pocillopora_acuta_HIv2___RNAseq.g2827.t1;Pocillopora_acuta_HIv2___RNAseq.g28815.t1;Pocillopora_acuta_HIv2___RNAseq.g4028.t1;Pocillopora_acuta_HIv2___RNAseq.g4031.t1c"	"Synaptotagmin-10 (Synaptotagmin X) (SytX);Synaptotagmin-9 (Synaptotagmin IX) (SytIX);Annexin A6 (Annexin VI) (Annexin-6);Synaptotagmin-7 (IPCA-7) (Prostate cancer-associated protein 7) (Synaptotagmin VII) (SytVII);Synaptotagmin-1 (Synaptotagmin I) (SytI);Synaptotagmin-7 (IPCA-7) (Prostate cancer-associated protein 7) (Synaptotagmin VII) (SytVII);Synaptotagmin-1 (Synaptotagmin I) (SytI)"	"6.061% (2/33)"	0.3408297	0.47	NA	NA
