GO.cluster	IC	GO.ID	term	definition	Oral_elim.genes_frequency	Oral_elim.pvalue	Oral_elim.-log10_pvalue	Oral_elim.Significant_genes	Oral_elim.Significant_genes_symbol	Aboral_elim.genes_frequency	Aboral_elim.pvalue	Aboral_elim.-log10_pvalue	Aboral_elim.Significant_genes	Aboral_elim.Significant_genes_symbol
"4"	3.98	"GO:0005509"	"calcium ion binding"	"Binding to a calcium ion (Ca2+)."	"15.206% (85/559)"	7.813957e-11	10.11	"Pocillopora_acuta_HIv2___RNAseq.30415_t;Pocillopora_acuta_HIv2___RNAseq.6093_tb;Pocillopora_acuta_HIv2___RNAseq.g10475.t1;Pocillopora_acuta_HIv2___RNAseq.g11580.t1;Pocillopora_acuta_HIv2___RNAseq.g11588.t1;Pocillopora_acuta_HIv2___RNAseq.g12286.t1;Pocillopora_acuta_HIv2___RNAseq.g12290.t1;Pocillopora_acuta_HIv2___RNAseq.g12292.t1;Pocillopora_acuta_HIv2___RNAseq.g12617.t1;Pocillopora_acuta_HIv2___RNAseq.g13403.t1;Pocillopora_acuta_HIv2___RNAseq.g13576.t1;Pocillopora_acuta_HIv2___RNAseq.g13977.t1;Pocillopora_acuta_HIv2___RNAseq.g14640.t1;Pocillopora_acuta_HIv2___RNAseq.g14871.t1;Pocillopora_acuta_HIv2___RNAseq.g15159.t1;Pocillopora_acuta_HIv2___RNAseq.g15567.t1;Pocillopora_acuta_HIv2___RNAseq.g16486.t1;Pocillopora_acuta_HIv2___RNAseq.g16948.t1;Pocillopora_acuta_HIv2___RNAseq.g18121.t1;Pocillopora_acuta_HIv2___RNAseq.g18214.t1;Pocillopora_acuta_HIv2___RNAseq.g19312.t1;Pocillopora_acuta_HIv2___RNAseq.g19392.t1;Pocillopora_acuta_HIv2___RNAseq.g19600.t1;Pocillopora_acuta_HIv2___RNAseq.g20232.t1;Pocillopora_acuta_HIv2___RNAseq.g2384.t1;Pocillopora_acuta_HIv2___RNAseq.g24120.t1;Pocillopora_acuta_HIv2___RNAseq.g24760.t1;Pocillopora_acuta_HIv2___RNAseq.g24761.t1;Pocillopora_acuta_HIv2___RNAseq.g25003.t1;Pocillopora_acuta_HIv2___RNAseq.g25934.t1;Pocillopora_acuta_HIv2___RNAseq.g26118.t1;Pocillopora_acuta_HIv2___RNAseq.g26596.t1;Pocillopora_acuta_HIv2___RNAseq.g26613.t1;Pocillopora_acuta_HIv2___RNAseq.g26782.t1;Pocillopora_acuta_HIv2___RNAseq.g27399.t1;Pocillopora_acuta_HIv2___RNAseq.g28025.t1;Pocillopora_acuta_HIv2___RNAseq.g2813.t4;Pocillopora_acuta_HIv2___RNAseq.g28227.t1;Pocillopora_acuta_HIv2___RNAseq.g2827.t1;Pocillopora_acuta_HIv2___RNAseq.g28815.t1;Pocillopora_acuta_HIv2___RNAseq.g28858.t1;Pocillopora_acuta_HIv2___RNAseq.g2915.t1;Pocillopora_acuta_HIv2___RNAseq.g29841.t1;Pocillopora_acuta_HIv2___RNAseq.g3016.t1;Pocillopora_acuta_HIv2___RNAseq.g3051.t1;Pocillopora_acuta_HIv2___RNAseq.g30904.t1;Pocillopora_acuta_HIv2___RNAseq.g3222.t1;Pocillopora_acuta_HIv2___RNAseq.g3532.t1;Pocillopora_acuta_HIv2___RNAseq.g4028.t1;Pocillopora_acuta_HIv2___RNAseq.g4031.t1c;Pocillopora_acuta_HIv2___RNAseq.g4369.t1;Pocillopora_acuta_HIv2___RNAseq.g4399.t2;Pocillopora_acuta_HIv2___RNAseq.g4732.t1;Pocillopora_acuta_HIv2___RNAseq.g6366.t1;Pocillopora_acuta_HIv2___RNAseq.g701.t1;Pocillopora_acuta_HIv2___RNAseq.g702.t1;Pocillopora_acuta_HIv2___RNAseq.g710.t1;Pocillopora_acuta_HIv2___RNAseq.g7553.t1;Pocillopora_acuta_HIv2___RNAseq.g8520.t1;Pocillopora_acuta_HIv2___RNAseq.g8644.t1;Pocillopora_acuta_HIv2___RNAseq.g8913.t1;Pocillopora_acuta_HIv2___RNAseq.g8915.t1;Pocillopora_acuta_HIv2___TS.g14552.t1;Pocillopora_acuta_HIv2___TS.g14962.t1;Pocillopora_acuta_HIv2___TS.g1731.t1;Pocillopora_acuta_HIv2___TS.g19499.t2;Pocillopora_acuta_HIv2___TS.g20007.t1;Pocillopora_acuta_HIv2___TS.g20880.t1;Pocillopora_acuta_HIv2___TS.g21616.t3a;Pocillopora_acuta_HIv2___TS.g22704.t2;Pocillopora_acuta_HIv2___TS.g23115.t1;Pocillopora_acuta_HIv2___TS.g23175.t1;Pocillopora_acuta_HIv2___TS.g24807.t1;Pocillopora_acuta_HIv2___TS.g25258.t1;Pocillopora_acuta_HIv2___TS.g25259.t2;Pocillopora_acuta_HIv2___TS.g29407.t1;Pocillopora_acuta_HIv2___TS.g3024.t4;Pocillopora_acuta_HIv2___TS.g3256.t1;Pocillopora_acuta_HIv2___TS.g6578.t1;Pocillopora_acuta_HIv2___TS.g7149.t2;Pocillopora_acuta_HIv2___TS.g9126.t1;Pocillopora_acuta_HIv2___TS.g9414.t1;Pocillopora_acuta_HIv2___TS.g9749.t1;Pocillopora_acuta_HIv2___TS.g9752.t3;Pocillopora_acuta_HIv2___TS.g9777.t1"	"Synaptotagmin-10 (Synaptotagmin X) (SytX);Multiple coagulation factor deficiency protein 2 homolog (Neural stem cell-derived neuronal survival protein);Myoferlin (Fer-1-like protein 3);Hemicentin-1 (Fibulin-6) (FIBL-6);Mucin-like protein;Fucolectin-4;Fucolectin;Fucolectin;Calcium-binding mitochondrial carrier protein (Mitochondrial substrate carrier family protein O);Synaptotagmin-9 (Synaptotagmin IX) (SytIX);Aggrecan core protein (Cartilage-specific proteoglycan core protein) (CSPCP);Mucin-like protein;Oncoprotein-induced transcript 3 protein (Liver-specific zona pellucida domain-containing protein);Extracellular calcium-sensing receptor (CaSR) (Parathyroid cell calcium-sensing receptor) (PCaR1) (RaKCaR);Polycystin-1-like protein 2 (Polycystin-1L2) (PC1-like 2 protein) (Polycystic kidney disease protein 1-like 2);Myosin-2 essential light chain (Myosin II essential light chain) (Non-muscle myosin essential light chain);Mucin-like protein;Neurocalcin homolog (DrosNCa);Sodium/calcium exchanger NCL2 (Na(+)/Ca(2+)-exchange protein NCL2) (OsEFCAX2) (Protein NCX-like 2) (OsNCL2);Sushi, von Willebrand factor type A, EGF and pentraxin domain-containing protein 1 (Polydom);Collagenase 3 (EC 3.4.24.-) (Matrix metalloproteinase-13) (MMP-13);1-phosphatidylinositol 4,5-bisphosphate phosphodiesterase eta-2 (EC 3.1.4.11) (Phosphoinositide phospholipase C-eta-2) (Phosphoinositide phospholipase C-like 4) (PLC-L4) (Phospholipase C-like protein 4) (Phospholipase C-eta-2) (PLC-eta2);Calcyphosin-like protein;Sushi, nidogen and EGF-like domain-containing protein 1 (Insulin-responsive sequence DNA-binding protein 1) (IRE-BP1);Calmodulin, striated muscle;Uromodulin (Tamm-Horsfall urinary glycoprotein) (THP) [Cleaved into: Uromodulin, secreted form];Cytosolic phospholipase A2 (cPLA2) (Phospholipase A2 group IVA) [Includes: Phospholipase A2 (EC 3.1.1.4) (Phosphatidylcholine 2-acylhydrolase); Lysophospholipase (EC 3.1.1.5)];Annexin A6 (Annexin VI) (Annexin-6);Mucin-like protein;Fibrillin-1 [Cleaved into: Asprosin];Voltage-dependent calcium channel type A subunit alpha-1 (Cacophony protein);Hemicentin-2;Calcyphosin-2 (Calcyphosine-2);Tolloid-like protein 1 (EC 3.4.24.-) (Chicken tolloid-like protein 1) (Metalloprotease colloid);Tolloid-like protein 2 (EC 3.4.24.-) (Metalloprotease xolloid) (Xenopus tolloid);Cubilin (Intrinsic factor-cobalamin receptor);EF-hand calcium-binding domain-containing protein 4B (Calcium release-activated channel regulator 2A) (Ras-related protein Rab-46);Fibropellin-1 (Epidermal growth factor-related protein 1) (Fibropellin-I) (SpEGF I) (UEGF-1);Synaptotagmin-7 (IPCA-7) (Prostate cancer-associated protein 7) (Synaptotagmin VII) (SytVII);Synaptotagmin-1 (Synaptotagmin I) (SytI);Collectin-11 (Collectin kidney protein 1) (CL-K1);Cadherin EGF LAG seven-pass G-type receptor 1 (Cadherin family member 9) (Flamingo homolog 2) (hFmi2);Matrilin-2;Carbamoyl-phosphate synthase [ammonia], mitochondrial (EC 6.3.4.16) (Carbamoyl-phosphate synthetase I) (CPSase I);Villin-1;Calmodulin-2 (CaM-2);Fibropellin-3 (Epidermal growth factor-related protein 3) (Fibropellin III) (Fibropellin-c) (SpEGF III);Myosin regulatory light polypeptide 9 (Myosin regulatory light chain 2, smooth muscle isoform) (Myosin regulatory light chain 9);Synaptotagmin-7 (IPCA-7) (Prostate cancer-associated protein 7) (Synaptotagmin VII) (SytVII);Synaptotagmin-1 (Synaptotagmin I) (SytI);Low-density lipoprotein receptor-related protein 4 (LRP-4) (Multiple epidermal growth factor-like domains 7);Low-density lipoprotein receptor-related protein 8 (LRP-8) (Apolipoprotein E receptor 2);Calmodulin (CaM);Adhesion G protein-coupled receptor L4;Polycystin-2 (Polycystic kidney disease 2 protein homolog);Sperm receptor for egg jelly (suREJ);Polycystin-1-like protein 2 (Polycystin-1L2) (PC1-like 2 protein) (Polycystic kidney disease protein 1-like 2);Protocadherin Fat 1 (Cadherin family member 7) (Cadherin-related tumor suppressor homolog) (Protein fat homolog) [Cleaved into: Protocadherin Fat 1, nuclear form];Hemicentin-1 (Fibulin-6) (FIBL-6);Calmodulin (CaM);Fibropellin-1 (Epidermal growth factor-related protein 1) (Fibropellin-I) (SpEGF I) (UEGF-1);Fibropellin-1 (Epidermal growth factor-related protein 1) (Fibropellin-I) (SpEGF I) (UEGF-1);Cadherin-23 (Otocadherin);Diacylglycerol kinase beta (DAG kinase beta) (EC 2.7.1.107) (Diglyceride kinase beta) (DGK-beta);Fibropellin-1 (Epidermal growth factor-related protein 1) (Fibropellin-I) (SpEGF I) (UEGF-1);Fibropellin-3 (Epidermal growth factor-related protein 3) (Fibropellin III) (Fibropellin-c) (SpEGF III);Thrombospondin-3;Cell growth regulator with EF hand domain protein 1 (Cell growth regulatory gene 11 protein) (Hydrophobestin);Calmodulin (CaM);Calmodulin-like protein 3;Fibropellin-1 (Epidermal growth factor-related protein 1) (Fibropellin-I) (SpEGF I) (UEGF-1);Hemicentin-1 (Fibulin-6) (FIBL-6);Hemicentin-1 (Fibulin-6) (FIBL-6);Mucin-like protein;Mucin-like protein;Matrilin-2;Protein unc-13 homolog C (Munc13-3);Fucolectin-3;Protocadherin-like protein;Ciliary-associated calcium-binding coiled-coil protein 1;E3 ubiquitin-protein ligase CBL-B (EC 2.3.2.27) (RING-type E3 ubiquitin transferase CBL-B) (SH3-binding protein CBL-B) (Signal transduction protein CBL-B);Follistatin-related protein 5 (Follistatin-like protein 5) (m-D/Bsp120I 1-2);Fibropellin-1 (Epidermal growth factor-related protein 1) (Fibropellin-I) (SpEGF I) (UEGF-1);Protocadherin Fat 1 (Cadherin family member 7) (Cadherin-related tumor suppressor homolog) (Protein fat homolog) [Cleaved into: Protocadherin Fat 1, nuclear form];Oncoprotein-induced transcript 3 protein"	"11.807% (66/559)"	4.018841e-18	17.4	"Pocillopora_acuta_HIv2___RNAseq.10263_t;Pocillopora_acuta_HIv2___RNAseq.21012_t;Pocillopora_acuta_HIv2___RNAseq.21015_t;Pocillopora_acuta_HIv2___RNAseq.2533_t;Pocillopora_acuta_HIv2___RNAseq.26508_t;Pocillopora_acuta_HIv2___RNAseq.820_t;Pocillopora_acuta_HIv2___RNAseq.g10343.t1;Pocillopora_acuta_HIv2___RNAseq.g1075.t1;Pocillopora_acuta_HIv2___RNAseq.g1127.t2;Pocillopora_acuta_HIv2___RNAseq.g11876.t1;Pocillopora_acuta_HIv2___RNAseq.g12987.t1;Pocillopora_acuta_HIv2___RNAseq.g13823.t1;Pocillopora_acuta_HIv2___RNAseq.g14253.t1;Pocillopora_acuta_HIv2___RNAseq.g14769.t1;Pocillopora_acuta_HIv2___RNAseq.g15290.t1;Pocillopora_acuta_HIv2___RNAseq.g15698.t1;Pocillopora_acuta_HIv2___RNAseq.g15699.t1;Pocillopora_acuta_HIv2___RNAseq.g1638.t1;Pocillopora_acuta_HIv2___RNAseq.g16484.t1;Pocillopora_acuta_HIv2___RNAseq.g17517.t1;Pocillopora_acuta_HIv2___RNAseq.g17519.t1;Pocillopora_acuta_HIv2___RNAseq.g19085.t1;Pocillopora_acuta_HIv2___RNAseq.g21032.t1;Pocillopora_acuta_HIv2___RNAseq.g22527.t1;Pocillopora_acuta_HIv2___RNAseq.g23178.t1;Pocillopora_acuta_HIv2___RNAseq.g23210.t1;Pocillopora_acuta_HIv2___RNAseq.g24040.t1;Pocillopora_acuta_HIv2___RNAseq.g24688.t1;Pocillopora_acuta_HIv2___RNAseq.g25351.t1;Pocillopora_acuta_HIv2___RNAseq.g27031.t1;Pocillopora_acuta_HIv2___RNAseq.g2716.t1;Pocillopora_acuta_HIv2___RNAseq.g28109.t1;Pocillopora_acuta_HIv2___RNAseq.g28226.t2;Pocillopora_acuta_HIv2___RNAseq.g28502.t1;Pocillopora_acuta_HIv2___RNAseq.g28504.t1;Pocillopora_acuta_HIv2___RNAseq.g28800.t1;Pocillopora_acuta_HIv2___RNAseq.g28818.t1;Pocillopora_acuta_HIv2___RNAseq.g28910.t1;Pocillopora_acuta_HIv2___RNAseq.g28911.t1;Pocillopora_acuta_HIv2___RNAseq.g28971.t1a;Pocillopora_acuta_HIv2___RNAseq.g30322.t1;Pocillopora_acuta_HIv2___RNAseq.g30806.t1;Pocillopora_acuta_HIv2___RNAseq.g3515.t1;Pocillopora_acuta_HIv2___RNAseq.g3780.t1;Pocillopora_acuta_HIv2___RNAseq.g3826.t1;Pocillopora_acuta_HIv2___RNAseq.g5342.t1;Pocillopora_acuta_HIv2___RNAseq.g5388.t1;Pocillopora_acuta_HIv2___RNAseq.g7895.t1;Pocillopora_acuta_HIv2___RNAseq.g8148.t1;Pocillopora_acuta_HIv2___RNAseq.g8914.t1;Pocillopora_acuta_HIv2___RNAseq.g8916.t1;Pocillopora_acuta_HIv2___RNAseq.g9049.t1;Pocillopora_acuta_HIv2___TS.g11002.t4;Pocillopora_acuta_HIv2___TS.g12453.t2;Pocillopora_acuta_HIv2___TS.g1462.t1;Pocillopora_acuta_HIv2___TS.g15590.t1;Pocillopora_acuta_HIv2___TS.g18622.t1b;Pocillopora_acuta_HIv2___TS.g23602.t1;Pocillopora_acuta_HIv2___TS.g23673.t1;Pocillopora_acuta_HIv2___TS.g24743.t1;Pocillopora_acuta_HIv2___TS.g30706.t1;Pocillopora_acuta_HIv2___TS.g4835.t2;Pocillopora_acuta_HIv2___TS.g5115.t2;Pocillopora_acuta_HIv2___TS.g5308.t2;Pocillopora_acuta_HIv2___TS.g5338.t1;Pocillopora_acuta_HIv2___TS.g8258.t1"	"Extracellular sulfatase Sulf-2 (hSulf-2) (Arylsulfatase) (EC 3.1.6.1) (N-acetylglucosamine-6-sulfatase) (EC 3.1.6.14) [Cleaved into: Extracellular sulfatase Sulf-2 secreted form];Mannan-binding lectin serine protease 1 (EC 3.4.21.-) (Complement factor MASP-3) (Complement-activating component of Ra-reactive factor) (Mannose-binding lectin-associated serine protease 1) (MASP-1) (Mannose-binding protein-associated serine protease) (Ra-reactive factor serine protease p100) (RaRF) (Serine protease 5) [Cleaved into: Mannan-binding lectin serine protease 1 heavy chain; Mannan-binding lectin serine protease 1 light chain];Coagulation factor IX (EC 3.4.21.22) (Christmas factor) [Cleaved into: Coagulation factor IXa light chain; Coagulation factor IXa heavy chain];Hemicentin-1 (Fibulin-6) (FIBL-6);Signal peptide, CUB and EGF-like domain-containing protein 2 (Protein CEGP1) (Scube/You);Maternal embryonic leucine zipper kinase (MELK) (EC 2.7.11.1) (Protein kinase Eg3) (pEg3 kinase);Protocadherin Fat 3 (FAT tumor suppressor homolog 3);SPARC-related modular calcium-binding protein 2 (Secreted modular calcium-binding protein 2) (SMOC-2) (Smooth muscle-associated protein 2) (SMAP-2);Oncoprotein-induced transcript 3 protein (Liver-specific zona pellucida domain-containing protein);Mucin-like protein;Protocadherin Fat 4 (hFat4) (Cadherin family member 14) (FAT tumor suppressor homolog 4) (Fat-like cadherin protein FAT-J);Mucin-like protein;Hemicentin-1 (Fibulin-6) (FIBL-6);Fibrillin-2 [Cleaved into: Placensin];Prothrombin (EC 3.4.21.5) (Coagulation factor II) [Cleaved into: Activation peptide fragment 1; Activation peptide fragment 2; Thrombin light chain; Thrombin heavy chain];Myosin-2 essential light chain (Myosin II essential light chain) (Non-muscle myosin essential light chain);Myosin-2 essential light chain (Myosin II essential light chain) (Non-muscle myosin essential light chain);Fibropellin-1 (Epidermal growth factor-related protein 1) (Fibropellin-I) (SpEGF I) (UEGF-1);Tyrosine kinase receptor Cad96Ca (EC 2.7.10.1) (Cadherin-96Ca) (Tyrosine kinase receptor HD-14);Tyrosine kinase receptor Cad96Ca (EC 2.7.10.1) (Cadherin-96Ca) (Tyrosine kinase receptor HD-14);Tyrosine kinase receptor Cad96Ca (EC 2.7.10.1) (Cadherin-96Ca) (Tyrosine kinase receptor HD-14);Halomucin;Protein naked cuticle homolog 2-like (Naked-2-like) (Protein naked cuticle homolog 2-B) (Naked-2B);Tolloid-like protein 1 (EC 3.4.24.-) (Chicken tolloid-like protein 1) (Metalloprotease colloid);Hemicentin-2;Hemicentin-2;Synaptotagmin-3 (Synaptotagmin III) (SytIII);Neurexin-1 (Neurexin I-alpha) (Neurexin-1-alpha);Mammalian ependymin-related protein 1 (MERP-1);Dystonin (Bullous pemphigoid antigen 1) (BPA) (Dystonia musculorum protein) (Hemidesmosomal plaque protein) (Microtubule actin cross-linking factor 2);Plastin-3 (T-plastin);Fibulin-2 (FIBL-2);Neurogenic locus Notch protein [Cleaved into: Processed neurogenic locus Notch protein];Mucin-like protein;Matrilin-4 (MAT-4);Matrilin-3;Synaptotagmin-10 (Synaptotagmin X) (SytX);Matrilin-2;Fibrillin-3 [Cleaved into: Fibrillin-3 C-terminal peptide];Uromodulin (Tamm-Horsfall urinary glycoprotein) (THP) [Cleaved into: Uromodulin, secreted form];Mannan-binding lectin serine protease 1 (EC 3.4.21.-) (Complement factor MASP-3) (Complement-activating component of Ra-reactive factor) (Mannose-binding lectin-associated serine protease 1) (MASP-1) (Mannose-binding protein-associated serine protease) (Ra-reactive factor serine protease p100) (RaRF) (Serine protease 5) [Cleaved into: Mannan-binding lectin serine protease 1 heavy chain; Mannan-binding lectin serine protease 1 light chain];Transmembrane prolyl 4-hydroxylase (P4H-TM) (EC 1.14.11.29) (Hypoxia-inducible factor prolyl hydroxylase 4) (HIF-PH4) (HIF-prolyl hydroxylase 4) (HPH-4);Epidermal growth factor receptor substrate 15-like 1 (Eps15-related protein) (Eps15R);Protein kinase C-binding protein NELL1 (NEL-like protein 1);Testican-2 (SPARC/osteonectin, CWCV, and Kazal-like domains proteoglycan 2);Protein jagged-1 (Jagged1) (hJ1) (CD antigen CD339);Hemicentin-1 (Fibulin-6) (FIBL-6);Protein jagged-1 (Jagged1) (CD antigen CD339);Hemicentin-1 (Fibulin-6) (FIBL-6);Low-density lipoprotein receptor-related protein 4 (LRP-4) (Multiple epidermal growth factor-like domains 7);Low-density lipoprotein receptor-related protein 4 (LRP-4) (Multiple epidermal growth factor-like domains 7);Allograft inflammatory factor 1 (AIF-1) (Ionized calcium-binding adapter molecule 1) (Protein G1);Neurogenic locus Notch protein [Cleaved into: Processed neurogenic locus Notch protein];Matrilin-2;Fibrillin-1 (MP340) [Cleaved into: Asprosin];Hemicentin-1 (Fibulin-6) (FIBL-6);Agrin [Cleaved into: Agrin N-terminal 110 kDa subunit; Agrin C-terminal 110 kDa subunit; Agrin C-terminal 90 kDa fragment (C90); Agrin C-terminal 22 kDa fragment (C22)];Protocadherin Fat 4 (FAT tumor suppressor homolog 4) (Fat-like cadherin protein FAT-J);Signal peptide, CUB and EGF-like domain-containing protein 3;Hemicentin-2;Cadherin-related tumor suppressor (Protein fat) [Cleaved into: Ft-mito];Microtubule-actin cross-linking factor 1, isoforms 6/7 (Uncharacterized protein KIAA0754);Aggrecan core protein (Cartilage-specific proteoglycan core protein) (CSPCP);Tyrosine kinase receptor Cad96Ca (EC 2.7.10.1) (Cadherin-96Ca) (Tyrosine kinase receptor HD-14);Collagenase 3 (EC 3.4.24.-) (Matrix metalloproteinase-13) (MMP-13);Hemicentin-2"
"4"	6.38	"GO:0005507"	"copper ion binding"	"Binding to a copper (Cu) ion."	"10% (5/50)"	0.3151645	0.5	NA	NA	"16% (8/50)"	0.0004090389	3.39	"Pocillopora_acuta_HIv2___RNAseq.g13784.t1;Pocillopora_acuta_HIv2___RNAseq.g21518.t1;Pocillopora_acuta_HIv2___RNAseq.g2165.t1;Pocillopora_acuta_HIv2___RNAseq.g22559.t1;Pocillopora_acuta_HIv2___RNAseq.g27566.t1;Pocillopora_acuta_HIv2___RNAseq.g30215.t1;Pocillopora_acuta_HIv2___RNAseq.g4785.t1;Pocillopora_acuta_HIv2___RNAseq.g4791.t1"	"Tyrosinase (EC 1.14.18.1) (Monophenol monooxygenase);Diamine oxidase [copper-containing] (Diamine oxidase) (EC 1.4.3.22) (Amine oxidase copper domain-containing protein 1) (Histaminase);DBH-like monooxygenase protein 1 (EC 1.14.17.-) (DBH-related protein) (Monooxygenase X);Coagulation factor V (Activated protein C cofactor) [Cleaved into: Coagulation factor V heavy chain; Coagulation factor V light chain];Hephaestin-like protein (EC 1.-.-.-);Coagulation factor V (Activated protein C cofactor) [Cleaved into: Coagulation factor V heavy chain; Coagulation factor V light chain];Coagulation factor VIII (Procoagulant component);Coagulation factor VIII (Procoagulant component)"
"5"	6.75	"GO:0005125"	"cytokine activity"	"The activity of a soluble extracellular gene product that interacts with a receptor to effect a change in the activity of the receptor to control the survival, growth, differentiation and effector function of tissues and cells."	"8.571% (3/35)"	0.4895643	0.31	NA	NA	"25.714% (9/35)"	3.166251e-06	5.5	"Pocillopora_acuta_HIv2___RNAseq.7335_t;Pocillopora_acuta_HIv2___RNAseq.g12378.t1;Pocillopora_acuta_HIv2___RNAseq.g13857.t1;Pocillopora_acuta_HIv2___RNAseq.g20144.t1;Pocillopora_acuta_HIv2___RNAseq.g27038.t1;Pocillopora_acuta_HIv2___RNAseq.g27039.t1;Pocillopora_acuta_HIv2___RNAseq.g27047.t1;Pocillopora_acuta_HIv2___TS.g18100.t1;Pocillopora_acuta_HIv2___TS.g18104.t1"	"Nodal homolog (Nodal-related protein 1) (Xnr-1) (Xnr1) (nr-1);Metalloproteinase inhibitor 1 (Tissue inhibitor of metalloproteinases 1) (TIMP-1);Bone morphogenetic protein 2 (BMP-2);Growth/differentiation factor 6 (GDF-6) (Bone morphogenetic protein 13) (BMP-13) (Growth/differentiation factor 16);Protein Wnt-7a;Protein Wnt-8b;Protein Wnt-8a;Protein Wnt-8b;Protein Wnt-8b"
"5"	5.73	"GO:0048018"	"receptor ligand activity"	"The activity of a gene product that interacts with a receptor to effect a change in the activity of the receptor. Ligands may be produced by the same cell that expresses the receptor. Ligands may also be expressed at the plasma membrane of an adjacent cell (e.g. Notch ligands) or be secreted and diffuse extracellularly from their point of origin to the receiving cell (e.g. interleukins)."	"7.792% (6/77)"	0.5163192	0.29	NA	NA	"19.481% (15/77)"	0.009461934	2.02	"Pocillopora_acuta_HIv2___RNAseq.7335_t;Pocillopora_acuta_HIv2___RNAseq.g12378.t1;Pocillopora_acuta_HIv2___RNAseq.g13857.t1;Pocillopora_acuta_HIv2___RNAseq.g14769.t1;Pocillopora_acuta_HIv2___RNAseq.g15290.t1;Pocillopora_acuta_HIv2___RNAseq.g20144.t1;Pocillopora_acuta_HIv2___RNAseq.g27038.t1;Pocillopora_acuta_HIv2___RNAseq.g27039.t1;Pocillopora_acuta_HIv2___RNAseq.g27047.t1;Pocillopora_acuta_HIv2___RNAseq.g5342.t1;Pocillopora_acuta_HIv2___RNAseq.g7895.t1;Pocillopora_acuta_HIv2___TS.g1462.t1;Pocillopora_acuta_HIv2___TS.g18100.t1;Pocillopora_acuta_HIv2___TS.g18104.t1;Pocillopora_acuta_HIv2___TS.g18622.t1b"	"Nodal homolog (Nodal-related protein 1) (Xnr-1) (Xnr1) (nr-1);Metalloproteinase inhibitor 1 (Tissue inhibitor of metalloproteinases 1) (TIMP-1);Bone morphogenetic protein 2 (BMP-2);Fibrillin-2 [Cleaved into: Placensin];Prothrombin (EC 3.4.21.5) (Coagulation factor II) [Cleaved into: Activation peptide fragment 1; Activation peptide fragment 2; Thrombin light chain; Thrombin heavy chain];Growth/differentiation factor 6 (GDF-6) (Bone morphogenetic protein 13) (BMP-13) (Growth/differentiation factor 16);Protein Wnt-7a;Protein Wnt-8b;Protein Wnt-8a;Protein jagged-1 (Jagged1) (hJ1) (CD antigen CD339);Protein jagged-1 (Jagged1) (CD antigen CD339);Fibrillin-1 (MP340) [Cleaved into: Asprosin];Protein Wnt-8b;Protein Wnt-8b;Agrin [Cleaved into: Agrin N-terminal 110 kDa subunit; Agrin C-terminal 110 kDa subunit; Agrin C-terminal 90 kDa fragment (C90); Agrin C-terminal 22 kDa fragment (C22)]"
"5"	6.91	"GO:0008083"	"growth factor activity"	"The function that stimulates a cell to grow or proliferate. Most growth factors have other actions besides the induction of cell growth or proliferation."	"6.667% (2/30)"	0.6657267	0.18	NA	NA	"20% (6/30)"	0.0006412634	3.19	"Pocillopora_acuta_HIv2___RNAseq.7335_t;Pocillopora_acuta_HIv2___RNAseq.g12378.t1;Pocillopora_acuta_HIv2___RNAseq.g13857.t1;Pocillopora_acuta_HIv2___RNAseq.g15290.t1;Pocillopora_acuta_HIv2___RNAseq.g20144.t1;Pocillopora_acuta_HIv2___RNAseq.g5342.t1"	"Nodal homolog (Nodal-related protein 1) (Xnr-1) (Xnr1) (nr-1);Metalloproteinase inhibitor 1 (Tissue inhibitor of metalloproteinases 1) (TIMP-1);Bone morphogenetic protein 2 (BMP-2);Prothrombin (EC 3.4.21.5) (Coagulation factor II) [Cleaved into: Activation peptide fragment 1; Activation peptide fragment 2; Thrombin light chain; Thrombin heavy chain];Growth/differentiation factor 6 (GDF-6) (Bone morphogenetic protein 13) (BMP-13) (Growth/differentiation factor 16);Protein jagged-1 (Jagged1) (hJ1) (CD antigen CD339)"
"6"	8.01	"GO:0045545"	"syndecan binding"	"Binding to syndecan, an integral membrane proteoglycan (250-300 kDa) associated largely with epithelial cells."	"10% (1/10)"	0.5390927	0.27	NA	NA	"30% (3/10)"	0.004787253	2.32	"Pocillopora_acuta_HIv2___RNAseq.g21477.t1;Pocillopora_acuta_HIv2___RNAseq.g21479.t1;Pocillopora_acuta_HIv2___RNAseq.g21481.t1"	"Tenascin (TN) (Cytotactin) (GMEM) (GP 150-225) (Glioma-associated-extracellular matrix antigen) (Hexabrachion) (JI) (Myotendinous antigen) (Neuronectin) (Tenascin-C) (TN-C);Tenascin (TN) (Cytotactin) (GMEM) (GP 150-225) (Glioma-associated-extracellular matrix antigen) (Hexabrachion) (JI) (Myotendinous antigen) (Neuronectin) (Tenascin-C) (TN-C);Tenascin (TN) (Cytotactin) (GMEM) (GP 150-225) (Glioma-associated-extracellular matrix antigen) (Hexabrachion) (JI) (Myotendinous antigen) (Neuronectin) (Tenascin-C) (TN-C)"
"6"	6.84	"GO:0043394"	"proteoglycan binding"	"Binding to a proteoglycan, any glycoprotein in which the carbohydrate units are glycosaminoglycans."	"3.571% (1/28)"	0.8859375	0.05	NA	NA	"25% (7/28)"	0.00346233	2.46	"Pocillopora_acuta_HIv2___RNAseq.g12258.t1;Pocillopora_acuta_HIv2___RNAseq.g12281.t1;Pocillopora_acuta_HIv2___RNAseq.g21477.t1;Pocillopora_acuta_HIv2___RNAseq.g21479.t1;Pocillopora_acuta_HIv2___RNAseq.g21481.t1;Pocillopora_acuta_HIv2___RNAseq.g26979.t1;Pocillopora_acuta_HIv2___TS.g18622.t1b"	"Receptor-type tyrosine-protein phosphatase S (R-PTP-S) (EC 3.1.3.48) (Chick receptor tyrosine phosphatase alpha) (CRYP alpha) (CRYPalpha);Receptor-type tyrosine-protein phosphatase F (EC 3.1.3.48) (Leukocyte common antigen related) (LAR);Tenascin (TN) (Cytotactin) (GMEM) (GP 150-225) (Glioma-associated-extracellular matrix antigen) (Hexabrachion) (JI) (Myotendinous antigen) (Neuronectin) (Tenascin-C) (TN-C);Tenascin (TN) (Cytotactin) (GMEM) (GP 150-225) (Glioma-associated-extracellular matrix antigen) (Hexabrachion) (JI) (Myotendinous antigen) (Neuronectin) (Tenascin-C) (TN-C);Tenascin (TN) (Cytotactin) (GMEM) (GP 150-225) (Glioma-associated-extracellular matrix antigen) (Hexabrachion) (JI) (Myotendinous antigen) (Neuronectin) (Tenascin-C) (TN-C);Cathepsin B (EC 3.4.22.1) (Cathepsin B1) [Cleaved into: Cathepsin B light chain; Cathepsin B heavy chain];Agrin [Cleaved into: Agrin N-terminal 110 kDa subunit; Agrin C-terminal 110 kDa subunit; Agrin C-terminal 90 kDa fragment (C90); Agrin C-terminal 22 kDa fragment (C22)]"
